0,IdiuU,"  Yesterday, 10:12 PM, updated 4h ago",New Member,Group: Junior Member,Posts: 24,Joined: Apr 2017,,"as of 31 dec 2016, net loss of 89 5642 ringgit, expecti unable to recover in short period of time... so wan TUTUP KEDAIhttp://www.sinchew.com.my/node/1658497-A+AKUALA LUMPUR (July 3): Penang-based food and beverage firm Texchem Resources Bhd announced that Dim Sum Delight Sdn Bhd, the operator of two Michelin-star Tim Ho Wan restaurants in Malaysia, has ceased business operations due to challenging future prospects. Texchem owns 51% in Dim Sum Delight, while the remaining 49% reportedly belongs to a Malaysian company owned by Angel Chong and Kelvin Khoo.For the financial year ended Dec 31, 2016 (FY2016), Dim Sum Delight incurred a loss of RM895,642, and “is not expected to turn around in the near future"", Texchem said in a Bursa Malaysia filing today.""Given that the current retail market remains soft and competitive, the board of Dim Sum Delight is of the view that the prospects of Dim Sum Delight is very challenging and this situation is not expected to change anytime soon.""Accordingly, the shareholders of Dim Sum Delight are of the opinion that Dim Sum Delight should cease its business operation to minimise losses,"" Texchem added.Texchem, which also operates Sushi King and Goku Raku Ramen restaurants, said that at this time, it is unable to ascertain the extent of the closure costs associated with the cessation of its restaurant business. “Texchem will provide updates on this matter in due course,” it said, adding that its board of directors, having considered all aspects, is of the opinion that the cessation is Texchem’s best interest. There are two Tim Ho Wan restaurants in Malaysia: one in Mid Valley Megamall, and another at 1Utama Shopping Mall. Separately, Texchem also said its 94.87%-owned subsidiary Ocean Pioneer Food Sdn Bhd has signed two pacts — a sales and purchase agreement, and a machinery purchase agreement — with SHT Marine Frozen Sdn Bhd to sell a piece of leasehold land and related equipment in Setiawan, Perak, for RM2.65 million. Texchem said the sale will unlock the value of the assets, and is part of its strategy to strengthen its financial position. Shares in Main Market-listed Texchem rose one sen or 0.71% to close at RM1.42 today, giving it a market capitalisation of RM176.22 million."
1,Baconateer,"  Yesterday, 10:14 PM",Meh..... (TM),Group: Senior Member,"Posts: 1,976",Joined: Jun 2013,From: Blue Planet,a.k.a overpriced dim sum..
2,ListenToTheAngin,"  Yesterday, 10:14 PM",New Member,Group: Junior Member,Posts: 22,Joined: Jun 2015,,"890,000 become 89 million.."
3,kidmad,"  Yesterday, 10:15 PM",Look at all my stars!!,Group: Senior Member,"Posts: 3,391",Joined: Jul 2005,,like that also tak aPA!!.. in Malaysia no sweet sauce...  no kampong koh... prepare sau pei la this dim sum shop.. went there once and never again.
4,smallcrab,"  Yesterday, 10:15 PM",Getting Started,Group: Junior Member,Posts: 82,Joined: Jul 2007,From: Puchong,kenot beweekend people queue up one Mad Valley branch
5,IdiuU,"  Yesterday, 10:15 PM",New Member,Group: Junior Member,Posts: 24,Joined: Apr 2017,,i write wrong? hahaha
6,Baconateer,"  Yesterday, 10:16 PM",Meh..... (TM),Group: Senior Member,"Posts: 1,976",Joined: Jun 2013,From: Blue Planet,no wonder hv to kolos..
7,Magna Carta,"  Yesterday, 10:17 PM",New Member,Group: New Member,Posts: 0,Joined: May 2017,,and nothing of value was lost that day.
8,EdBaaBaa,"  Yesterday, 10:18 PM",Getting Started,Group: Junior Member,Posts: 67,Joined: Jan 2013,,hahay they dunno how to tim ho wan?
9,kidmad,"  Yesterday, 10:18 PM",Look at all my stars!!,Group: Senior Member,"Posts: 3,391",Joined: Jul 2005,,i think they just need this 2 winning ingredient.. straight profit margin up up up.
10,Hollow21,"  Yesterday, 10:19 PM",Casual,Group: Junior Member,Posts: 484,Joined: Jul 2011,,MV one queue damn long
11,panz3l,"  Yesterday, 10:19 PM",Getting Started,Group: Junior Member,Posts: 113,Joined: Nov 2008,,"went once and serious midvalley branch tasted very bad, not comparable with hk 1 at all"
12,patienceGNR,"  Yesterday, 10:21 PM",? Ride All Day ?,Group: Senior Member,"Posts: 1,566",Joined: Mar 2011,From: Autofreaks.NET Poking The Bikes,dem... wan tan already la this time
13,ironmaid89,"  Yesterday, 10:21 PM",New Member,Group: New Member,Posts: 0,Joined: Aug 2012,,Michelin Star Dim Sum
14,pagi makan roti,"  Yesterday, 10:22 PM",Getting Started,Group: Junior Member,Posts: 64,Joined: Jun 2016,,Ktards say financial reports don't matter. They see so popular won't tutup kedaiBtw tim ho wan in Indonesia is muslim friendly. No halal status but no pork no lard variety alongside the original ones.  They even use different set of utensils for that. Right beemay
15,ar188,"  Yesterday, 10:22 PM",Look at all my stars!!,Group: Senior Member,"Posts: 8,094",Joined: Jun 2006,,got one time i go macam not much ppl..half full only.
16,arthurlwf,"  Yesterday, 10:23 PM",Look at all my stars!!,Group: Senior Member,"Posts: 2,469",Joined: Jan 2003,,"From google review score, its stated 3.7 out of 5, and further michelin 1 star.Does this mean michelin food are really lousy? Or perhaps high price food with so so quality for rich ppl??? I really wonder....."
17,ar188,"  Yesterday, 10:24 PM",Look at all my stars!!,Group: Senior Member,"Posts: 8,094",Joined: Jun 2006,,"yes for example, popular no 3 car in malaysia, every year lose 1bil also wont tutup, betul ma...  toyoi"
18,dewill,"  Yesterday, 10:24 PM",Regular,Group: Senior Member,"Posts: 1,479",Joined: Feb 2006,,malaysian enjoy nasi lemak only
19,everest,"  Yesterday, 10:25 PM",Getting Started,Group: Junior Member,Posts: 61,Joined: Sep 2007,,Bad economy
0,cocomaru,"  Today, 12:30 AM, updated 37m ago",Getting Started,Group: Junior Member,Posts: 80,Joined: Apr 2011,,"Guys I wanna ask has anyone ever been recruited for internship in Public Bank, they want students with minimum CGPA 3.0, how high is the probability of a student that is gonna be recruited if he only has a minimum of 2.5"
1,daddygrandson,"  Today, 12:32 AM",New Member,Group: New Member,Posts: 2,Joined: Jun 2017,,0. Min requirement is 3.0 unless he is sinkalan can sinka his way in
2,herojack41,"  Today, 12:32 AM",Master Of Trouble Maker,Group: Senior Member,"Posts: 5,396",Joined: Nov 2007,From: A Place Where God And Master Of TroubleMaker Exist,2.5 is like rubbish of all timego become intern as janitor
3,cocomaru,"  Today, 01:25 AM",Getting Started,Group: Junior Member,Posts: 80,Joined: Apr 2011,,
4,L_nette,"  Today, 01:35 AM",New Member,Group: Junior Member,Posts: 36,Joined: Nov 2013,,0%. Fyi big banks have hundreds of application for internship. Usually they wont even take people with 3.0 because so many 3.5 and higher already applied.
5,cocomaru,"  Today, 01:36 AM",Getting Started,Group: Junior Member,Posts: 80,Joined: Apr 2011,,my teacher just texted me and told me i should go for it since they would see your communication skills and presentation skills even though i have bad CGPA?
6,ZuloPhobia,"  Today, 01:40 AM",Getting Started,Group: Junior Member,Posts: 53,Joined: May 2011,,"you can try, but like other forumner said there will slot others 3.0 above that would also appliedHigh CGPA != Poor Communication SkillLow CGPA != Great Communication Skill"
7,Baconateer,"  Today, 01:42 AM",Meh..... (TM),Group: Senior Member,"Posts: 1,976",Joined: Jun 2013,From: Blue Planet,just send ur application la.. no harm in trying..
8,1malaysiajib,"  Today, 02:01 AM",New Member,Group: Junior Member,Posts: 28,Joined: Jan 2017,,"when i was back in UNI, i had tons of friends with CGPA below 3.00 that was admitted into PUBLIC BANK for their internship simply because PBB was looking for people."
9,tropicanagolf,"  Today, 02:04 AM",New Member,Group: Junior Member,Posts: 12,Joined: May 2011,,Isn't public bank a lousy chinaman bank
10,cocomaru,"  Today, 03:38 AM",Getting Started,Group: Junior Member,Posts: 80,Joined: Apr 2011,,"Still considering. I have another interview with Public Mutual, but its for people who can push sales, I am an introvert and shy, and I don't think I will do good in sales so that is why I wanna go for Public Bank, but min CGPA is 3.0, now my hopes are lost"
0,Win10,"  Yesterday, 08:47 PM, updated 40m ago",New Member,Group: Junior Member,Posts: 16,Joined: Nov 2016,,"Selamat Malam Cikgu Harfa!’ jerit Langit, ketua kelas TB15. Ketua kelas yang beraltitud melebihi paras pandangan mata Cikgu Harfa sendiri. Cikgu Harfa meneliti keseluruhan kelas. Hanya terdapat 5 orang sahaja yang datang malam itu. Tiga berkromosom XX, dua berkromosom XY, salah seorangnya ialah Langit.Cikgu Harfa masuk kelas malam ini untuk mengajar pelajar tentang sistem respirasi manusia.Studen, malam ini kita akan membincangkan tentang perihal sistem respirasi manusia. Jadi siapa boleh beritahu apa organ respirasi manusia?’Senyap. Bunyi anjing menyalak di luar, semua persetan.Tiada siapa yang tahu?’ tanya CIkgu Harfa.Sepi. Bunyi kucing menderam nak bercat-fight, semua persetan.Dilihatnya Langit sedang ber-texting. Seorang budak perempuan India bernama Vijaya sedang ber-camwhoring. Seorang perempuan Jawa, namanya Soci, sedang men-doodle notakaki pada buku Biologinya. Budak Cina obes bernama Bo Chan sedang tidur (pada waktu yang tidak sepatutnya) dan seorang budak gagap sedang engrossed dengan PSP, bermain Metal Gear Solid.Cikgu Harfa hanya mengeluh.Mereka memerlukan sedikit ‘dorongan’ untuk memahami Biologi. Harap rancangan aku untuk malam ini mampu memberi efek dalam hidup mereka. Mampu menjadi turning point supaya mereka boleh faham Biologi.’ getus Cikgu Harfa.Cikgu Harfa meneruskan syarahnya, tanpa seorang pun yang membayar perhatian.Tiba-tiba, Vijaya terbatuk-batuk dengan kuat.Dengan sangat teruk.Kenapa dengan kamu Vijaya? Kamu asma ke? Bronchodilator ada dalam posesi saya. Kamu mahu pinjam?’ tanya Cikgu Harfa.Tak apa, cikgu. Batuk biasa saja.’Baiklah. Seperti cikgu kata tadi, respirasi manusia sangat kompleks dan sangat delicate. Satu interupsi dalam ekuilibrium mampu menyebabkan kematian. Mari cikgu beri satu contoh. Vijaya, mari ke depan.’ panggil Cikgu Harfa.Vijaya terpiat-piat seketika sebelum bangun dengan ragu-ragu, menuju ke depan kelas. Semua pelajar tertanya-tanya akan ‘contoh’ yang dikatakan Cikgu Harfa.Baiklah. Vijaya, silakan duduk. Orait studen, seperti yang anda dapat lihat, Vijaya merupakan seorang manusia, dan terdapat satu sistem respirasi yang sedang berfungsi dengan baik di dalam dadanya.’ Cikgu Harfa melurutkan kedua-dua tangannya ke bahu dan dada Vijaya.Secara maniac-nya Cikgu Harfa tiba-tiba memegang leher Vijaya dan mencekiknya. Matanya terbeliak seperti pelacur yang sedang senggugut.Vijaya meronta-ronta tanpa suara. Peti vokalnya sempit di-asfiksiasi jari jemari Cikgu Harfa.Satu kelas termangu dan terpinga. Kemudian, serangan panik melanda semua. Soci meraung seperti banshee naik syeikh. Bo Chan mencarut-carut dalam dialek Hakka sambil tangannya mendail sesuatu. Polis atau bomba atau ambulans agaknya. Budak gagap pula melompat-lompat setempat sambil tergagap untuk menyebut ‘Cikgu Harfa dah gila’, mukanya merah menyala. Langit mencari sesuatu untuk dibaling pada Cikgu Harfa.Cikgu Harfa sekarang sudah sawan babi. Mulutnya berbuih-buih dengan liur putih, dan kuku jarinya yang merah panjang mula menusuk ke dalam daging leher Vijaya. Darah mula membuak keluar dari mulut Vijaya macam orang kena sula. Vijaya semakin lemas, matanya sudah jadi putih permata.Langit sepantas kilat grab PSP budak gagap lalu membalingnya ke arah Cikgu Harfa. Dia jatuh, ditarik graviti lalu tersembam ke lantai. Sawan babinya semakin akut, badannya kekejangan seperti katak yang direnjat elektrik dalam eksperimen bodoh Volta.Vijaya jatuh juga, ditarik graviti lalu tersembam ke lantai. Darah mengalir keluar dari lehernya seperti darah lembu yang disembelih waktu Hari Raya Korban Pelajar yang lain hanya mampu terpaku macam Statue of Liberty."
1,Win10,"  Yesterday, 08:50 PM",New Member,Group: Junior Member,Posts: 16,Joined: Nov 2016,,Sebab kenapa aku benci generasi pembaca karya so-called indie
2,daddygrandson,"  Yesterday, 08:50 PM",New Member,Group: New Member,Posts: 2,Joined: Jun 2017,,Apa haram jaadah nie babi
3,revious,"  Yesterday, 08:54 PM",New Member,Group: New Member,Posts: 1,Joined: Jun 2013,From: Borneo Sabah Country Of The Great Wind,What the fuck I just read?! I don't understand.
4,Win10,"  Yesterday, 09:20 PM",New Member,Group: Junior Member,Posts: 16,Joined: Nov 2016,,Trust me.. I don't tooThough we know what he/ she meant figuratively
5,jamilselamat,"  Yesterday, 09:34 PM",Getting Started,Group: Junior Member,Posts: 84,Joined: Jul 2011,,Did someone literally write this as a serious work of literature?Feels annoyingly like a hipster kid trying to tell a story. I'm all for modern interpretations but this... this is a really bad writing style. Reminds me of the infamous 'My Immortal' fan fic.
6,Nebelung Valesti,"  Yesterday, 09:49 PM",Getting Started,Group: Junior Member,Posts: 62,Joined: Aug 2008,From: KayTee,woah.
7,olman,"  Yesterday, 10:00 PM",Pukimon,Group: Senior Member,"Posts: 1,839",Joined: Jan 2003,From: PukiDex 150: SlowMon,literasi ejakulasi
8,SerioseCat,"  Yesterday, 10:02 PM",Getting Started,Group: Junior Member,Posts: 290,Joined: May 2008,,">Literasi Ojakulasiwatch out folks, we have the next Malique over here"
9,riezzien,"  Yesterday, 10:07 PM",New Member,Group: Junior Member,Posts: 24,Joined: Jan 2009,,mana part cikgu harfa mengeluh kesedapannye? stupis ts donno write dont write la ccbmch
10,Win10,"  Yesterday, 10:09 PM",New Member,Group: Junior Member,Posts: 16,Joined: Nov 2016,,"Back then, there's only few of publisher with indie line commemorating such writing. Thukul Cetak, Dubook, Fixi, Lejen Press. Tpi skang, banyak sgt publisher indie smpai wujud isu lambakan penulis dondang-sampah niMostly tema pulp-fiction dan urban kontemporari, dorg bleh dpat 20~40 manuskrip tiap bulan dari penulis tempatan? Welp, still salah DBP kot. https://www.roketkini.com/2015/10/20/sisi-g...die-yang-kasar/"
11,jamilselamat,"  Yesterday, 10:19 PM",Getting Started,Group: Junior Member,Posts: 84,Joined: Jul 2011,,"If there's demand, people will keep making it, I suppose.I dislike this nu-age, supposedly 'contemporary' writing. It feels like the writers are more concerned with making themselves look hip and cool rather than the audience comprehending what the hell the story is about. This is reminiscent of the days of trashy Malay novels in the 90s, who are more concerned with using obscure Malay words in their writing to make themselves feel poetic and shit. Maybe they keep doing it because they dont have a good story to tell.I come from the generation of latecomers to the works of Tamar Jalis and Tok Awang Ngah with their more direct approach to storytelling though, so I may be biased. The only other non horror novel that I remember enjoying reading is 'Tulang Tulang Berserakan' by Usman Awang'."
12,zakuankajang,"  Today, 01:18 AM",New Member,Group: New Member,Posts: 0,Joined: May 2017,"From: Kepala Batas, Penang",ejakulasi
13,joe_star,"  Today, 01:43 AM",Serving the Servants,Group: Senior Member,"Posts: 1,457",Joined: Mar 2007,,Cikgu suraya >> cikgu harfa
14,hakim1994,"  Today, 02:00 AM",Getting Started,Group: Junior Member,Posts: 78,Joined: Nov 2011,From: belakang lu bro,Dont care about the essay. Drillz 200% approved ??
15,mambangafro,"  Today, 02:58 AM",ME IS KUDA PING :3,Group: Senior Member,Posts: 617,Joined: Aug 2010,,apa lancau ni
16,ah_suknat,"  Today, 03:04 AM",whoooooooooooooop,Group: Senior Member,"Posts: 4,296",Joined: Jul 2006,"From: /k//k/, /k/undasang",Need the girl in the picta's instaPlease
17,Win10,"  Today, 03:35 AM",New Member,Group: Junior Member,Posts: 16,Joined: Nov 2016,,Google out Cikgu Aishah.. Her IG acc are easily obtainable iircPernah viral sebab dapat surat cinta dri abah pelajar
0,soowky,"  Yesterday, 02:27 PM, updated 13h ago",New Member,Group: Junior Member,Posts: 10,Joined: Jul 2009,From: /kay/,RD2_gVJJ-IM
1,zakuankajang,"  Yesterday, 02:32 PM",New Member,Group: New Member,Posts: 0,Joined: May 2017,"From: Kepala Batas, Penang",apa salahan kami?
2,vga_cable,"  Yesterday, 02:38 PM",New Member,Group: New Member,Posts: 0,Joined: Feb 2017,,"saya sokong behind keyboard,am not as tough as them."
3,siaoand1,"  Yesterday, 02:41 PM",Getting Started,Group: Junior Member,Posts: 164,Joined: Oct 2010,,rempits butthurt ppl komprain sikal bising XDsampah masyarakat cause trouble only
4,Mustadio,"  Yesterday, 02:42 PM",New Member,Group: Junior Member,Posts: 9,Joined: Dec 2008,,"RIP motorcycle, kesian motorcycle tidak bersalah menjadi mangsautube comment topkek"
5,mattsynyster,"  Yesterday, 02:42 PM",Getting Started,Group: Junior Member,Posts: 60,Joined: Feb 2013,"From: Ono Nonoko,",All Gay
6,nebula87,"  Yesterday, 02:43 PM",Getting Started,Group: Junior Member,Posts: 133,Joined: Nov 2013,,padan muka!!
7,HongKi,"  Yesterday, 02:44 PM",Getting Started,Group: Junior Member,Posts: 107,Joined: Nov 2013,,Nak lawan tu lawan je la.Nape buli motor tu?Kesian motor no life.
8,sunami,"  Yesterday, 02:45 PM",Getting Started,Group: Junior Member,Posts: 211,Joined: Jul 2006,,what's the story?
9,OldSchoolJoke,"  Yesterday, 02:48 PM",Getting Started,Group: Junior Member,Posts: 196,Joined: Mar 2010,,ok..im blur..siapa bising? M or I?inb4...salah orang tapi motor yang kena...transformers gonna rage
10,techfreakguy,"  Yesterday, 02:48 PM",New Member,Group: Junior Member,Posts: 16,Joined: May 2016,,Hahahaha..pandan muka..bodoh bising bebal..bunyi cam taik laju tak ke mana pun..
11,iGamer,"  Yesterday, 02:49 PM",Casual,Group: Junior Member,Posts: 369,Joined: Feb 2016,From: BanhammerLand,Noisy modified bike............. better rempit die fast fast.........
12,FourZeroFour,"  Yesterday, 02:50 PM",Getting Started,Group: Junior Member,Posts: 162,Joined: Apr 2008,,"Dekat rumah aku dulu selalu jugak bising bebudak revving moto rempit diorang. Tapi lepas ada jiran dalam neighbouhood aku start pakai harley davidson, dah senyap terus dah moto diorang sampai la sekarang"
13,nintendo86,"  Yesterday, 02:52 PM",New Member,Group: Junior Member,Posts: 4,Joined: Sep 2015,,cbr 600 rr repsol color scheme.. what a beauty..
14,Mr_47,"  Yesterday, 03:16 PM","***NOT MODERATOR *** Post : +10,000,000,00 Warn: 100%",Group: Senior Member,"Posts: 4,123",Joined: Jan 2003,From: Bora-bora u jelly? Special: Age of multi-monitor,if not superbike then godai parang style
15,komag,"  Yesterday, 03:19 PM",Getting Started,Group: Junior Member,Posts: 288,Joined: Mar 2005,,
16,ctrl_alt_del,"  Yesterday, 03:21 PM",On my way,Group: Senior Member,Posts: 578,Joined: Jan 2005,,No need so much trouble...just tie some invisible string to trap moto...
17,Zuchie,"  Yesterday, 10:48 PM",New Member,Group: New Member,Posts: 0,Joined: May 2017,,Please la give us the truth story.. only moron people always make like this.
18,syahmie8,"  Yesterday, 11:01 PM",New Member,Group: Junior Member,Posts: 4,Joined: Apr 2013,,So. Melayu gaduh sama melayu la ni.. Bodoh.
19,silent_stalker,"  Yesterday, 11:01 PM",Enthusiast,Group: Senior Member,Posts: 820,Joined: Apr 2012,,Based on the report im guessing a group of rempit convoy to wedding. And u know la when they are in large group sure preng preng. Twist the throttle just to make noise.I sokong the parang people
0,ah_suknat,"  Today, 02:52 AM, updated 1h ago",whoooooooooooooop,Group: Senior Member,"Posts: 4,296",Joined: Jul 2006,"From: /k//k/, /k/undasang",
1,GibeDeMuny,"  Today, 03:21 AM",New Member,Group: Junior Member,Posts: 12,Joined: Nov 2016,,>download pending
