5,B1ue_Flare,"  Jun 17 2017, 11:50 PM",New Member,Group: New Member,Posts: 0,Joined: Jul 2016,,"Doesn't matter, had sex"
6,Jag23sys,"  Jun 18 2017, 12:08 AM",New Member,Group: Junior Member,Posts: 5,Joined: Aug 2016,,Still SG will be far stronger
7,huaweie5830,"  Jun 18 2017, 12:16 AM",Enthusiast,Group: Senior Member,Posts: 906,Joined: Jan 2013,,Lol all truth is all sgrean r laughing tooHeard a uncle say “????? ?????“thought he teaching Chinese to a youngsterThen he say I refering to the lee family I loled
8,Bill888,"  Jun 18 2017, 12:40 AM",New Member,Group: New Member,Posts: 0,Joined: Jun 2015,,"He is book smart but not street smart, that's why."
9,jeffwkh,"  Jun 18 2017, 08:10 AM",Getting Started,Group: Junior Member,Posts: 93,Joined: Mar 2010,,he is good just continue become PM everyone have family problem that normal
10,petang makan maggi,"  Jun 18 2017, 08:12 AM",New Member,Group: Junior Member,Posts: 31,Joined: Mar 2017,,you_dont_chibai.jpg
11,desmond2020,"  Jun 18 2017, 08:22 AM",Getting Started,Group: Junior Member,Posts: 280,Joined: Jun 2005,,If someone can't control his wifeI guess he also need to step down as pm.
12,andyng38,"  Jun 18 2017, 08:28 AM",Getting Started,Group: Junior Member,Posts: 271,Joined: Jun 2007,,"Very hard to laff @ PM LeeHe can say my one is your three,what happened to your 1MDB,and Proton need help from Geely"
13,tmkul,"  Jun 18 2017, 08:31 AM",New Member,Group: Junior Member,Posts: 18,Joined: Jul 2007,,ya..malaysia menang spore lagicompare him to    najib  .. own wife can not manage .. still want to be internatinal leader ..and cultivated a group of guardian of   corruptions ... lee hsien loong has a lot more to learn ...
14,hjffgjng,"  Jun 18 2017, 08:33 AM",Getting Started,Group: Junior Member,Posts: 62,Joined: May 2017,,tsmana tetek tered???u not hamsap anymore??ayam rely could use some picta now
15,advocado,"  Jun 18 2017, 08:33 AM",Look at all my stars!!,Group: Senior Member,"Posts: 2,075",Joined: Jun 2007,,"every successful man has a woman behind.be ut mamathir, lee kuan yew, ir mo1.even lee chong wei if not his wife would finish his money very fast."
16,old_and_slow,"  Jun 18 2017, 08:35 AM",Regular,Group: Senior Member,"Posts: 1,529",Joined: Jun 2010,From: Malaysia,"small issue... demolish house only, come malaysia la"
17,eksk,"  Jun 18 2017, 08:37 AM",Casual,Group: Junior Member,Posts: 380,Joined: Oct 2004,,betul tu.. cuba contohi bang Jib. alpha male.. NajibRazakkickball.jpg
18,Ikruga,"  Jun 18 2017, 08:45 AM",Getting Started,Group: Junior Member,Posts: 126,Joined: Jan 2009,,"Brilliant, now someone needs to storm into an UMNO General Assembly and recite this poem, Only to see from yonder,A man came running, only known as Mat Over,Coming to punch the poor guy right in the kisser."
19,andyng38,"  Jun 18 2017, 08:49 AM",Getting Started,Group: Junior Member,Posts: 271,Joined: Jun 2007,,"Such violence we cannot condoneBe it punch, slap or VLC coneNo recitation needed, they know it alreadyThat's why the race/religion card is always handy."
0,pagi makan roti,"  Yesterday, 12:24 PM, updated 3h ago",Getting Started,Group: Junior Member,Posts: 64,Joined: Jun 2016,,"Some of them very very not polite.Calling ppl bad names, making fun of ppl physical appearance, speaking bad english, not mastering official language.Ish. Apa nak jadi."
1,SKY233,"  Yesterday, 12:25 PM",u x sukak u keluar,Group: Senior Member,Posts: 630,Joined: Jul 2008,From: :hehe:,ok
2,10996455,"  Yesterday, 12:25 PM",On my way,Group: Senior Member,Posts: 516,Joined: Apr 2014,,Cos PPL like u exist make k very bad
3,johnsdoes,"  Yesterday, 12:25 PM",Getting Started,Group: Junior Member,Posts: 131,Joined: Nov 2014,,sebab mereka pagi2 tak makan roti
4,pagi makan roti,"  Yesterday, 12:26 PM",Getting Started,Group: Junior Member,Posts: 64,Joined: Jun 2016,,I polite
5,0168257061,"  Yesterday, 12:27 PM",10k Club,Group: Senior Member,"Posts: 14,183",Joined: Jul 2007,From: Tongshan,siapa bukak tered siapa butthurt
6,revolver,"  Yesterday, 12:27 PM",New Member,Group: Junior Member,Posts: 9,Joined: Sep 2007,,engrand master race
7,ISawYou,"  Yesterday, 12:28 PM",Getting Started,Group: Junior Member,Posts: 261,Joined: Oct 2011,"From: Tawau -> Menumbok, Sabah(Land Below The Wind)",so you think you are good enough to judge others la. oh really?
8,petirbuas,"  Yesterday, 12:28 PM",(??????),Group: Senior Member,Posts: 718,Joined: Dec 2009,From: The Internet,"mu dok suke, mu kluor la bodo!"
9,Lancewood,"  Yesterday, 12:28 PM",Getting Started,Group: Junior Member,Posts: 57,Joined: Feb 2015,,
10,hightechgadgets8,"  Yesterday, 12:28 PM",R?t Vui ???c làm quen v?i b?n,Group: Senior Member,"Posts: 2,628",Joined: Sep 2011,From: HCMC,fixed
11,quartre88,"  Yesterday, 12:29 PM",Getting Started,Group: Junior Member,Posts: 90,Joined: Feb 2007,From: Bukit Padang Mental Hospital,u mesti sehati sejiwa dengan bingding hehehe
12,thelws,"  Yesterday, 12:32 PM",Getting Started,Group: Junior Member,Posts: 217,Joined: Jan 2005,,Pick one response:OkSiapa buka tered dia...Ts bodoInsapla
13,Matrix,"  Yesterday, 12:33 PM",King of Char Siew!,Group: Senior Member,"Posts: 14,946",Joined: Jan 2003,From: Damansara Jaya/Bandar Utama,Diamlah bodoh banggang vavi.Tak suka you go 14th Floor.
14,MeToo,"  Yesterday, 12:38 PM",Look at all my stars!!,Group: Senior Member,"Posts: 5,930",Joined: May 2009,,99% immature keyboard warrior ma...What u expect wor....
15,Ubat Kuat,"  Yesterday, 12:39 PM",New Member,Group: New Member,Posts: 0,Joined: Jun 2017,,32 is the keyword to this thread
16,hurricane21,"  Yesterday, 12:44 PM",Senior Newbie,Group: Senior Member,"Posts: 1,114",Joined: Feb 2006,From: Melaka,
17,lorrydriverrocks,"  Yesterday, 12:44 PM",Getting Started,Group: Junior Member,Posts: 185,Joined: May 2014,,K Tards became like this because of uIf Mod ban u then we become normal back
18,pagi makan roti,"  Yesterday, 12:45 PM",Getting Started,Group: Junior Member,Posts: 64,Joined: Jun 2016,,Are u got miss overest
19,lorrydriverrocks,"  Yesterday, 12:47 PM",Getting Started,Group: Junior Member,Posts: 185,Joined: May 2014,,I dun miss k tards
0,ekoh,"  Today, 12:47 AM, updated 3h ago",New Member,Group: Junior Member,Posts: 30,Joined: Feb 2009,,"'The plane started shuddering': Another AirAsia flight turned back to Australia Another AirAsia X flight has been turned back after take-off from Australia, with passengers reporting hearing bangs and seeing sparks coming from an engine before the plane landed again safely.Flight D7207 took from the Gold Coast bound for Malaysia at 10.50pm on Monday night.One passenger, Tim Joga, told Fairfax Media that plane began vibrating just a few minutes after take-off. ""The plane started shuddering then there were a couple of loud bangs and a lot of light,"" he said.Mr Joga, 31, was sitting on the right hand side and said he heard about ""four or five bangs"" coming from the direction of the right-side engine, before he reported seeing flames coming from the engine.""I could see an orange light coming from the windows,"" he said. The plane landed at Brisbane Airport a short time later where the Airbus A330-343 was being examined, according to witness photographs supplied to Fairfax Media. Newlyweds Malissa Siaea? and her husband were on-board heading for Thailand for their honeymoon. ""It started making funny noises when we were getting ready for take-off,"" she told Fairfax Media.""About 20-minutes into the our flight fire sparked out of the right-side engine.""""Then the plane swooped a little bit and started shaking badly.""She said not many passengers even realised there was a problem until a man yelled out ""What the heck is happening?""Mr Jago said passengers remained calm and unlike a recent Air Asia X flight where the pilot urged passengers to pray as the flight experienced trouble, a traveller instead urged a celestial plea. ""Someone said the engine's on fire and we should pray but mostly everyone remained calm and everyone clapped when the plane landed safely,"" he said. Asked if the incident would deter him from flying with budget airlines in the future, Mr Jago, who paid less than $600 for a one-way ticket from New Zealand to India via Australia and Malaysia, said it would not. ""I'm not fussed about living or dying,"" he said and described the mid-air encounter as ""exciting.""Just last week Air Asia X launched an investigation into what caused the mid-air safety scare on flight D7237 on June 25, when passengers reported engine failure. The flight, also bound for Kuala Lumpur, was turned back to Perth.  The company said it complied with all safety standards set by the countries it operates in, including Australia. The investigation, being conducted in conjunction with engine manufacturer Rolls-Royce, is expected to take months."
1,RicoT,"  Today, 12:56 AM",Getting Started,Group: Junior Member,Posts: 75,Joined: Feb 2009,,"Air Asia Xciting, or Air Asia Xtreme"
2,JohnLai,"  Today, 12:59 AM",Skeptical Cat,Group: Senior Member,"Posts: 1,119",Joined: Apr 2006,,"Asked if the incident would deter him from flying with budget airlines in the future, Mr Jago, who paid less than $600 for a one-way ticket from New Zealand to India via Australia and Malaysia, said it would not. ""I'm not fussed about living or dying,"" he said and described the mid-air encounter as ""exciting."""
3,cicak.fakir,"  Today, 01:02 AM",Getting Started,Group: Junior Member,Posts: 240,Joined: May 2016,,slowthough commendable than the other click-bait titlehttps://forum.lowyat.net/topic/4346982
4,nearlee,"  Today, 01:04 AM",Getting Started,Group: Junior Member,Posts: 103,Joined: May 2009,From: iNearly,Chucuk lambat
5,red streak,"  Today, 01:08 AM",Doto 2 Pinoy Slayer,Group: Senior Member,Posts: 968,Joined: Feb 2006,,Rolls-Royce engine again. Agenda Yahudi untuk menjatuhkan maruah AirAsia detected
0,syafiqTWIN,"  Jul 2 2017, 10:27 PM, updated 2d ago",New Member,Group: New Member,Posts: 0,Joined: Jul 2017,,"https://www.facebook.com/ahmad.muchlis/post...155133129732558     Daripada beli Vios 1.5 2017 diharga RM80k low spec, lebih baik beli BMW 3 series E90 LCI MSPORT 2010 di harga RM75k on the road~ Dari segi teknologi, BMW masih jauh ke hadapan. Teknologi push button tu, tahun 2004 lagi dah ada. Perdana sampai hari ini masih start pakai kunci. Cuba pandu Vios dikelajuan 180km/j. Mesti isteri kat sebelah mengomel, ""jangan bawa laju laju bang"" Bunyi angin bukan main kuat. Seram. Kalau lalu line kanan di highway, kereta belakang mesti tembak lampu tinggi. Tak pun, kena sondol. Sebab kereta anda tidak cukup performance. Kan dah tak boleh kejar masa. Pasrah. Handling goyang. Kena badan terlalu letih, mata mengantuk. Nak cari R&R, jauh lagi. Silap hari bulan, terbabas. Sistem keselamatan tidak mendukung sebab mampu beli low spec saja - Risiko kematian tinggi sekali. Semua ini tak terjadi pada kereta buatan jerman itu. High spec. Kelajuan 200km/j, masih boleh lepas dua tangan untuk check allignment lagi. Tidur anak insyaallah tak terganggu. Tapi bukan bermakna pandu laju itu bagus. Hanya buat perbandingan dari aspek performance dan keselamatan.Kalau tiba-tiba terlanggar lubang atau obstacles yang ganggu handling, dia ada sistem utk luruskan balik kenderaan. Bagi yang ada jiwa sport, kalau berselisih dengan vellfire, nissan GTR, camry, hilux turbo, honda civic, volkswagen itu boleh bagi salam perkenalan lah. ? Besok nak jual kembali, harga vios BARU jatuh 50%. Kalau ini, paling 10 - 20% sahaja. Lantaran ia sudah melepasi susut nilai tahun pertama. Artis yang pakai BMW model E90 ini setahu saya, Wak doyok. Orang fesyen.Tapi kereta dah make up habis. Bagi saya, tiada originaliti. Tahun masih dibawah."
1,AyamBlend,"  Jul 2 2017, 10:32 PM",New Member,Group: Junior Member,Posts: 6,Joined: Nov 2011,,Pakai perdana because I love pm I love Malaysia.
2,leeweichun,"  Jul 2 2017, 10:38 PM",New Member,Group: Junior Member,Posts: 15,Joined: Feb 2014,,"After 1 year of service and repairs, then compare your bank account balance again."
3,syncnsky,"  Jul 2 2017, 10:44 PM",New Member,Group: Junior Member,Posts: 11,Joined: Nov 2004,,Masuk workshop. Keluar kedai hutang bank beribu-ribu...
4,unwanted guy,"  Jul 2 2017, 10:46 PM",New Member,Group: Junior Member,Posts: 6,Joined: May 2017,,Memang bodo
5,Smoochy poohh,"  Jul 2 2017, 10:47 PM",New Member,Group: New Member,Posts: 0,Joined: Aug 2016,From: Raub  Seremban,"Baru-baru ini muncul iklan dari seorang individu yang berkata membeli sebuah BMW 3-Series E90 adalah jauh lebih berbaloi dari membeli sebuah Toyota Vios.Menurut iklan beliau, dari membelis ebuah Toyota Vios, adalah lebih baik membeli sebuah BMW 320i E90 kerana Vios adalah sebuah kenderaan yang tidak begitu sempurna berbanding dengan BMW (memang sebuah Vios tidak patut dibandingkan dengan sebuah BMW, baik di bumi atau di planet-planet lain),  dan adalah lebih bijak untuk membeli sebuah BMW 3-Series terpakai.Mungkin beliau sedikit ""over"" di dalam iklan tersebut kerana ada banyak faktor yang tidak dikongsi - contohnya harga insurans, harga alat ganti, jumlah penyurutan nilai dan juga fakta di mana ia memerlukan seorang pemilik yang rajin untuk melayan sebuah kenderaan Jerman terpakai.Rakan Careta dari Page Auto Stylista di Facebook, Kamarul Ariffin Nor Sadan nampaknya berfikiran sama seperti kami dan beiau tampil menasihatkan orang ramai agar jangan mudah terpedaya.Kamarul sebenarnya memang memiliki sebuah BMw 3-Series E90 dan kerana itu, pengalaman beliau memang boleh diterima-pakai.Teruskan membaca komentar Kamarul yang dimuat-naik di dalam laman Facebook beliau. kamarul BMWKamarul dan BMW E90 beliau.  Sebagai pemilik BMW E90, aku sarankan agar kau orang tak terperdaya dengan penjual seperti ini.Aku beli E90 LCI tahun keluaran 2010 pada tahun 2012 di BMW Premium Selections— kira secondhand tapi melalui Auto Bavaria.Masa ambil, odometer baru 8,000km. Ada warranti lagi setahun. Lima tahun aku guna kereta ni aku boleh kata kereta ini bagus.Aku berpuashati dengannya, cuma pemilikan kereta ini tak seindah gambaran yang dihebahkan. Beberapa perkara kau kena tahu: 1. Harga: ?RM80,000 hutang vs RM75,000 tunai. Bukan mudah kumpul wang tunai sebanyak RM75,000. Kalau kau ada wang tunai sebanyak itu, elok kau guna duit itu untuk beli kereta terpakai yang masih boleh buat pinjaman bank dan bayar harga muka tinggi, selebihnya kau laburkan. 2. Waranti: ?BMW terpakai tahun 2010 mestilah dah luput waranti. Kereta baru ada warranty sehingga 5 tahun. Jika kewangan baru nak stabil, jangan peningkan kepala pakai kereta tiada warranty. Kecuali kau beli kereta terpakai yang kos selenggara rendah. Semestinya bukan BMW E90. 3. Alat ganti: ?Sparepart reconditioned boleh dapat murah, tapi kena rajin cari sendiri. Kalau kereta dah rosak, nak kena cari lagi sparepart sendiri, memang niaya. Sparepart Taiwan pun murah, tapi apa guna beli kereta kualiti Jerman tapi semua pakai parts Taiwan yang tak authorised. Baik beli kereta tempatan tapi alat ganti asli. Bergaya jangan sampai poket papa kedana. itu kurang bijak. 4. Tayar: ?Sesetengah spec E90 tiada tayar spare. Ia pakai tayar run flat— bermaksud kalau pancit boleh jalan beberapa puluh kilometer lagi dengan kelajuan terhad. Harga sebuah tayar run flat untuk size untuk E90 ni mececah RM1,200 sebiji. Aku tukar kepada tayar biasa, sebab tak mampu. Kalau pancit, terpaksa panggil tow truck. Lagi satu, saiz tayar pun tak begitu mudah di cari.BMW E90 side 5. Penjimatan bahan api: ?E90 320i mempunyai enjin 2.0L. Kecermatan minyaknya tak akan sama dengan enjin 1.5L. Mesti 2.0L lebih tinggi sedikit. Lagi-lagi kalau suka bawa macam pelesit, seperti yang dianjurkan dalam pos penjual. Jangan nanti dah beli E90, merungut setiap minggu sebab harga minyak naik. Dan bila pandu macam pelesit, komponen akan perlu ditukar dengan lebih kerap! 6. Lain-lain: ?- Ada ciri lampu tutup sendiri jika lupa matikan lampu selepas enjin dimatikan, namun namanya bukan LED Angel Eye Technology.?- Kesenyapan kabin (NVH) E90, terutamanya jika spesifikasi dengan rim 18"" dan tayar run flat, tidaklah begitu hebat. Kalau versi M-sport, NVH lebih teruk kerana springnya keras. Dan Vios baharu sudah mempunyai lebih banyak alatan canggih seperti keyless entry, push start button dan lain-lain. Paling penting, Vios ini ""reliable"" dan menjimatkan minyak! Kesimpulan:Hati-hati dengan janji manis penjual. Dia cerita yang indah-indah sahaja. Tak usah percaya semua yang dia kata.Maaf jika saya kata, jika budget kau mampu beli Vios baharu RM80,000 secara pinjaman bank, maka anda belum mampu beli BMW E90 terpakai pada harga RM75,000 secara tunai. Oh ya! Cuba teka harga brake pad ori E90 berapa? Eh jangan kata boleh pakai brake tak ori pula.Credit : Careta http://careta.my/article/pemilik-bmw-e90-j...i-bmw-dari-vios"
6,pisces88,"  Jul 2 2017, 10:48 PM",Look at all my stars!!,Group: Senior Member,"Posts: 2,390",Joined: Nov 2007,,very true lol
7,rcracer,"  Jul 2 2017, 10:53 PM",?????,Group: Senior Member,"Posts: 3,437",Joined: Jan 2003,,"De regulated tariff , insurance 6-7 k a year, quietly sell off cannot afford,"
8,boonwuilow,"  Jul 2 2017, 10:54 PM",Diesel rocks,Group: Senior Member,"Posts: 3,657",Joined: Oct 2009,"From: Cheras, Selangor","For those individual who are wiser than other, would buy a 320d (which is the turbo diesel variant) that would do over 1000km per tank of diesel. While in the same time more fun to drive than the petrol version because got more low end torque."
9,MR_alien,"  Jul 2 2017, 10:55 PM",Mr.Alien on the loss,Group: Senior Member,"Posts: 2,013",Joined: Oct 2007,From: everywhere in sabah,hes like /k/tardwhy buy myvi when u can topup and buy use kancil turbo
10,urnicksux2,"  Jul 2 2017, 10:55 PM",New Member,Group: Junior Member,Posts: 31,Joined: Jul 2013,,ok i go order 5 now
11,ar188,"  Jul 2 2017, 10:55 PM",Look at all my stars!!,Group: Senior Member,"Posts: 8,094",Joined: Jun 2006,,lol
12,ar188,"  Jul 2 2017, 10:57 PM",Look at all my stars!!,Group: Senior Member,"Posts: 8,094",Joined: Jun 2006,,"nah, torque is useless if you dont have the power to go with it.will still prefer turbo/sc petrol engine vs your td diesel."
13,memekfalui,"  Jul 2 2017, 10:58 PM",Getting Started,Group: Junior Member,Posts: 242,Joined: Oct 2004,,Baik merungut banyak poker kosongDaripada jadi aruah dalam vios kosong
14,vin_ann,"  Jul 2 2017, 10:59 PM",Look at all my stars!!,Group: Senior Member,"Posts: 9,841",Joined: Feb 2006,,
15,zoozooka,"  Jul 2 2017, 11:01 PM",Getting Started,Group: Junior Member,Posts: 221,Joined: Jun 2012,,Prefer virgin ViOS
16,lol~,"  Jul 2 2017, 11:01 PM",Getting Started,Group: Junior Member,Posts: 219,Joined: Jun 2009,,"Few my fb friends (incl cousins) share this post hintting they wanna buy 1. Im done giving 2cent to them coz they will never hear me out. In malaysia, most ppl wont gonna hear other ppl opinion unless:1 u are reputable person2 u give an opinion which not favourable to what they desireIn the end, keep quite are better option. No wonder lots of ppl keep on getting scam coz they only see the good side"
17,vin_ann,"  Jul 2 2017, 11:02 PM",Look at all my stars!!,Group: Senior Member,"Posts: 9,841",Joined: Feb 2006,,Are 320d reliable? Friend share that his friend get second hand 320d pre-facelift ard RM80k .... Get own mechanic outside to service is way cheaper But the parts cost might cost a bomb when fails right ?
18,Lancewood,"  Jul 2 2017, 11:02 PM",Getting Started,Group: Junior Member,Posts: 57,Joined: Feb 2015,,mau beli bmw tapi takut roadtax tinggi takut makan minyak.......haih.....bagus beli mawi bah.
19,Lancewood,"  Jul 2 2017, 11:04 PM",Getting Started,Group: Junior Member,Posts: 57,Joined: Feb 2015,,you know the sound of that diesel compare to the 3 liter straight 6?Heck even the 4 potter on the F10 528i sounded bad.
0,playstan211,"  Yesterday, 11:34 PM, updated 3h ago",Getting Started,Group: Junior Member,Posts: 277,Joined: Jan 2013,,specs as below. AMD Ryzen 5 1600Giga AB350 Gaming 3Kingston HyperX 16GB @ 2667MHzGiga Aorus Xtreme GTX1080 8GSamsung 850 Evo 500GBToshiba HDD 3TBSeasonic X Gold 750WPhanteks P400 Tempered GlassPrice: S$2600+
1,ar188,"  Yesterday, 11:35 PM",Look at all my stars!!,Group: Senior Member,"Posts: 8,094",Joined: Jun 2006,,how muchie the 1080 gpu?
2,lawliet88,"  Yesterday, 11:35 PM",Getting Started,Group: Junior Member,Posts: 216,Joined: May 2010,From: Cheras For PPL to Live 1,1080 but ur monitor spec?
3,cj7,"  Yesterday, 11:36 PM",Casual,Group: Junior Member,Posts: 356,Joined: Mar 2008,,usd. wow.
4,koopa,"  Yesterday, 11:37 PM",Casual,Group: Junior Member,Posts: 498,Joined: Mar 2005,From: Bowser Koopa Castle,Hopefully comes with 200Hz monitor.
5,playstan211,"  Yesterday, 11:40 PM",Getting Started,Group: Junior Member,Posts: 277,Joined: Jan 2013,,936Dell S2318Hjust a normal monitor. planning to upgrade to a better one.
6,Zgames,"  Yesterday, 11:42 PM",- I am a very weird lizard -,Group: Senior Member,"Posts: 1,436",Joined: Apr 2013,From: Raub ( Studying weeeeeeeeeeeeee ),Now time to sub humble monthly or bai humble bundle and in no time 100+ game.
7,ar188,"  Yesterday, 11:44 PM",Look at all my stars!!,Group: Senior Member,"Posts: 8,094",Joined: Jun 2006,,what currency is this?
8,GibeDeMuny,"  Yesterday, 11:45 PM",New Member,Group: Junior Member,Posts: 12,Joined: Nov 2016,,inb4 pirate still
9,playstan211,"  Yesterday, 11:47 PM",Getting Started,Group: Junior Member,Posts: 277,Joined: Jan 2013,,SGD
10,marfccy,"  Yesterday, 11:50 PM",Le Ponyland!!!,Group: Senior Member,"Posts: 3,801",Joined: Nov 2011,,untungla new rig
11,PeinEVO,"  Yesterday, 11:51 PM",Getting Started,Group: Junior Member,Posts: 259,Joined: Jun 2013,,abis la u ..nnti jdi mcm i..skit2 mahu try upgrade hahaha
12,aloy5415,"  Yesterday, 11:54 PM",Getting Started,Group: Junior Member,Posts: 266,Joined: Jan 2009,From: Where Is Nowhere,nasib baik i tak. sebab i poor.
13,zerorating,"  Yesterday, 11:56 PM",Sampah Masyarakat,Group: Senior Member,Posts: 572,Joined: Aug 2007,From: Lokap Polis,"not completed, get this also:» Click to show Spoiler - click again to hide... «"
14,adren1,"  Yesterday, 11:58 PM",New Member,Group: Junior Member,Posts: 49,Joined: Nov 2008,From: P.J,If here the same spec can get how much in RM?
15,PeinEVO,"  Today, 12:25 AM",Getting Started,Group: Junior Member,Posts: 259,Joined: Jun 2013,,i pon not that well off.. still a fresh graduate with no income of my own.. still trying to fund my upgrade through selling my unused item per my signature     but still need more funding
16,daddygrandson,"  Today, 12:27 AM",New Member,Group: New Member,Posts: 2,Joined: Jun 2017,,If convert to myr is ard 8k. Mahal.Mayb in sgd is cheap
17,JohnLai,"  Today, 12:36 AM",Skeptical Cat,Group: Senior Member,"Posts: 1,119",Joined: Apr 2006,,"Wah...so rich, how about donating some of previous gear to me."
18,ihatemynahs,"  Today, 12:44 AM",New Member,Group: Junior Member,Posts: 24,Joined: Dec 2010,"From: Kota Tinggi, Johor",enjoice
19,@zan65,"  Today, 12:49 AM",New Member,Group: Junior Member,Posts: 12,Joined: Dec 2016,From: Penang - Skudai,welcome comrade!
