Topic title: Pakatan MPs  Dispose Investments in 1MDB,"Topic posted on: 22 Feb 2017, 22:01:00",Topic link: https://forum.lowyat.net/topic/4204443,"Topic scraped on: 02 Aug 2017, 03:26:05",
username,date,avatar_title,group,post_count,join_date,from,text
PappyBoyington,20170222,Getting Started,Group: Junior Member,Posts: 142,201606,,"http://www.malaysiakini.com/news/373422Pakatan Harapan leaders today urged the Employees Provident Fund (EPF) to dispose its investments in 1MDB as soon as possible.In a joint statement signed by Parti Amanah Negara’s Dzulkefly Ahmad, PKR’s Wong Chen and DAP’s Teresa Kok, the opposition coalition claimed that the decrease in EPF’s 2016 dividend rate was due to EPF’s investment amounting to RM1.72 billion in 1MDB.Apart from the EPF, Pakatan Harapan also urged government institutions such as Tabung Haji and Retirement Fund Inc (KWAP) to dispose their investments in state investment fund.The EPF, they said, was facing financial problems which would in turn affect EPF depositors.“EPF’s investment of RM1.72 billion is a huge amount, more so since the funds are from the people’s savings,” they said.Citing Finance Minister II Johari Abdul Ghani who said that EPF’s investment in 1MDB did not pose any risks, the trio however argued that 1MDB bonds held by EPF involved higher interest rates than bonds from government institutions at 9.85 percent.“1MDB’s financial problem has become a financial risk not only to the company but to the Federal Treasury especially since 1MDB faces the risk of cross default that can seriously affect the country’s financial system.""Supporting the Malaysian Trades Union Congress’ (MTUC) call for the 2016 EPF dividend rate to be increased, they said the announcement of a 5.7 percent dividend rate compared to 2015’s 6.4 percent rate was far from the government’s aim to have its citizens to have more savings.The EPF last week declared a dividend rate of 5.7 percent for 2016 with the total payout amounting to RM37.08 billion.Prime Minister Najib Abdul Razak said the 5.7 percent dividend rate announced by the EPF for 2016 was good enough given the challenging conditions in the global economy last year.MTUC however urged that the EPF declare a 6.4 percent dividend rate for 2016, the similar rate announced in 2015."
hafiez,20170222,Look at all my stars!!,Group: Senior Member,"Posts: 2,757",200701,From: Huntington Beach,LOL.1.75bil penyebab dividend turun to 5.7%.
big[1],20170222,On my way,Group: Senior Member,Posts: 588,201506,,the payout amount required for one (1) per cent dividend in 2016 was RM6.51 billion
ikankering,20170222,New Member,Group: Newbie,Posts: 3,201701,,cukur.i dont have money in epf.
Toyoi,20170223,New Member,Group: Junior Member,Posts: 7,201302,From: ToyoiLand,Is EPF part of 1mdb as well?9 May 2015https://forum.lowyat.net/topic/3573517Cash-rich pension funds invest RM3 billion in 1MDB19 May 2015https://forum.lowyat.net/topic/3583036Now Finance Ministry says EPF’s investment in 1MDB ‘slightly risky’ 26 May 2015https://forum.lowyat.net/topic/3589655Abdul Ghani: EPF’s Investments In 1MDB’s Power Plants Safe21 Oct 2015https://forum.lowyat.net/topic/3751208CEO Shahril: EPF RM219.3 Billion Loans Taken By Govt Agencies Are Well Serviced21 Feb 2017https://forum.lowyat.net/topic/4202276
Toyoi,20170223,New Member,Group: Junior Member,Posts: 7,201302,From: ToyoiLand,"EPF not in the business of bailing out companies, says CEOThe Star 13 Apr 2015 SoS...“If you actually look at the track record of EPF, we do not bail out people or companies,”"
