Topic title: Tanda pilihan raya dah dekat  Hehehehe    ,"Topic posted on: 25 May 2017, 10:02:00",Topic link: https://forum.lowyat.net/topic/4300009,"Topic scraped on: 02 Aug 2017, 03:07:29",
username,date,avatar_title,group,post_count,join_date,from,text
darthboyzzee,20170525,New Member,Group: Junior Member,Posts: 42,201502,,"» Click to show Spoiler - click again to hide... «""Bangla"" tu memang orang malaysia. Bapak dia dah lama kerja kat Malaysia kahwin orang sini."
will4848,20170525,UNKNOWN,Group: Senior Member,Posts: 594,201009,From: DONT KNOW,and this is the all time winner ....
nazq,20170525,doom merchant,Group: Senior Member,"Posts: 1,164",201006,,"AFAIK they're briefing the schools now for possible pusat mengundi, and also election officials as wellmaybe after SEA games?"
SKY233,20170525,u x sukak u keluar,Group: Senior Member,Posts: 643,200807,From: :hehe:,win
Subang Nuclear Reactor,20170525,Getting Started,Group: Junior Member,Posts: 65,201512,"From: Melbourne, Darwin, Guangzhou","If they cannot launch the voting before I back to Australia in JulyThen sorry Malaysians, I can't help you all with my puny 1 vote"
St0rmFury,20170525,Getting Started,Group: Super Senior,Posts: 175,200705,From: KL,That guy is high out of his mind lol
silent_stalker,20170525,Enthusiast,Group: Senior Member,Posts: 820,201204,,"Degrading the election process is normal politics used by those that think they will lose or lost. Even trump did it during his campaign ( although he won  ), n obama did the same when the candidate he vouch for lost."
Cloudx,20170525,(?°?°??? ???,Group: Senior Member,"Posts: 1,483",200410,From: Island where you get pearl,"Any problem? His face didn't look bangla pun, some of my indian friends has brownish complexion like them, c'mon don't jump into conclusion and cause havoc."
Jag23sys,20170525,New Member,Group: Junior Member,Posts: 5,201608,,This one dont look like Bangladeshi
