username,time,avatar_title,group,post_count,join_date,from,text
BaoFatAuto,"  Jun 10 2016, 11:23 AM, updated 7 months ago",New Member,Group: New Member,Posts: 0,Joined: Jul 2015,From: Subang Jaya,"Hi guys, not sure if any of you have heard of ezbuy Malaysia or formerly known as 65Daigou Malaysia. They claim themselves as 'the only flat rate Taobao forwarder in Malaysia' and today I will show you guys how these crooks trying to slash my throat. I am trying my very best to stay calm as I am typing these, but I really beh tahan with their shitty service and how good they are in giving empty promises. I have been using 65daigou for more than six months and spent alot of money on their services. I will usually opt for their 'Buy-For-me' service, in which I will provide them the Taobao link and pay for the item in MYR (although they do earn from the RMB-MYR exchange rate so its ok I close one eye) and they will help me purchase the item. When I am about to check out the item for the delivery to Malaysia stage, this is what they charge me:For three pair of shoes only, how is it possible for it to weight 8.87KG? ARE THESE SHOES MADE OF STEEL?!!   And because it weighs 8.87KG, the delivery fee is automatically RM99.74. And this amount is delivery of the shoes, not including the cost price of the shoe. So ok lo, I screen shot this and personally inquire ezbuy Malaysia thinking maybe got error. Because for Buy-for-Me service, once item reach their warehouse, they will repack the items to save delivery cost. It is also promised on their website and policy. Then after I consult them, this was their reply:Ya ok I admit I was very pissed when replying them because I really cannot tahan with their shit service. As you guys can see, there are two similar pair of shoes I order, but how come only one pair weigh 7KG but another weigh less than 1KG? Make sense no? It's so obvious that there are errors somewhere but these guys can blatantly give this kind of unprofessional reply.I am so tired of their shit rude feedbacks and snail service. For all the money they spent on advertising and brand rebranding, they should have spend it better on increasing their services and efficiency. There were also couple of times which my parcel arrive much later than the promised ETA. And for those who are wondering why didn't I confront them on their Facebook page or other social media platform instead, this is because ezbuy Malaysia does not allow postings on their Facebook page. I am here just to express my frustration and alerting current and potential ezbuy users. So disappointed with their services. After all my parcels have arrived, I will never ever use their shit service again."
sunami,"  Jun 10 2016, 11:29 AM",Getting Started,Group: Junior Member,Posts: 211,Joined: Jul 2006,,hmmm...the screen shot is pretty small..can barely see the wording...appreciate if you can resize it?
chengsiong80,"  Jun 10 2016, 11:30 AM",Getting Started,Group: Junior Member,Posts: 175,Joined: May 2007,,"I never use ezbuy or 65daigou, normally I use taobao forwarder or wiwaa.For wiwaa, sometime the weight of the item can be very big due to the size of the packaging. But 1 good thing about wiwaa is u can opt for sea shipment if the weight of the item is very heavy. That will save a lot of $$, but it will take longer time to deliver to u."
b3arbear,"  Jun 10 2016, 11:34 AM",Getting Started,Group: Junior Member,Posts: 105,Joined: Aug 2010,,you should open an account and buy it yourself. I been doing that for months. kinda transparent and you can monitor it 24/7.I used to buy from few sellers and forward to Shenzhen warehouse. then only resend to Malaysia in one parcel. eta whole process take up to 2 weeks.
BaoFatAuto,"  Jun 10 2016, 11:37 AM",New Member,Group: New Member,Posts: 0,Joined: Jul 2015,From: Subang Jaya,"Sorry bro, just fixed the resolution"
BaoFatAuto,"  Jun 10 2016, 11:38 AM",New Member,Group: New Member,Posts: 0,Joined: Jul 2015,From: Subang Jaya,Taobao forwarder is it direct ship from taobao website itself? I am not very familiar with Chinese characters that's why abit susah
BaoFatAuto,"  Jun 10 2016, 11:40 AM",New Member,Group: New Member,Posts: 0,Joined: Jul 2015,From: Subang Jaya,"The Shenzhen warehouse address don't need Taobao forwarder or middle-person? Sorry bro, just asking cuz I not so familiar"
b3arbear,"  Jun 10 2016, 11:49 AM",Getting Started,Group: Junior Member,Posts: 105,Joined: Aug 2010,,"still need but you do everything on your own. whereby you deal directly with Taobao or 3rd party courier service provider.let say you buying item A from seller A. you pay once to taobao, taobao will hold the money until you have rec'd the item or upon the given notice period.then item A will send out by seller to your designated warehouse (got 4 choices, differences are the couriers' services and their price)when reach warehouse, they will repack and weigh again if you buying few items. then they will quote you the postage from warehouse to your doorstep. very transparent as you can see the weight of each item from your account."
dvinez,"  Jun 10 2016, 12:19 PM",Limited Edition,Group: Senior Member,"Posts: 1,448",Joined: Dec 2006,From: Paradise,"refering to their reply, ur item kena volumetric weightmaybe u seldom use postage"
damonlbs,"  Jun 10 2016, 01:21 PM",Casual,Group: Junior Member,Posts: 371,Joined: May 2005,From: KL,your shoe box must be very bighttp://www.online-calculators.co.uk/volumetric/weight.php
joe_mamak,"  Jun 10 2016, 01:26 PM",Casual,Group: Junior Member,Posts: 333,Joined: Dec 2006,,They mentioned volumetric weight.
BaoFatAuto,"  Jun 10 2016, 03:26 PM",New Member,Group: New Member,Posts: 0,Joined: Jul 2015,From: Subang Jaya,"Noted, but for ezbuy Buy-For-Me policy is that for every orders that reached their warehouse, they will repack the item means if the parcel came in a bigger box, they will open it and place it in a smaller box, fitting the item nicely"
csneo,"  Jun 10 2016, 03:31 PM",Casual,Group: Junior Member,Posts: 324,Joined: May 2005,,maybe ts can ask them to repack to small size of box
e_mc_square,"  Jun 10 2016, 03:43 PM",Casual,Group: Junior Member,Posts: 369,Joined: Dec 2008,,"I tried to calculate volumetric weight for TS.But you need a very big shoe box to have 8KG volumetric weight.Volumemetric Weight = (Height * Length * Width) / 6000           (measured by cm)If the box is a cube, you will need a 36cm * 36cm * 36cm box man..."
ycs,"  Jun 10 2016, 04:22 PM",MEMBER,Group: Senior Member,"Posts: 2,435",Joined: Jan 2003,From: Selangor,"thats why i use the Prime service, flat RM8.80 per checkout, no matter what size"
dvinez,"  Jun 10 2016, 04:41 PM",Limited Edition,Group: Senior Member,"Posts: 1,448",Joined: Dec 2006,From: Paradise,"not sure how ezbuy work, but if without repackingeach shoe box + seller packing + warehouse packing it is possible to get 8KG volumetric weight, shoe box dimension alone is pretty big without packinggoogled standard size for reference"
e_mc_square,"  Jun 10 2016, 04:47 PM",Casual,Group: Junior Member,Posts: 369,Joined: Dec 2008,,30 * 18 * 30 / 6000 = 1.17kg only lah...How to get 8kg in 3 pair of shoes?
dvinez,"  Jun 10 2016, 04:52 PM",Limited Edition,Group: Senior Member,"Posts: 1,448",Joined: Dec 2006,From: Paradise,"havent include packing by seller/repack warehouse? when 3 packed together it will get bigger dimensionwe never know how they will pack it, maybe can ask total dimension from ezbuy and lodge complaint   i order thing about 6 shoe box size from my agent, kena about 7kg only though"
dvinez,"  Jun 10 2016, 04:54 PM",Limited Edition,Group: Senior Member,"Posts: 1,448",Joined: Dec 2006,From: Paradise,"can try this calculator, just by stacking up alone without consider external packing it is about 10KGhttp://www.dhl.com/en/tools/volumetric_weight_express.html"
dvinez,"  Jun 10 2016, 05:01 PM",Limited Edition,Group: Senior Member,"Posts: 1,448",Joined: Dec 2006,From: Paradise,maybe can just ask them remove the box not sure if they will charge to repack again
e_mc_square,"  Jun 10 2016, 05:47 PM",Casual,Group: Junior Member,Posts: 369,Joined: Dec 2008,,"No matter how you stack, at the end, the volumetric is 4.5kg by the calculator you provide.May I know how you stack? Please enlighten me."
e_mc_square,"  Jun 10 2016, 05:48 PM",Casual,Group: Junior Member,Posts: 369,Joined: Dec 2008,,6  pairs 7kg is normal I guess.
BaoFatAuto,"  Jun 10 2016, 06:55 PM",New Member,Group: New Member,Posts: 0,Joined: Jul 2015,From: Subang Jaya,"Hi guys thanks all for the concern. Just to update, ezbuy Malaysia has already gotten back to me and they admit it was their fault. The parcel has changed from 7kg to 0.53kg wtf.. I already attached their reply here, not sure is it viewable or not. Btw, thanks all for sharing ??"
alucard89,"  Jun 10 2016, 06:58 PM",Look at all my stars!!,Group: Senior Member,"Posts: 2,228",Joined: Apr 2006,,"Oh wow, that's a lotBtw, how do you get those estimated shipping fee with buyforme?I only get message that shipping fee and agent fee will be calculated once item sent to warehouse"
BaoFatAuto,"  Jun 10 2016, 07:06 PM",New Member,Group: New Member,Posts: 0,Joined: Jul 2015,From: Subang Jaya,"This one the items already reach their warehouse, that's why can calculate weight + shipping fee + agent fee together. Hence I was so shocked how come items already arrive warehouse but the weight is so blardy unreasonable.I had a few dissatisfying encounters with ezbuy Malaysia before (delayed ETA, parcel sent wrong to their Sabah warehouse and so much more) that's why totally lost hope on them. Personally am a SVIP membership but they don't even know how to talk properly to customers ?"
alucard89,"  Jun 10 2016, 07:16 PM",Look at all my stars!!,Group: Senior Member,"Posts: 2,228",Joined: Apr 2006,,"I see, so we still need to wait until item arrived to the warehouseI thought they can give estimates before thatWhich shipping method do you normally used and how long does it usually take to arrive?Any specific shipping method need to be used for electronic items?"
r3d2,"  Jun 10 2016, 07:21 PM",Getting Started,Group: Junior Member,Posts: 98,Joined: May 2006,From: Kuala Lumpur,"Had a few argument with them on the weight, they always charge more than the actual weight and never less. They have very canggih computer."
a13solut3,"  Jun 10 2016, 10:30 PM",Whiner FTW!,Group: Senior Member,"Posts: 1,185",Joined: Mar 2007,From: _|_,"when u get them, measure them up, if they scam u, spam on their fb, senangkan?"
BaoFatAuto,"  Jun 10 2016, 10:49 PM",New Member,Group: New Member,Posts: 0,Joined: Jul 2015,From: Subang Jaya,"The estimation only applicable for few items with the yellow 'ezbuy' option. My friend got use other Taobao forwarder before and he say for China to reach China actually very fast; within two days can arrive. But this cb ezbuy always holan ppl, reach warehouse also they can say haven't reach. In the end take up about four to five days just for inspection and repack.I usually use Economy Air. The ETA I don't dare want to say cuz sometimes their mood sibeh swing, sometimes delivery fast sometimes delivery slow. For electronic items I not sure ba, I think is 'Sensitive Air'? ?"
BaoFatAuto,"  Jun 10 2016, 10:52 PM",New Member,Group: New Member,Posts: 0,Joined: Jul 2015,From: Subang Jaya,"This I have to salute you bro ?? But how come you know they charge more? Did you weigh the item once it reach Malaysia? But ok lo your experience not that bad, mine got once parcel sent to their Sabah warehouse when I'm located in KL. That is only after countless calls asking for the exact whereabouts of the parcel only they admit KNN."
BaoFatAuto,"  Jun 10 2016, 10:53 PM",New Member,Group: New Member,Posts: 0,Joined: Jul 2015,From: Subang Jaya,"Can't spam on their fb la bro, they don't let users to post on their page. Maybe too much negative feedback, takut affect their business kot"
1to3for,"  Jun 11 2016, 01:17 AM",New Member,Group: Junior Member,Posts: 29,Joined: Aug 2014,,ask them to repack. i also suggest to remove all shoe boxes and just ship in the shoes itself.
K.I.T.T,"  Jun 12 2016, 12:32 AM",Casual,Group: Junior Member,Posts: 439,Joined: Sep 2008,,ezbuy ni aku pernah pakai service dia.aku dah try ship by dhl. cod. self collect. dan pos.dhl macam smpah. kata 3 hari. bangang x smapiaku guna cod barang aku smpai warehouse hari rabu aku set nak amik jumaat (minggu yang sama) ezbuy gi set minggu depanaku guna self colect kalau tak aku bising tanya 5 hari diorang diam laaaaaapos dioarang oktapi diorang punya pos RM8 BUKAN pakai poslaju utk area KL atau selangor RM8 tu masuk poket diorang jugak.tapi aku respek pasal apa budak2 dia tak tahu jalan atau tak pahham jalan mereka akan call kita smpai kita angkat mereka akan bagitau mereka dari daigou
K.I.T.T,"  Jun 12 2016, 12:35 AM",Casual,Group: Junior Member,Posts: 439,Joined: Sep 2008,,if u want order use ezbuy please order within kuantity 10pcs above. because if less qty those packing u can see agak cincai using part of box only
KuzumiTaiga,"  Jun 12 2016, 02:53 AM",Spends too much time with mechanical keyboards,Group: Senior Member,"Posts: 2,842",Joined: Jun 2008,From: Cheras ~ London WC1E 7HU~ Shenzhen,"once quoted, means shipping charges finalized and left warehouse already."
K.I.T.T,"  Jun 12 2016, 11:23 PM",Casual,Group: Junior Member,Posts: 439,Joined: Sep 2008,,too compress also not that good.
BaoFatAuto,"  Jun 13 2016, 12:50 PM",New Member,Group: New Member,Posts: 0,Joined: Jul 2015,From: Subang Jaya,"Uishh, dulu pun I ade nk try gune DHL sbab urgent punye barang. Pastu bile I nk tukar ke DHL diorang punye sales rep asyik je call I bagitau ""kalo gune DHL mahal la, takut pun akan delay la, tula nila"" I pun terus bengong apsal gune DHL yg mahal2 tu tp diorang sendiri ckap mungkin akan delay ke papeLantak la, I skrang pun gune ezbuy utk order kecik2 je. Yg mcm urgent atau important orders I gune forwarder lain. Entah la, I rase cam diorang bile da tukar name ke ezbuy ngan heavy marketing sume, service mmg slow banyak la"
K.I.T.T,"  Jun 13 2016, 01:45 PM",Casual,Group: Junior Member,Posts: 439,Joined: Sep 2008,,aku pun order bende kecik kecik ringan ringan dengan diorang.kalau bende tu berat sensitive item aku cari dlm lyn economy air dengab priority air kat ezbuy beza 12 jam je
hanrx7,"  Jun 13 2016, 03:00 PM",New Member,Group: Junior Member,Posts: 29,Joined: Jun 2012,,u can told them that u are not bought rice pack..
douglas_tong,"  Jun 13 2016, 03:15 PM",MaddDougg,Group: Senior Member,"Posts: 1,653",Joined: Jan 2011,,"sigh, after reading this I am not sure how to get things i want from taobao. got to know about ezbuy but since reading this, zero confidence.any suggestion?"
BaoFatAuto,"  Jun 13 2016, 07:31 PM",New Member,Group: New Member,Posts: 0,Joined: Jul 2015,From: Subang Jaya,Hahahaha nice one ?
BaoFatAuto,"  Jun 13 2016, 07:35 PM",New Member,Group: New Member,Posts: 0,Joined: Jul 2015,From: Subang Jaya,"I have few friends who purchased from Taobao directly, they told me that Taobao now has options in which you can directly ship to your address or something. I'm not so familiar with it, but you can try check out Taobao and see.I'm now using WaaDaigou, it's a relatively small forwarder company compared to ezbuy. But because it is small and they don't heavily market themselves *yet*, so they're very friendly and customer-oriented ? So far, my few parcels came in time and in good condition. If they're continuing with this rate, I guess I'll be using their services in the long run"
jerm57,"  Jun 14 2016, 11:23 AM",New Member,Group: Junior Member,Posts: 8,Joined: Nov 2010,From: Penis ular Bolehland,"8kg volumetric weight sounds a bit high but is totally plausible because you bought 3 pair of shoes. I guess you could request them to squeeze your shoes into one bag and possibly damage it. They just didn't want to deliver your leather shoes like hamm chinn peng. Should have just nego for a lower price rather than make a big fuss.They also did the right thing by giving you a massive discount on shipping, but you still not happy. Win liao lorr.Mostly TS just don't know how volumetric weight works."
kcng999,"  Jun 14 2016, 11:56 AM",Casual,Group: Junior Member,Posts: 440,Joined: Dec 2010,,"Hi there, i bought cook accressories cost rm299.00 by credit card on April 2016, when receive stock then open it got one dent n scratch. So just pack it again without used n return it. One blue note return stock copy. Keep calling customer service until today June 2016 without my money refund nor any solution. Every time i have to call n waiting n listen music around 8 to 10 mins n never call me at once from April to June 2016. Always advertise at NTV7 but no respone from customer service n money refund. Advertisement at tv7 n tv9 just cover the sales only without care any customer return stock n complaint n refund their money. This kind of cj wow shop please close sales treat compare previous time Smart Shop much better n have few outlet shop to walk in n return goods n refund.Will inform to goverment consumer sales department n any related goverment to protect malaysian.For everyone happen like this please share n keep on posting cause cj wow shop took our's money without refund.Anyone face this problem?"
BloodAngel,"  Jul 11 2016, 10:07 PM",New Member,Group: Junior Member,Posts: 4,Joined: Aug 2015,,"Hi Guys & Gals,My girl having the same problems. The customer service hotlline is not reachable and the message reply is damn slow.The clothes received have no size indication on it and the size are either is too big or too small.    Wonder did they check the goods before send out. Or maybe there is communication breakdown between the taobao and ezbuy malaysia.   Lousy service"
PetomJL,"  Jul 12 2016, 03:43 PM",New Member,Group: Junior Member,Posts: 44,Joined: Mar 2009,,"I've tried Taobao's SEA shipping 3 times already, I think they are ok and quite cheap.There are 2 types of service: 1) Taobao's Direct Shipping and 2) Taobao's Forwarder.For no. 1) They will quote the shipping cost at the checkout. So need to shop all things and checkout at same time. Then you don't need to do anything else just wait for it to arrive. From my experience, this option is cheaper if your item is heavy. For no. 2) There are 3 registered forwarders you can choose from. I guess there's no big difference between them, I just choose the cheapest one. The shipping cost will only be quoted after each items reach the warehouse and weighed. You can shop separately and decide when to ask them to consolidate, pack and ship to you. There are a number of days whre you can keep the items for free in the warehouse,1 week I think.The no. 2 option, is cheaper than the direct shipping if your item is relatively light (below 3kg or so)."
SonnyCooL,"  Jul 12 2016, 07:10 PM",Web Bastard,Group: Senior Member,"Posts: 4,510",Joined: Sep 2004,From: www.bitching.asia,ask me anything u want to know ??? hopefully we can answer you
guysmiley,"  Jul 12 2016, 07:18 PM",Getting Started,Group: Junior Member,Posts: 112,Joined: Dec 2012,,happened to me. informed them to split my parcel into 2. at first they were reluctant. then afetr a week they decided to do it. from rm300 per parcel based on dimensional weight to less than rm50 for 2 parcels by physical weight.wasnt lucky for my friend that ordered bicycle rims. physical weight is less than 2kg. but the box is too big and cost him almost rm150.
BaoFatAuto,"  Jul 12 2016, 10:04 PM",New Member,Group: New Member,Posts: 0,Joined: Jul 2015,From: Subang Jaya,"My friend tried the Taobao Direct Shipping Service last month... And her parcel was lost She told me that she has always used the direct shipping service but this is the first time she experience this kind of issue. Upon waiting for more than two weeks, her parcel still haven't arrive and just like every normal human being, she was of course worried. She contacted Taobao service agent but they were so slow and ask redundant questions. After acquiring the tracking number, she found out her parcel is in Hong Kong instead.The most troublesome part is, Taobao pushed the blame to the China courier company for the parcel mislocation and the refunds can only be made in terms of funds transfer in local (China) bank account. Means no China bank account = no money back.WTF? I haven't kepoh with my friend to follow up on the issue but I would personally recommend if it's an expensive item; using forwarder is better cuz in case if anything happens they will be blamed hehehe ?"
BaoFatAuto,"  Jul 12 2016, 10:11 PM",New Member,Group: New Member,Posts: 0,Joined: Jul 2015,From: Subang Jaya,"Aiyoo 2kg RM150 wtf. But ok la in your case, ezbuy willing to split the parcel or not a lot of money gone. Another good option I can suggest is to use the Buy-For-Me service instead; they will help you to repackage into the most smallest form possible LOL. But their Buy-For-Me service they will hike up abit currency la"
ah_suknat,"  Jul 13 2016, 03:46 AM",whoooooooooooooop,Group: Senior Member,"Posts: 4,296",Joined: Jul 2006,"From: /k//k/, /k/undasang","This kind of businesa they always pok silapThey will over charge you on the weight, if you agree, they just diam diam charge you, if you bising, they will say oh sorry its our fault.How many people actually measures their own items upon receiving anyway?"
miyakochan89,"  Jul 23 2016, 07:53 PM",IDGAF,Group: Senior Member,Posts: 964,Joined: Aug 2008,,"Damn. I only noticed this thread. I ordered something plastic, 40pcs above. And they charged me shipping for 6KG! When I went to take the parcel just now, it was so super light. Urgh. I am gonna weigh it later and see."
asyadeema,"  Jul 25 2016, 09:17 AM",New Member,Group: New Member,Posts: 0,Joined: Jul 2016,,"Ya, couldnt agree more with dvinez. Your shoes must be coming with a box so they will charge it volumetric charge."
ycs,"  Jul 26 2016, 03:00 PM",MEMBER,Group: Senior Member,"Posts: 2,435",Joined: Jan 2003,From: Selangor,i notice ezybuy shipping rates seems on the high side
spacelion,"  Jul 27 2016, 06:09 PM",??,Group: Senior Member,"Posts: 1,373",Joined: Mar 2009,From: impossibru,are you fucking stupid or whatthe weight is based on volume not on how much it actually weighif u ask them to repackage without shoe box sure the weight is a lot less.
shin_daria,"  Jul 28 2016, 01:33 AM",New Member,Group: Junior Member,Posts: 24,Joined: Oct 2013,,"Lucky TS ended it good with ezbuy.my story wasnt so lucky. twice buy from ezbuy twice also problem. one time, item is 1 kg but 80cm size. they re-packed it in the biggest box they have, at least 130cm in size! Box was practically one-third filled!second time--this was the straw that broke the camels back. Bought inflatable chair which as a cover packaging (ie a bag to keep the chair in), and in the warehouse the staff chatted with me. ""u have defect a bit, i refund rm2"" and show grainy picture of what looks like the packaging torn. I asked ""is it the cover that is defected?"" and he said ""yes"" so I said refund accepted. And the item arrived. No, not the packaging defect, THE INFLATABLE CHAIR ITSELF WAS TORN. LITERALLY GOT HOLE. How to use? I send picture in chat. they say "" eh i thought you understand us, we meant cover as the chair itself"" wah so shit ah your English. obvious want to cover own ass. I pestered again and they ask for ""proof of picture that chair is not inflatable anymore"" . So I fill the chair and I send a picture of the deflated chair (literally become lembik after 10 mins because you know, got HOLES  ). and they said THEY CANNOT SEE so can only refund 30%. I'm gonna go back to using taobao consolidation. at least if got defect i can chat with seller directly.  ezbuy can go to the same rabbit hole with ensogo. pfft!"
