Topic title: Tengku Adnan  Barisan Nasional  BN  Tidak,"Topic posted on: 03 Apr 2017, 13:12:00",Topic link: https://forum.lowyat.net/topic/4246683,"Topic scraped on: 02 Aug 2017, 03:19:33",
username,date,avatar_title,group,post_count,join_date,from,text
ironmaid89,20170403,New Member,Group: Newbie,Posts: 0,201208,,"TENGKU ADNAN TENGKU MANSOR (tiga dari kiri) bersama Mhd . Amin Nordin Abd Aziz (dua dari kiri) dan Rizalman Mokhtar (kanan) merasmikan Majlis Pengiktirafan Bagi Kawasan Yang Ditaraf A (peringkat 1), Blueprint Penarafan Kebersihan Kuala Lumpur di Padang Bola Sepak, Kompleks Sukan Desa Tasik, Kuala Lumpur Barisan Nasional (BN) sentiasa menjaga dan peka dengan permasalahan rakyat meskipun kawasan yang mereka diami dipimpin oleh pembangkang.Menteri Wilayah Persekutuan, Datuk Seri Tengku Adnan Tengku Mansor berkata, keadaan sedemikian bukannya satu halangan kerana apa yang penting adalah permasalahan masyarakat setempat harus diutamakan untuk diselesaikan.“Walaupun bukan kawasan kita (BN), kita tetap peduli agar seiring dengan seruan Perdana Menteri, Datuk Seri Najib Tun Razak iaitu rakyat didahulukan, pencapaian diutamakan.“Oleh itu, rakyat perlu sedar bahawa kerajaan sentiasa inginkan yang terbaik,” katanya di sini, hari ini.Beliau berkata demikian ketika berucap dalam Majlis Pengiktirafan Kawasan Yang Ditaraf A (Peringkat 1), Blueprint Penarafan Kebersihan Wilayah Persekutuan Kuala Lumpur di sini, hari ini. - UTUSAN ONLINEhttp://www.utusan.com.my/berita/wilayah/kl...0#ixzz4dA1DajCv"
Slowpokeking,20170403,New Member,Group: Newbie,Posts: 0,201410,,Cukur.
tsunade,20170403,Regular,Group: Senior Member,"Posts: 1,883",200301,From: Konoha,See the benefits of voting for opposition?
myasiahobby,20170403,Casual,Group: Junior Member,Posts: 455,200912,From: Russia,kuat hisap gam
memekfalui,20170403,Getting Started,Group: Junior Member,Posts: 242,200410,,rupa cakap tak serupa birkin
leonhang,20170403,Getting Started,Group: Junior Member,Posts: 166,200811,,"Where can I find this fuck ? POTHOES EVERY FUCKING WHERE IN KEPONG, and you say care about Pembangkang areas LOL"
googoo,20170403,New Member,Group: Junior Member,Posts: 14,200610,,Macam kena troll saja ni
sonic31s,20170403,Getting Started,Group: Junior Member,Posts: 85,201604,,Another self-proclaim from BN ministers !
ZeroSOFInfinity,20170403,New Member,Group: Junior Member,Posts: 38,200510,,"""Ini adalah agenda pembangkang untuk memburukkan nama BN!"""
ikankering,20170403,New Member,Group: Newbie,Posts: 3,201701,,i think all ppl vote bn better.
arubin,20170403,Holy Pastafarian,Group: Senior Member,Posts: 619,200710,From: Church of the Flying Spaghetti Monster,
