Topic title: Najib  Komoditi naik harga petanda baik 2017,"Topic posted on: 09 Jan 2017, 09:28:00",Topic link: https://forum.lowyat.net/topic/4170252,"Topic scraped on: 02 Aug 2017, 03:32:41",
username,date,avatar_title,group,post_count,join_date,from,text
soowky,20170109,New Member,Group: Junior Member,Posts: 10,200907,From: /kay/,"Najib: Rising commodity prices sign of better times in 2017PUTRAJAYA, Jan 9 — Recovering commodity prices indicate that Malaysia’s economy may improve this year, Prime Minister Datuk Seri Najib Razak said today.Speaking to civil servants at the monthly Prime Minister's Department assembly, Najib pointed that prices of crude oil, palm oil and rubber had all increased compared to 2016 prices.""Looking at the global scenario and the big picture, 2016 was a very challenging year,"" he said.""But there is hope now the situation will improve in 2017,"" he added.sos"
Hansleyss,20170109,New Member,Group: Junior Member,Posts: 37,201408,,"Price increase of cos is always a good thing and a good sign for the year. Rakyat pay more, less subsidy, gove fork out less.....good for the gove but always middle income group are the one that suffers."
rubrubrub,20170109,"global warming is real, stupid.",Group: Senior Member,"Posts: 1,452",200810,From: UC Berkeley,Q: How many stupid people is he going to cheat with that statement? A: Sadly many
Timemuffin,20170109,Getting Started,Group: Junior Member,Posts: 84,201107,,any Felda /k want to corroborate dear leader's statement?
mywingame,20170109,Getting Started,Group: Junior Member,Posts: 68,201607,,Dia kan kata Economy 2016 baik? napa now become a bad year pula
nuba,20170109,New Member,Group: Newbie,Posts: 0,201610,,Najib adalah makhluk yang paling optimis
cloud666,20170109,Getting Started,Group: Junior Member,Posts: 73,201006,,what brand of weed?
nickykee,20170109,New Member,Group: Junior Member,Posts: 40,200803,From: Morning Star,i belif i belif i can fly
pandah,20170109,On my way,Group: Senior Member,Posts: 537,201107,,"tapi ringgit still weakbarang guna seharian increase price while own family go aus play golfmemanglah good, good for u only"
Ibrahimovic,20170109,*HolyHunk*,Group: Senior Member,"Posts: 1,516",200708,From: Johor-Singapore,Lol it trick my local pisang goreng seller already. He told me price always go up because other countries economy are doing better than us but not because we are doing bad. Mind controlling rural people is easy. They really should continue doing this and win the next GE.
Toyoi,20170109,New Member,Group: Junior Member,Posts: 7,201302,From: ToyoiLand,"Ringgit jatuh . sayur jadi mahal., but good for tourism export8 Jan 2017https://forum.lowyat.net/topic/4169951"
Toyoi,20170109,New Member,Group: Junior Member,Posts: 7,201302,From: ToyoiLand,"Villagers Of Kampung Tok San Penang Leave UMNO, To Give PPBM ‘A Try’9 Jan 2017https://forum.lowyat.net/topic/4170509"
kabuto12,20170109,Getting Started,Group: Junior Member,Posts: 82,201604,,Hahaha..  He is telling a jokes
SweetPuff,20170109,Look at all my stars!!,Group: Senior Member,"Posts: 2,003",200301,,That fella punya street cred sudah negative.
azhan82,20170109,Getting Started,Group: Junior Member,Posts: 240,201505,From: Klang Valley,"Cukur, we use/import/export a lot of crude oil, palm oil and rubber"
kcchong2000,20170109,New Member,Group: Newbie,Posts: 3,200901,,Yea. Npw i belip pig can fly too. #looking4weed
avatargod,20170109,New Member,Group: Junior Member,Posts: 32,200812,,diversion
mrhrs,20170109,New Member,Group: Junior Member,Posts: 12,200901,,nk pilihanraya naik la... zzz
