Topic title: Noh Omar  Selangor BN s Manifesto For GE14,"Topic posted on: 11 Jul 2017, 11:27:00",Topic link: https://forum.lowyat.net/topic/4354795,"Topic scraped on: 02 Aug 2017, 02:59:24",
username,date,avatar_title,group,post_count,join_date,from,text
ironmaid89,20170711,New Member,Group: Newbie,Posts: 0,201208,,"Tan Sri Noh Omar said Selangor BN had received several inputs and views from various quarters including former top government officials and government-linked companies’ leaders in coming up with a meaningful manifesto.The Selangor Barisan Nasional (BN) is currently refining its  manifesto for the 14th General Election (GE14), with the priority divided between the urban and rural areas in the state.Its chairman Tan Sri Noh Omar said Selangor BN had received several inputs and views from various quarters including former top government officials and government-linked companies’ leaders in coming up with a meaningful manifesto.“We just have to wait for the details of the manifesto,” he told reporters at Selangor BN’s Aidilfitri open house here yesterday night.Also present were Prime Minister Datuk Seri Najib Tun Razak , his wife Datin Seri Rosmah Mansor and Deputy Prime Minister Datuk Seri Dr Ahmad Zahid Hamidi.Noh, who is also Selangor Umno Liaison Committee chairman, said the Selangor BN manifesto would be divided into categories namely urban and rural areas and it would vary according to the 22 parliamentary and 56 state constituencies.Noh urged all state BN leaders to work hard in exposing weaknesses of the Selangor government, led by Parti Keadilan Rakyat.He also advised those not selected to contest in GE14 not to be disheartened but to put the party first and continue serving the people and the nation. — Bernamahttp://www.themalaymailonline.com/malaysia...d-says-noh-omar"
froggyx,20170711,Getting Started,Group: Junior Member,Posts: 219,200612,,MB wanna be....
keny2020j,20170711,Getting Started,Group: Junior Member,Posts: 276,200906,,why doing a new 1 while the old 1 nothing was completed?
bangaubagus,20170711,Getting Started,Group: Junior Member,Posts: 162,201608,,"If Selangor still under TSKI.. apa kelemahan pon xda, got video of his working adalah"
Jasonist,20170711,gegegegege,Group: Senior Member,"Posts: 1,103",200605,From: Malaysia,menyampah tengok muka dia
sgwc,20170711,New Member,Group: Junior Member,Posts: 18,200601,From: inside a palace with ephemeral darkness embrace,Win.
freakingringo,20170711,New Member,Group: Junior Member,Posts: 21,201103,,he still want to himself relevant..just pass on dude..
avatargod,20170711,New Member,Group: Junior Member,Posts: 32,200812,,Yelah... Asal tengok muka dia mesti rasa meluat
Kaerna,20170711,Getting Started,Group: Junior Member,Posts: 282,200802,,Well you can start by removing Noh Omar himself. Confirm vote will come back without any manifesto also.
honorable thief,20170711,New Member,Group: Junior Member,Posts: 6,201704,,
M4A1,20170711,[*#^?SONE?^#],Group: Senior Member,"Posts: 1,171",200508,,"if no noh omar, bn win 99 liao"
YellowKingValley,20170711,Casual,Group: Junior Member,Posts: 398,201412,,.
YellowKingValley,20170711,Casual,Group: Junior Member,Posts: 398,201412,,Inb4 he gets dropped and...
berzerk,20170711,On my way,Group: Senior Member,Posts: 630,200712,,good move BN! former top government officials & big bosses of GLCs are very good at understanding the needs of the voters.
teehk_tee,20170711,#crushingit ?,Group: Senior Member,"Posts: 5,201",200504,From: KUL/BKK/HKG/JKT,nih muka gatal nak duduk kerusi MB dahit'll be his nxt GE dun worry
Toyoi,20170711,New Member,Group: Junior Member,Posts: 7,201302,From: ToyoiLand,Noh Omar says he is still in dark over MO1's identity29 Sep 2016https://forum.lowyat.net/topic/4068477...Umno minister Noh Omar today admitted he still does not know who the figure named in the US Department of Justice (DOJ) civil suit related to 1MDB named 'Malaysian Official 1' is.
M4A1,20170711,[*#^?SONE?^#],Group: Senior Member,"Posts: 1,171",200508,,can we just remove him?muka macam constipated
kiasunkiasi,20170711,On my way,Group: Senior Member,Posts: 538,200711,,manifesto?which of the one for GE13 materialise?
soowky,20170711,New Member,Group: Junior Member,Posts: 10,200907,From: /kay/,kalau noh udang ni dibuang najib. im sure 30% vote swing back to BN. but jilat is more important than 30%.
