Topic title: Ramai sedar  mahu perubahaan di Kelantan   UMNO,"Topic posted on: 26 Jun 2017, 22:17:00",Topic link: https://forum.lowyat.net/topic/4340338,"Topic scraped on: 02 Aug 2017, 03:01:33",
username,date,avatar_title,group,post_count,join_date,from,text
joe_mamak,20170626,Casual,Group: Junior Member,Posts: 333,200612,,"http://www.malaysiakini.com/news/386777Ramai sedar, mahu perubahaan di Kelantan, kata Umno26 Jun 2017Umno Kelantan akan berusaha menarik sokongan generasi muda dan pengundi yang bekerja di luar negeri itu pada Pilihan Raya Umum ke-14 (PRU14) akan datang dalam usaha menawan kembali Kelantan selepas 27 tahun di bawah pentadbiran kerajaan PAS.Ketua Penerangan Umno, Tan Sri Annuar Musa berkata ketika ini terdapat perubahan terhadap sokongan kumpulan itu terhadap Umno terutama dalam kalangan orang muda dari Kelantan yang menetap di luar negeri itu serta golongan mahasiswa.“Sudah ramai yang sedar dan mahukan perubahan di negeri ini. Mereka faham mengenai pembangunan di Kelantan kerana mereka terdiri daripada kalangan cerdik pandai juga.“Setakat in, sokongan kuat daripada golongan ini memberi kekuatan kepada Umno,” katanya kepada pemberita pada majlis Mesra Aidilfitri Orghe Parlime Terre (Orang Parlimen Ketereh) di kediamannya di Bukit Marak, di Kota Bharu, hari ini.Annuar yang juga anggota Parlimen Ketereh, berkata beliau yakin pengundi luar daripada golongan orang muda mampu membawa perubahan pada PRU14 ini.“Golongan muda sudah memberi banyak peluang kepada PAS dan sekarang mereka tidak menolak kebaikan yang dilakukan oleh Umno,” katanya.Mengulas mengenai ‘perang bendera’ yang berlaku terutama ketika perantau pulang menyambut lebaran di Kelantan ketika ini, Annuar berkata ia tidak membawa sebarang makna kerana tiada sebarang bantuan dihulurkan kepada golongan memerlukan.Beliau berkata Umno mengambil langkah untuk tidak terlibat dalam ‘perang’ bendera itu dan di sebaliknya memilih untuk membantu rakyat secara senyap-senyap tanpa sebarang publisiti.""Kita tidak melihat perbuatan memacak bendera itu sebagai gerakan (membantu rakyat). Gerakan Umno sepanjang Ramadan amat banyak malah sudah berpuluh ribu rakyat dibantu.""Di kawasan Parlimen saya sendiri iaitu Ketereh lebih 20,000 rakyat dibantu secara senyap-senyap tanpa publisiti. Kalau kita sibuk mahu memacak bendera sudah tentu kita akan terlupa agenda sebenar mahu membantu mereka, "" katanya.- Bernama"
ray123,20170626,Senior Citizen,Group: Senior Member,"Posts: 2,450",200301,,"Wonder what PAS thinks of this, after all their lovey-dovey moments with UMNO."
Avex,20170626,Casual,Group: Junior Member,Posts: 483,200301,From: /k/ isle,"habislah PAS, UMNO dah serang masuk"
froggyx,20170626,Getting Started,Group: Junior Member,Posts: 219,200612,,Biar padan mukak....talam 34 mukak...
slimey,20170626,,Group: Senior Member,"Posts: 4,874",200704,,"hehehehe.........checkmate pasbut i do admit, umno is a better party than pas in terms of policy making"
G-CooL^_^,20170626,Getting Started,Group: Junior Member,Posts: 140,200301,From: Kuala Lumpur,"Haha, PAS now apa pun x dakMasa apa pun x dak, UMNO will not give any dedak"
ah_suknat,20170626,whoooooooooooooop,Group: Senior Member,"Posts: 4,300",200607,"From: /k//k/, /k/undasang",Inb4 simpsons haaaahaa
wanritsu,20170626,Getting Started,Group: Junior Member,Posts: 242,201207,From: live and let live,Syukur. Development coming to Kelantan
jacckl,20170626,New Member,Group: Junior Member,Posts: 49,201211,,pas say umno is kawan
sgwc,20170626,New Member,Group: Junior Member,Posts: 18,200601,From: inside a palace with ephemeral darkness embrace,HahahahahahaCome on pr... let's make em have 3 corner fight so that umno will win over kelantan just to stir shit up.
l4nunm4l4y4,20170626,Getting Started,Group: Junior Member,Posts: 169,201108,,
spinecheek,20170626,New Member,Group: Junior Member,Posts: 9,201206,,aint pas = umno?papa say son is not capablelet papa handle the situationso no issue
MR_alien,20170626,Mr.Alien on the loss,Group: Senior Member,"Posts: 2,021",200710,From: everywhere in sabah,inb4 bagi saya 1 peluang
abgropi,20170627,New Member,Group: Newbie,Posts: 0,201706,,pembangunan>all.hidup umno!
abgropi,20170627,New Member,Group: Newbie,Posts: 0,201706,,learn from what happen in kelantan.don't ever support opp party.
automan5891,20170627,New Member,Group: Junior Member,Posts: 16,200909,,"Ramai sedar, mahu perubahaan di Kelantan, kata Umnolol yeah right. RIP kelantan you lose either way."
silent_stalker,20170627,Enthusiast,Group: Senior Member,Posts: 820,201204,,I know alot of kelantanese. Most of them actually like it as is. They see it like kelantan is their home n kl is just a place for them to work.
whyamiblack,20170627,New Member,Group: Junior Member,Posts: 18,201402,,Ya and then come people state buat taik.
HJ_Ishimori,20170627,New Member,Group: Junior Member,Posts: 35,201610,From: Kuala Lumpur (Malaysia) | Ashikaga (Japan),OK la tu..dah bolot duit MARA..ini lah tiba bolot duit kelantan..PAS pun main angguk keplas..sila kan..
ar188,20170627,Look at all my stars!!,Group: Senior Member,"Posts: 8,118",200606,,"i tot some one siggy say got 60,000years development already?"
abgropi,20170704,New Member,Group: Newbie,Posts: 0,201706,,hidup umno!
