Topic title: Umno to go on nationwide info blitz,"Topic posted on: 19 Feb 2017, 22:22:00",Topic link: https://forum.lowyat.net/topic/4201108,"Topic scraped on: 02 Aug 2017, 03:26:38",
username,date,avatar_title,group,post_count,join_date,from,text
joe_mamak,20170219,Casual,Group: Junior Member,Posts: 333,200612,,"http://www.malaysiakini.com/news/373039Umno to go on nationwide info blitz on forex scandalAnne Muhammad    19 Feb 2017Umno will start a nationwide information blitz on the 1990s foreign exchange scandal next month, following a cabinet decision to form a special committee to investigate the total losses suffered by Bank Negara Malaysia.Umno information chief Annuar Musa said the information sessions are important because there have been attempts to equate the scandal with 1MDB.""Why was a committee formed on this and not 1MDB? This is something that will be explained (in the nationwide information blitz),"" he said."
Flaming_lion,20170219,An Innocent Lion,Group: Senior Member,Posts: 635,201008,,"lol... These guys are funny, but you know, they will definitely make an impact though..."
IReallyNeed Answers,20170219,Krazeybender,Group: Senior Member,Posts: 887,200801,From: Cheras,I tot masterrace  senang lupa?
sonic31s,20170219,Getting Started,Group: Junior Member,Posts: 85,201604,,"Dumno ministry?!?!This's nothing new, telling people's wrong except themself...."
Dyson Jin,20170219,On my way,Group: Senior Member,Posts: 538,201303,,"if tun m still in umno,they wont do like that de..haha"
everest,20170219,Getting Started,Group: Super Senior,Posts: 61,200709,,Take action after many years
Toyoi,20170220,New Member,Group: Junior Member,Posts: 7,201302,From: ToyoiLand,Final 1MDB report classified as secret3 Mar 2016https://forum.lowyat.net/topic/3883695https://forum.lowyat.net/topic/3885310TI-M: Now is the best time to declassify 1MDB audit report14 Jul 2016https://forum.lowyat.net/topic/4002275
