Topic title: PERKASA demo depan pejabat MIC,"Topic posted on: 22 May 2017, 00:08:00",Topic link: https://forum.lowyat.net/topic/4296543,"Topic scraped on: 02 Aug 2017, 03:08:22",
username,date,avatar_title,group,post_count,join_date,from,text
joe_mamak,20170522,Casual,Group: Junior Member,Posts: 333,200612,,"http://www.malaysiakini.com/news/382972PERKASA demo depan pejabat MIC21 Mei 2017 Wira PERKASA hari ini mengadakan protes di hadapan ibu pejabat MIC bagi membantah kenyataan pemimpinnya, khususnya Bendahari Agung parti itu, Datuk Vell Paari.Ketuanya, Azrul Akmal Saharudin berkata protes itu berikutan kenyataan Vell Paari yang mengaitkan PERKASA dengan gerakan militan IS kerana mempertahankan pendakwah kontroversi Dr Zakir Naik.Dengan membawa bendera PERKASA berwarna kuning, berpakaian hitam dan bersongkok, Azrul berkata mereka mahu memastikan kaum Melayu dan masyarakat Islam tidak mengundi MIC dalam pilihan raya umum akan datang.""Wira Perkasa tidak lagi boleh bersabar dengan kebiadapan MIC dan kita akan pastikan calon-calon MIC tidak akan lagi diundi oleh orang-orang Melayu Islam di mana-mana tempat calon MIC.""Wira Perkasa juga mahu Barisan Nasional menilai semula kedudukan MIC dalam kerajaan di atas kebiadapan mereka terutamanya dalam isu RUU 355 dan Dr Zakir Naik ini,"" katanya.PERKASA minggu lalu melancarkan perang terhadap MIC berikutan laporan portal The Star Online bertajuk ""Take Action Against Zakir Naik, MIC Urges Police"" bertarikh 12 Mei lalu.Setiausaha Agung PERKASA, Syed Hassan Syed Ali berkata, meskipun laporan akhbar itu tidak secara langsung mengaitkan PERKASA dengan IS, namun pihaknya menemui kenyataan bertulis Vell Paari dalam kumpulan WhatsApp yang menyebut mengenai perkara itu.Sehubungan itu, Azrul berkata sayap Pemuda PERKASA mengutuk sekeras-kerasnya tindakan Vell Parri yang disifatkan sebagai 'kurang ajar'.""Dalam erti kata lain, mereka mahu menyatakan PERKASA ini adalah satu gerakan bersikap teroris hanya kerana PERKASA mempertahankan Dr Zakir Naik, seorang pendakwah yang amat disegani di seluruh dunia,"" katanya.Wira Perkasa juga menuntut Presiden MIC, Datuk Seri Subramaniam menafikan kenyataan dibuat Vellparri mewakili parti itu.""Kami menuntut beliau untuk menasihatkan anggota-anggotanya tidak bermain api kerana ia pasti akan mengundang tindakan balas daripada orang Melayu Islam yang suara mereka diwakili oleh PERKASA.""Jangan sesekali kamu usik Melayu Islam, kerana Wira Perkasa akan menjadi benteng untuk mempertahankannya,"" tegasnya."
vanpersie91,20170522,Regular-ly posting shits and stuffs,Group: Senior Member,"Posts: 1,300",200901,From: Hurr Durr Herp Derp Land,"tapi memang zakir naik is wanted fella by his origin nation and interpol kan?memang la sama religion brotherhood tapi kalau tak salah kenapa nak protek dia. let him cooperate with related authorities lah to prove his innocence.pelik pelik warga meleis nih. jangan sebab ""agama"" jd alasan untuk tidak berlaku adil."
Lancewood,20170522,Getting Started,Group: Junior Member,Posts: 57,201502,,i suppork Perkasa on this hor by virtue zakar turun not a wanted refugee in MALAYSIA.
pg84,20170522,Getting Started,Group: Junior Member,Posts: 225,201111,,"while showing a sad face , Naik lol in heart"
automan5891,20170522,New Member,Group: Junior Member,Posts: 16,200909,,racist until don't care zakar naik is a terrorist.
[[x]],20170522,Getting Started,Group: Junior Member,Posts: 87,201705,,Wanted fugitive by interpol
Lancewood,20170522,Getting Started,Group: Junior Member,Posts: 57,201502,,Unfortunately revered in Malaysia
