Topic title: Najib s aide  1MDB negotiator and alleged RM2m rec,"Topic posted on: 04 May 2017, 15:11:00",Topic link: https://forum.lowyat.net/topic/4281626,"Topic scraped on: 02 Aug 2017, 03:11:39",
username,date,avatar_title,group,post_count,join_date,from,text
upcars,20170504,New Member,Group: Newbie,Posts: 3,201702,,"aCsmrTDJg0sNajib's aide, 1MDB negotiator and alleged RM2m recipientPublished on May 3, 2017PKR vice-president Rafizi Ramli dropped a bombshell yesterday, claiming that a company owned by Amhari Efendi Nazaruddin, an aide of Prime Minister Najib Abdul Razak, had received RM2 million from Najib."
JoLee,20170504,Getting Started,Group: Junior Member,Posts: 85,200301,,Macai Scumno will say 2m ciput only.
buysellaccount,20170504,Getting Started,Group: Junior Member,Posts: 116,201110,,nais.
Matrix,20170504,King of Char Siew!,Group: Senior Member,"Posts: 14,991",200301,From: Damansara Jaya/Bandar Utama,RM 2m is for afternoon tea-time only.
wankongyew,20170504,Regular,Group: Senior Member,"Posts: 1,075",200711,,Highly skilled negotiator of course must receive a commission to strike the best deal on behalf of Malaysia.
quikstep,20170504,Casual,Group: Junior Member,Posts: 404,201004,,Serious? Government dunno how to negotiate with foreign governments? Damn malu sia
