Topic title: Noh Omar  BN Selangor Lancar Ops Yawas,"Topic posted on: 25 Mar 2017, 00:33:00",Topic link: https://forum.lowyat.net/topic/4233141,"Topic scraped on: 02 Aug 2017, 03:21:33",
username,date,avatar_title,group,post_count,join_date,from,text
ironmaid89,20170325,New Member,Group: Newbie,Posts: 0,201208,,"Noh menyampaikan sumbangan kepada mangsa ribut di Dewan Kampung Bestari Jaya, di sini.BN Selangor melancarkan 'Ops Yayasan Warisan Anak Selangor (Yawas)', bagi membuktikan berlaku penyelewengan menerusi Skim Mesra Usia Emas (SMUE) kepada waris yang telah meninggal dunia.Pengerusi Umno Selangor, Tan Sri Noh Omar berkata, peruntukan sebanyak RM2,500 itu telah disalahguna pihak tidak bertanggungjawab.""Perkara itu telah dibincangkan pada taklimat dan perjumpaan pemimpin BN di negeri ini, Isnin lalu.""Kita mendengar taklimat dan mendapat bukti bahawa bagaimana wang ini dikeluarkan hanya melalui wakil-wakil rakyat dengan menggunakan mesin ATM (mesin juruwang automatik).""Kita juga ada senarai nama yang sepatutnya dapat duit tetapi duitnya tak dapat,"" katanya pada sidang media selepas Majlis Perjumpaan Ramah Mesra bersama Mangsa Ribut dan Penyerahan Surat Lantikan Kontraktor Projek Rumah Mesra Rakyat di Dewan Kampung Bestari Jaya, di sini, petang tadi.Sehubungan itu, beliau meminta wakil-wakil Badan Bukan Kerajaan (NGO) dan pemuda Umno di setiap Dun di negeri ini membuat laporan polis, Suruhanjaya Pencegahan Malaysia (SPRM) dan Jabatan Pendaftaran Pertubuhan (ROS)  terhadap penyelewengan wang berkenaan.Noh yang juga Menteri Kesejahteraan Bandar, Perumahan dan Kerajaan Tempatan berkata, terdapat Dun tertentu di negeri ini telah mula membuat laporan berhubung penyelewengan itu yang didahului dengan Pengerusi Gabungan NGO, Datuk Seri Jamal Md Yunos.""Kita akan membuat secara berperingkat dan sudah tentulah kita juga ada peguam sebelum laporan itu dibuat bagi meneliti bukti yang kita terima,"" katanya.Noh berkata, pihaknya juga mempunyai bukti peruntukan wang rakyat itu dibelanjakan secara tunai tanpa kawalan.""Kita diberitahu, penerima yang namanya ada, tetapi orang berkenaan belum terima lagi peruntukan yang sepatutnya.""Kita juga dimaklumkan, ada juga duit ini dikeluarkan di luar negeri Selangor seperti Kota Kinabalu, Pulau Pinang dan  ada ahli Parlimen di Wilayah Persekutuan pun dapat kad (Yawas) ini. Kalau nak bagi, bagilah seluruh negara... kenapa nak bagi di Wilayah?,"".""Biarlah pihak berkuasa menjalankan penyiasatan sama ada berlaku penyelewengan atau pun tidak, tetapi, sebelum kita membuat laporan, kita nak pastikan kita mempunyai dokumen dan bukti yang lengkap,"" katanyahttp://www.sinarharian.com.my/edisi/selang...wengan-1.648963"
JohnLai,20170325,Skeptical Cat,Group: Senior Member,"Posts: 1,152",200604,,"""Kita juga ada senarai nama yang sepatutnya dapat duit tetapi duitnya tak dapat,"" katanya pada sidang media selepas Majlis Perjumpaan Ramah Mesra bersama Mangsa Ribut dan Penyerahan Surat Lantikan Kontraktor Projek Rumah Mesra Rakyat di Dewan Kampung Bestari Jaya, di sini, petang tadi.Sungguh mencurigakan....entah-entah dah dapat duit, habiskan semua kat tempat yang 'diragui'.....lepas tu, cakap tak dapat duit...."
and85rew,20170325,Red Devil,Group: Senior Member,Posts: 646,200605,From: Kuching,Go dai noob
JRocket,20170325,New Member,Group: Newbie,Posts: 3,201409,,siapa boleh sepak kepala dia aku bagi rm50.
