username,date,avatar_title,group,post_count,join_date,from,text
ironmaid89,07/30/17,New Member,Group: Newbie,Posts: 0,1 Aug 2012,,"MCA yakin dengan perubahan sokongan dalam kalangan pengundi di Pulau Pinang kerana mereka sudah hilang kepercayaan terhadap DAP yang gagal menunaikan janji selepas mengambil alih negeri ini selama sembilan tahun.Presidennya, Datuk Seri Liow Tiong Lai berkata, sehingga hari ini, pelbagai janji tidak dilaksanakan dan Ketua Menteri Lim Guan Eng dilihat terus memperdaya rakyat dan sentiasa cuba memecahbelahkan rakyat dalam usahanya meraih undi.""Saya yakin pada pilihan raya umum akan datang, perubahan akan berlaku dengan sokongan beralih daripada DAP kepada MCA dan Gerakan...kita bekerja keras untuk dapatkan sokongan rakyat di Pulau Pinang.""Saya juga minta pengundi Cina memberi kekuatan kepada MCA kerana kita dalam kerajaan yang dapat memperkuatkan institusi kenegaraan yang berbilang-bilang kaum dan inklusif,"" katanya kepada pemberita selepas merasmikan Dewan SJK© Yu Chye di sini, hari ini.Tiong Lai yang juga Menteri Pengangkutan berkata kerajaan sentiasa memberi perhatian kepada usaha meningkatkan lagi keharmonian rakyat dan berada di landasan betul dalam mengatur strategi untuk membangunkan masa depan negara.Sebagai contoh, katanya,  pelancaran tren Aliran Transit Massa (MRT) baru-baru ini menunjukkan kerajaan BN mampu melaksanakan pelbagai program untuk masa depan negara yang lebih baik.-Bernamahttp://www.sinarharian.com.my/politik/pera...pinang-1.710930"
sonic31s,07/30/17,Getting Started,Group: Junior Member,Posts: 85,1 Apr 2016,,Penang case...Need more Penang Rakyat to comment...
Cloudx,07/30/17,(?°?°??? ???,Group: Senior Member,"Posts: 1,483",1 Oct 2004,From: Island where you get pearl,Another fella hisap weed too much. MCA has never ever even stand a chance in Penang yet here he comes barking non stop.
azhan82,07/30/17,Getting Started,Group: Junior Member,Posts: 240,1 May 2015,From: Klang Valley,habislaa..the return of MCA to penang..inb4 Weeeeeeeeeeeeeeed
zstan,07/30/17,10k Club,Group: Senior Member,"Posts: 11,982",1 Nov 2007,,Not sure why would BN want to win back Penang. Should let tokong continue to sell every inch of land and raise water rates indefinitely first.
alexcky,07/30/17,business Sifu,Group: Senior Member,Posts: 754,1 Nov 2007,,So bn janji dicapati.. Harga barang naikPls continue to vote bn so they can naik hargaTopkek
abgropi,07/30/17,New Member,Group: Newbie,Posts: 0,1 Jun 2017,,cukur.bn more support this GE.
