Topic title: Why Putin and Najib not close ,"Topic posted on: 08 Jun 2017, 13:55:00",Topic link: https://forum.lowyat.net/topic/4318596,"Topic scraped on: 02 Aug 2017, 03:05:31",
username,date,avatar_title,group,post_count,join_date,from,text
Fall guy,20170608,Getting Started,Group: Junior Member,Posts: 122,201012,,"pndKPlfUVhMis it because of mh370? throughout najib's term he has taken selfie with US, China and many other leaders except Putin. why?"
Jasonist,20170608,gegegegege,Group: Senior Member,"Posts: 1,103",200605,From: Malaysia,"one is real man, one is pondan, how to close??? u tell me lar"
Taipan052,20170608,Getting Started,Group: Junior Member,Posts: 63,201004,,one top one bottom can larr
omong,20170608,New Member,Group: Newbie,Posts: 0,201106,,"Putin: ""najib who?"""
Fall guy,20170608,Getting Started,Group: Junior Member,Posts: 122,201012,,is it Putin don't like Najib?
ashestoashes,20170608,New Member,Group: Junior Member,Posts: 26,200905,,if they're not close najib won't buy those fighter jets from him
