Topic title: so cute this old man  Lks c sure mata merah,"Topic posted on: 07 Jul 2017, 18:23:00",Topic link: https://forum.lowyat.net/topic/4351269,"Topic scraped on: 02 Aug 2017, 03:01:03",
username,date,avatar_title,group,post_count,join_date,from,text
Sirmacai,20170707,Getting Started,Group: Junior Member,Posts: 213,201604,,
joe_star,20170707,Serving the Servants,Group: Senior Member,"Posts: 1,457",200703,,His dotter pregnant?
nasrulafiq93,20170707,On my way,Group: Senior Member,Posts: 528,201101,"From: Taman Melawati, Kuala Lumpur",What a beautiful family
Boom Mortar,20170707,Getting Started,Group: Junior Member,Posts: 145,201309,,Left macham fatty nearlee
koolio,20170707,New Member,Group: Newbie,Posts: 2,201509,,why isnt big blow jho low in the pic?
OcHaa,20170707,Getting Started,Group: Junior Member,Posts: 141,200712,,what a happy familygodbless
Lumiaaa,20170707,Getting Started,Group: Junior Member,Posts: 96,201409,From: LYN,jho low disbandedhe is the scapegoatnajib will be remain free but u will see JL fall in jail
koolio,20170707,New Member,Group: Newbie,Posts: 2,201509,,i think they are still in cahoots...
audi90,20170707,New Member,Group: Junior Member,Posts: 14,201211,,i tot nearlee on the left
alwinnng,20170707,"To love at all, is to be vulnerable.",Group: Senior Member,"Posts: 3,875",200912,From: ¯\(°_o)/¯,Hahahahahahahahhhahahaha
Sirmacai,20170707,Getting Started,Group: Junior Member,Posts: 213,201604,,look at his hands and u will understand.
zoozooka,20170707,Getting Started,Group: Junior Member,Posts: 226,201206,,U2 Bruno
riezzien,20170707,New Member,Group: Junior Member,Posts: 24,200901,,jho low is the one taking the picture maybe? lul
wilsonjay,20170707,Wade Wilson,Group: Senior Member,"Posts: 1,493",200602,From: When The World Comes Down,who's that midget?
Arata,20170707,New Member,Group: Newbie,Posts: 1,201607,,nearlee
Sirmacai,20170707,Getting Started,Group: Junior Member,Posts: 213,201604,,look at what najib is holding
nearlee,20170707,Getting Started,Group: Junior Member,Posts: 103,200905,From: iNearly,>janji bijan Nearlee
apasarahannika,20170707,New Member,Group: Newbie,Posts: 3,201701,,Wow sudah kena pancut dalam
TheHitman47,20170707,Regular,Group: Senior Member,"Posts: 1,000",200909,From: In Your Mind,is it normal for a man to always stand like that?
Lumiaaa,20170707,Getting Started,Group: Junior Member,Posts: 96,201409,From: LYN,what for
avatargod,20170707,New Member,Group: Junior Member,Posts: 32,200812,,Nope... U know his stance la..
olman,20170707,Pukimon,Group: Senior Member,"Posts: 1,845",200301,From: PukiDex 150: SlowMon,Kazakhstan is the real safe haven
G-CooL^_^,20170707,Getting Started,Group: Junior Member,Posts: 140,200301,From: Kuala Lumpur,"Wow, richest man in the world"
azhan82,20170707,Getting Started,Group: Junior Member,Posts: 240,201505,From: Klang Valley,2.6 billion...spend like no tomorrow...both kids got their cut...bini got her cut...Laki got his cut..inb4 TS Uncut
azhan82,20170707,Getting Started,Group: Junior Member,Posts: 240,201505,From: Klang Valley,
Songlap,20170707,New Member,Group: Junior Member,Posts: 28,201302,From: Putrajaya,"cannot fit in the pic, have to zoom all the way out"
Travis_Bickle,20170707,New Member,Group: Junior Member,Posts: 7,201311,,"Yeah, seriously looks like Nearlee."
silent_stalker,20170707,Enthusiast,Group: Senior Member,Posts: 820,201204,,No if got balls
harrychoo,20170707,Look at all my stars!!,Group: Senior Member,"Posts: 3,586",200503,From: Bolehland,i loled
hcmalaya,20170707,New Member,Group: Newbie,Posts: 0,201510,,The Kazakh Has scandal right?
