sniper on the roof,20170424,20k VIP Club,Group: VIP,"Posts: 22,793",200301,From: Taipei,"u guys hate hak istimewa orang melayu, right?- all poor malaysians should be helped. Not just rich croniesu guys hate royal institution, right?- nope. And its enshrined in the constituition.u guys hate glc to be helm by only malay, right?- business should be run by the most capable be it black white brown yellow or pink.u guys hate malay as the majority, right?- hate racial politics."
Newsray,20170424,Getting Started,Group: Junior Member,Posts: 199,201112,,"I can answer the 4 questions all NO.Most people dont even care. In fact i not really know what is hak malay except asb maybe.Walau you gila kah say people hate royal? Why i wan hate royal? Walau eh jgn lar pusing ni mcm. Hate royal is a kesalahan serius. Apa lu ckp nk dei.Glc malay their company. If another non malay becomes ceo, he also not going to promote me manager, so why i hate.Malay majority, ni pon mau hate? Like this i need to love indian because lowest population? Or i need hate my parents.I agreed if wrong people lead the country, maybe somethinf will be affected. But your view on the points really fkup man. No idea how you got that."
keown83,20170424,Getting Started,Group: Junior Member,Posts: 166,200909,From: penang wit love,"yes..thats why the message or rules will not be send by the minority directly, but through their friends who is the 'same kind' with majoritywhich part of 'alibaba' or 'rule through proxy' that u didnt understand?"
joe_mamak,20170425,Casual,Group: Junior Member,Posts: 333,200612,,I also have countered it already.  It is impossible for the Malays to lose political power.  You can see from the figures I have posted earlier.  Your come back is nothing much really.  It is akin to having just one very charismatic Chinese MP to lead all the MPs to follow what he says.  Your argument would end when there is not even a single Chinese MP in Parliament
keown83,20170425,Getting Started,Group: Junior Member,Posts: 166,200909,From: penang wit love,
Dyson Jin,20170425,On my way,Group: Senior Member,Posts: 538,201303,,"hahahaha..ask city malays with kampung malayscity malays prefer ppl that can do work no care which race is it.kampung malays of course must org kita..dont care songlap how powerful,as long is org kita..that's the differences."
keown83,20170425,Getting Started,Group: Junior Member,Posts: 166,200909,From: penang wit love,"errr...im countering ur figure, not u countering me in the 1st place..didnt u remember? after my 1st counter figure with u, u provide nothing but just a comment & another comment..u can always backtrack if u want"
xpole,20170425,Personal satisfaction,Group: Senior Member,Posts: 864,200912,From: Scotland,"DAP is hypocrite. Luar agenda lain, behind the scene agenda lain."
keown83,20170425,Getting Started,Group: Junior Member,Posts: 166,200909,From: penang wit love,"with this kind of mentality, kampung people will always vote for BNhigh horse, arrogant, disrespect, but expect kampung people to vote PHjust like how u guys looked down on native sarawakian & sabahan but expect them to vote PHinstead of understand them & learn what their need is, u trying to reinvent them & shove off ur policy & attitude into their mouthkeep practicing that as BN will benefit the most"
xpole,20170425,Personal satisfaction,Group: Senior Member,Posts: 864,200912,From: Scotland,"Did opposition people approach orang kampung especially DAP?PAS managed to win kampung people heart in many states, but how about DAP? Last Sarawak election kalah teruk. Poodah."
joe_mamak,20170425,Casual,Group: Junior Member,Posts: 333,200612,,PAS kalah even more teruk.
joe_mamak,20170425,Casual,Group: Junior Member,Posts: 333,200612,,Already did earlier lah.  I mistook you for Kaffra.  That post still stands.  Your reply is just fear and BS.
joe_mamak,20170425,Casual,Group: Junior Member,Posts: 333,200612,,"So much character assassination.  So many straw men arguments too.  No lah, I am not against the special position of Malays as enshrined in the Perlembagaan.   I subscribe to Keluhuran Perlembagaan.  So does Lim Kit Siang.  He also believes in upholding the special position of the Malays.  No, I don't hate the royal institution.  Why do you want to generalize so much?  Shame on you.  No lah, I don't hate the GLCs helmed by Malays.  We also want GLCs to be successful.  Let the best persons run the GLCs.  I believe in meritocracy.  If the selection of the leader is based on race, then that isn't meritocracy.    No lah.  I don't hate Malays as the majority.  I am a Malaysian.  I am not so bothered by race lah.  What I do wish to see is that all Malaysians be treated fairly and equally.  Malaysia could be doing much better than what it is now.  If everyone feels like he/she has a strong sense of belonging, together we can make this country great.  But no, we have people like you playing up race all the time.  You ever stop to think a bit about the consequences of your actions?  Maybe also think a bit about your soul?"
GHBZDK,20170425,New Member,Group: Junior Member,Posts: 48,201206,,"really?explain about project Alpha 626 then!!   that's right, i know all about the DAP's chinese human cloning project taking place at the komtar black site. ur not fooling me with fake stats  deshi deshi basara basara deshi deshi basara basara deshi deshi basara basara deshi deshi basara basara"
joe_mamak,20170425,Casual,Group: Junior Member,Posts: 333,200612,,"Yeah, right."
nearlee,20170425,Getting Started,Group: Junior Member,Posts: 103,200905,From: iNearly,bump for the lulz macaiNearlee
sniper on the roof,20170425,20k VIP Club,Group: VIP,"Posts: 22,793",200301,From: Taipei,I see its quite pointless to post further.
keown83,20170425,Getting Started,Group: Junior Member,Posts: 166,200909,From: penang wit love,"u answer NO to all the question?especially question number 1? u sure ure Pakatan Supporter? u didnt saw or read what ur Pakatan non-malay friend said about 'hak istimewa melayu'? are u sure u support the right party? of cos u didnt care becos its running on background u didnt realize its existence..ASB, Tabung Haji (do u know there's NO systematic hajj management entity ala TH in Singapore? all hajj pilgrim in singapore paid the whole package price with no subsidy unlike TH), gomen staff hiring policy, public university entry policy, land ownership status policy, this is just a few, but u didnt realize it, becos its running on the background..will u agree for all of this to be abolish?OK then if u not hate royal institution..u must be new here u never saw what ur Pakatan non-malay said about royal instution before in topic-related old teredsu have no idea what ur pakatan supporter think about all of my question topics that i mention..especially number 1 & number 2..ive been in /k/ long enough to witnessed it myself"
joe_mamak,20170425,Casual,Group: Junior Member,Posts: 333,200612,,Thank goodness I don't generalize all BN supporters to be like you.
xpole,20170425,Personal satisfaction,Group: Senior Member,Posts: 864,200912,From: Scotland,Make Malay people become one of the DAP leader is not a good idea. In the end they just a puppet. The higher party management pressure them to do this and that.
joe_mamak,20170425,Casual,Group: Junior Member,Posts: 333,200612,,And you say this based on what?
keown83,20170425,Getting Started,Group: Junior Member,Posts: 166,200909,From: penang wit love,"then why i see a lot in /k/ talking bad with the 'tongkat2' thingy? doesnt that when u didnt against it then u dont need to talk bad about it?dude..ive been in /k/ so long i have witnessed all the event in the old nuked tereds related to royal institution..it may be not u, but u are not the only oppo supporter, amiright?good..so that it shud be no words that accuse gomen play racial when selecting some malays to helm glc post..nah..i know u gud guy..i didnt ask u anyway, i ask the other guy, generalizing on the topic, just as same as how Pakatun love to generalizing pipu..ah please...im being realistic..race card played ALL THE TIME by both camp..'let melayu screw melayu?', 'lks just using mahathir to gather malay votes?'..c'mon...this is no 1990 that u can hide everything under a carpet..u want to prove that Pakatan truely multiracial & most of u guys dun have racial sentiment? i have an idea..how about Bersatu/PAN contested in many chinese majority area while DAP contested in many malay majority area? this next GE can be the best bet to prove that Pakatan & those who support Pakatan are trully non-racist society"
keown83,20170425,Getting Started,Group: Junior Member,Posts: 166,200909,From: penang wit love,"becos u are a gud guybut unfortunately the rest of ur Pakatun friends didnt have the same view as u did, thus the 'macai here, macai there, macai everywhere' singing towards me & those who critical to Pakatan"
joe_mamak,20170425,Casual,Group: Junior Member,Posts: 333,200612,,"Already said, I don't generalize.  You keep wanting to generalize, what can I do?  Sure, there are opposition supporters who are racist, who are not fond of the royal institution and many more.  But it isn't exclusive to the opposition supporters.  You are a fine example of someone who has issues with race else you won't be playing it up so much.  Also, there are opposition supporters who are not what you make them out to be.  Then there are those who are silent.  I have no idea where they stand.  But seems you already generalized them as well.  PH can jump through hoops for you but you still won't believe lah.  Stop it with your ideas lah.  I know what you are up to."
joe_mamak,20170425,Casual,Group: Junior Member,Posts: 333,200612,,"Heck, many from your gang also use the word macai."
deeplyheartbroken,20170425,Enthusiast,Group: Senior Member,Posts: 748,200811,,"It is because 2017, things are clearer now. Facts happened can never turned into tricks. Only DUMNO turn tricks into facts. You are the stupid one, don't drag all Malays into it.Twist and turn stories turning white into black. Worse than Dajjal itself.Mari makan dedak ni for posting fake info again and again."
Dyson Jin,20170425,On my way,Group: Senior Member,Posts: 538,201303,,"It's all about your mindsets..see u want to change or not only..u want forever like that then like that lo..in the end,we suffer together unless you're the top rank ppl..  If got brainwashed by bn that dap is anti-muslims or whatever ..they will forever think like that..approach how many times still the same  unless they decided to think deeply and change their mindsets..then got hope la..  kalah then kalah lo..in the end..suffer together only ma.."
ashestoashes,20170425,New Member,Group: Junior Member,Posts: 26,200905,,hm... lets see if what he said is truepakatan win GEmuhyiddin and mahathir party losePKR won but less than DAPPAN won less than PKR but since they're considered DAP they become the heromat sabu become PMenjoice
plain_white,20170425,Getting Started,Group: Junior Member,Posts: 189,201004,,"why are you so paranoid? it's already 60 years independence and u still enslave with racial politics...let me enlighten u about what majority of non malays want.First, let me answer those paranoid questions of your1. we hate misuse of power and marginalization of minorities. It will come to a time when ur hak istimewa is no longer relevant when the population of the privileged one increases and the minorities keep shrinking. That time, when you are the 80% majority, u r basically competing among yourself. The minorities are actually worried and many migrate to other countries because they felt as 2nd class citizen and not appreciated. If u keep harping about this keistimewaaan, someday you will lose the competitive edge and all other countries will take over us. It's already happening anyway. Of course, helping the needed one is essential for country buiilding, but unfortunately it has been implemented in a wrong way and some group still think they are the master race that cannot dipersoal. So u expect unity can be achieved through this way? we all love healthy competition and we are in the same boat called malaysia, if one keep stepping on another member, sooner or later, the boat will sink2. We don't hate royal institution. I don't know where u got the idea. 3. Again, this answer is linked to point no 1. We need capable people to run the country and of course GLC. It should not be based on skin colour. The fact that many people will die to defend asal orang kite mentality, means we have reach a cancerous state in the country. It sadden me..really...4. We don't care who is the majority as long as the country is run by capable person and is progressing well."
deeplyheartbroken,20170425,Enthusiast,Group: Senior Member,Posts: 748,200811,,"People like him already cannot be saved. Poisoned too deeply by DUMNO.His own stupidity, selfishness and racist thoughts; all applied it on others except on his master"
keown83,20170425,Getting Started,Group: Junior Member,Posts: 166,200909,From: penang wit love,"haih..delusional as fucukdont drag all Malay into it?fine..dun forget during this next GE, go & parade into malay area with the story about LGE saving malay girl on rape case & see their reaction..the most twist & turn was coming from Pakatun..too many twist & turn..now tell me what happen to all the 'mahafiraun', dictatorship & his cronies & he's illegal 'wealth' that oppo bruhaha so much during Tun M's 30 years of tenure..suddenly he's as clean as an angle, just becos he say sorry & he joined Pakatan?what a fucuking twist, the most twisted story ever in malaysia history"
waiora_protuner,20170425,Getting Started,Group: Junior Member,Posts: 230,201106,,"""In line with their commitment to equality, the DAP originally campaigned against Bumiputra privileges, such as those afforded to them by Article 153 of the Constitution.""from wiki though...might be not reliable facts to you..."
joe_mamak,20170425,Casual,Group: Junior Member,Posts: 333,200612,,I think this is about the difference in interpretation of Bumiputera position and Bumiputera privileges.  This has been discussed many times before.
kaffra,20170425,On my way,Group: Senior Member,Posts: 602,200410,From: Deutschland,"its their play of words, bumi special position in itself brings nothing. special privileges like those allocated under NEP however......"
silic0sis,20170425,New Member,Group: Junior Member,Posts: 31,200508,,"Tongkat thing is bad because it destroys the growth of malays, it destroys the social and racial harmony because it creates an us-versus-you situation, it's racist and it affects malaysian economy and growth.The thing is, you can't talk about multiracial multicultural when there's a racist policy and when the policy itself counters the ideology of a multiracial country.You can't antagonize the minority and then say you want racial harmony. It's like I spit on your face daily, but tell you not to be angry at me, it doesn't make sense.But the thing is, why does race even matter, why is there such a thing as hak melayu or concepts of chinese taking over. Race doesn't mean anything and it is something completely beyond our control, we are all humans in the end, what does it matter if one human or another human is in charge?The reality is, most malaysians probably have some mixed blood, ""pure"" malays are probably rare, many probably either have some chinese or indian or both blood. Some have middle eastern or western blood as you can see with royal family. I have some malay blood too although I'm not bumi. In the future there will be even more assimilation, the bloodlines will be even more mixed between races.The concept of ""privilege"" is flawed anyway, because it truly does not matter.If you are rich, would you be upset if another Chinese guy is also rich? Would you think, only I can be rich, you can't?If you are happy, would you be upset if another Chinese guy is also happy? Would you think, only I can be happy, you can't?Because that's what you're fighting for even though it may not appear that way. Think about what privilege is. It means I can have something but you can't which is totally flawed and unnecessary. As long as I don't hurt you or take away your rights or your ability to be happy or successful, why does it matter? We can both be happy and successful together.It is better for everyone, if everyone works together and be successful and happy together, and in reality that is the only way for the country to truly grow.About royal families and royal institutions, I guess it's tradition, like in the UK. But the country will be perfectly fine without them. As religious heads, in theory, they only have true value if they can hear God's voice, otherwise how are they different from anyone else. But if people want to keep them there and pay for their well being and pay for all their luxuries, then its fine, although it's actually a weird thing when you think about it lol. It's like if your great great great great parents were once kings, everyone in the country should pool their money together to pay for all your expenses and luxury goods. But if people want to keep royal institution in place because of tradition it's fine."
empatTan,20170425,On my way,Group: Senior Member,Posts: 684,201603,,"Frankly, I see no hope for Malaysia. It's already too late, too little, no matter who wins. Frankly.Pity. A beautiful country this."
waiora_protuner,20170425,Getting Started,Group: Junior Member,Posts: 230,201106,,whats the point of the position without the privilege?point me out to those discussion so i can 'read'....
joe_mamak,20170425,Casual,Group: Junior Member,Posts: 333,200612,,Here.  You might find this interesting - http://www.freemalaysiatoday.com/category/...ial-position-2/
joe_mamak,20170425,Casual,Group: Junior Member,Posts: 333,200612,,"I won't if I am able to stand on my own two feet.  Oh wait.  You are being sarcastic, aren't you?"
fazlythewarrior,20170425,Getting Started,Group: Junior Member,Posts: 173,200706,From: Kuala Lumpur,The thing is this LKS guy still survived until now even my grandpa already passed away and his grandchildren still can see his determination in politics. Memang stone cold.
joe_mamak,20170425,Casual,Group: Junior Member,Posts: 333,200612,,
silic0sis,20170425,New Member,Group: Junior Member,Posts: 31,200508,,"Not sure if this is what you meant, but the way you wrote it implies that you would fight for privileges if you can't stand on your own two feet.As in you want to work for position, but if you fail you still want there to be privilege system in place as a backup."
darth5zaft,20170425,Enthusiast,Group: Senior Member,Posts: 722,201202,,"stop trying to shame people Lah.nation state are racial segregation in nature.everyone get one so everyone is out of each other hairs.that just basic human natureto be faireveryone from Murica, france, Australia, Sweden, UK are playing the same far right game. assimilate or get the hell out is something you'll see in CNN all days long.even DAP are playing the same thing. how hypothetical it would seen to him when a group ask to be accepted but at the same time hates other pendatang be it suluk, Bangla etc etc?"
joe_mamak,20170425,Casual,Group: Junior Member,Posts: 333,200612,,"Oh, I won't fight for it.  But if I am down and out and it seems like there is no light at the end of the tunnel, I sure would be grateful for any assistance, not privileges."
joe_mamak,20170425,Casual,Group: Junior Member,Posts: 333,200612,,"He plays up race so often.  Others don't do it.  Why?  They are special and he is not?  Malaysia can be so much better as a country if race didn't feature so prominently in our day-to-day.  How about you?  You play up race like he does?  Or not?PSMalaysia is about integration, not assimilation.  Najib said to that effect."
silic0sis,20170425,New Member,Group: Junior Member,Posts: 31,200508,,"Maybe historically, but even historically, it wasn't necessarily about race but more about location. Like China was not formed because everyone in China was Chinese, but more because of territory and location and people of the location deciding to form into bigger groups, clans to states to nation.In today's world, we know ""race"" doesn't really mean anything other than skin color and some attributes like thicker lips or slant-ier eyes, so it doesn't really mean anything anyway. We're all humans in the end.You have to look at what assimilate means. Assimilating in those situations just means to accept the ideology of individual rights and freedoms.By hypothetical, I assume you mean hypocritical? There is a difference in quality of immigrants, for example would you accept immigrants that comprised only of KKK members? Of course not. Would you accept immigrants comprised only of nobel prize winners? Probably."
deeplyheartbroken,20170425,Enthusiast,Group: Senior Member,Posts: 748,200811,,"That's why people like you is a disease. Sendiri badan dan hati busuk enough already, don't drag the whole kampung into it.Please shut up and take the dedak. Any sane person will know you are A9 Pro user.But judging from your quality of replies, I would say you deserve only an old Dell Optiplex.Guessed your commission won't be good with all these counters."
Protoculture,20170425,Enthusiast,Group: Senior Member,Posts: 807,200410,From: MARS BASE,"DAP is a carbon copy of PAP.  Masalah utama DAP punya dream adalah living in Malay Bolehland post 13 May 1969 with NEP plus other Bumi priviledges continue to get strengthened by successive UMNO-BN regime.DAP wasn't as strong as now before. Before 2008 election, the Chinese bickers amongst themselves through Gerakan, MCA vs DAP.After political tsunami in 2008, DAP capitalised on overwhelming Chinese supports who had abandoned MCA and Gerakan by the droves.DAP also grew bolder. A few missteps with the Royalty of Perak. Then playacting with PKR in their games of throne in Selangor culminating with Langkah Kajang, which aftereffects costing the Pakatan Rakyat.And now, UMNO got what it wanted with painting DAP as the boogeyman. A surefire way to get Malay votes.Pas also has made DAP as mortal enemy no. 1. A confirmation on Muslim votes for sure.So now apart from PKR, DAP had to rely on sympathy Malay votes delivered by ineffective Amanah and ineffectual Bersatu that depended on a few dissatisfied UMNO supporters.All of that in the larger background upon which DAP is being perceived anti Malay, anti Royalty and anti Islam.Frankly speaking, DAP kena pikir sendiri. Kurang2 two largest Malay parties are waging political war against DAP,  almost representing two thirds of Malays. Then the Royalty that had seen a few DAP shenanigans not only in Perak but Selangor as well when RBA targeted attacks against the Crown Prince of Selangor just because Sultan not approving Langkah Kajang. That and DAP frequent brushes against Islam, whose power rested with the Malay rulers.Sendiri ingatlah, DAP for sure pikirlah sendiri."
Vola Moguli,20170425,New Member,Group: Junior Member,Posts: 15,201701,,"DAP perlu fikir sendiri..but mean time BN enjoying all those money sometimes, u jst have to let it go so everyone can suffer together....then only maybe they will be happy..inb4 GST 12%"
silic0sis,20170425,New Member,Group: Junior Member,Posts: 31,200508,,"Not sure how any of that makes DAP like PAP. But the reality is no political party in malaysia is anti Malay or anti Islam because malays represent the majority by a huge margin and for any political party to be successful, you need the support of the malays. The only parties that are anti Malay are malay based parties. It is like if a white guy stood in a middle of a crowd of black people and yelled, ""nigger!"". No white guy would do that. However, a black guy doing the same thing would be OK.Another thing that I think many Malays may not realize is, everyone wants Malays to be successful.If Malays are successful, there won't be a need for racist policies like NEP that tears the country apart. If Malays are successful, they won't have so much hatred for other races. If Malay's are successful, the country will grow at a much higher and faster pace, everyone will have more purchasing power. If Malays are successful, everyone benefits.The only people who don't want Malays to be successful, are those who benefit from keeping Malays down, who benefit from creating racial tensions and getting the majority to vote for them."
