Topic title: Pas receiving RM90 million from Umno,"Topic posted on: 10 Feb 2017, 08:49:00",Topic link: https://forum.lowyat.net/topic/4193888,"Topic scraped on: 02 Aug 2017, 03:28:21",
username,date,avatar_title,group,post_count,join_date,from,text
news channel,20170210,New Member,Group: Newbie,Posts: 0,201607,,"I see there is hope in PAS.* * *PAS today said it will be initiating legal action against Kelantan Amanah adviser Husam Musa, who had accused the Islamist party of receiving RM90 million from Umno.PAS deputy president Tuan Ibrahim Tuan Man has vehemently denied the allegations made by Husam.“This malicious slander follows those made by Sarawak Report, which is now the subject of legal action.“PAS will take legal action against him (Husam Musa) just like we did against the Sarawak Report,” he said on his Facebook page.Husam, in one of his lectures on video, that is going viral on social media, had claimed PAS had received RM90 million from Umno and that this was exposed by Sarawak Report.He also claimed that the money was channelled through Affin Bank.Tuan Ibrahim said the party’s lawyer had been told to review the allegations made by Husam before proceeding with legal action.Credit: http://www.freemalaysiatoday.com/category/...-against-husam/"
azhan82,20170210,Getting Started,Group: Junior Member,Posts: 240,201505,From: Klang Valley,huh? SR dateline was 20th ish last december and still no lawsuit against them..Now they want to sue Husam?dont tell me this is going to be another next tuesday episode....
news channel,20170210,New Member,Group: Newbie,Posts: 0,201607,,Donation is not crime.
soowky,20170210,New Member,Group: Junior Member,Posts: 10,200907,From: /kay/,sampai la x saman lagi
patnam,20170210,Getting Started,Group: Junior Member,Posts: 104,200608,,UMNO-PAS confirmed...
Big Balls Jackson,20170210,New Member,Group: Junior Member,Posts: 7,201402,,rezeki jgn ditolak
rupart,20170210,Getting Started,Group: Junior Member,Posts: 295,200912,,donation
evilsmile,20170210,Getting Started,Group: Junior Member,Posts: 63,200909,,It is said that both SR and Husam got evidence that Bijan gave dedak 90 million to several top PAS leaderThey are waiting for lawsuits and possibly election campaign before exposing it all
sonic31s,20170210,Getting Started,Group: Junior Member,Posts: 85,201604,,"PAS gets donation from ""orang kite"" dumno...Sure win la coming GE !"
The Sand Cat,20170210,New Member,Group: Junior Member,Posts: 7,201411,,Sure its indirect funding lah
zeese,20170210,Warning Level,Group: Senior Member,"Posts: 1,341",200501,From: Kuala Lumpur,I though the lawsuit has been filed in UK?
pakmulau,20170210,Getting Started,Group: Junior Member,Posts: 128,201603,,nanti hari jumaat kita samankau tunggu kau tunggu
-Aktan-,20170210,2.6b dah masuk bro,Group: Senior Member,Posts: 779,200912,,Why kit Siang photo there
peja5081,20170210,Getting Started,Group: Junior Member,Posts: 131,200709,,Title misleading ppl.. news channel this day
peja5081,20170210,Getting Started,Group: Junior Member,Posts: 131,200709,,Being accused?recieving money
news channel,20170210,New Member,Group: Newbie,Posts: 0,201607,,Triggered!
Pete the great,20170210,Getting Started,Group: Junior Member,Posts: 204,201307,,Why got lim kit siang pic?
news channel,20170210,New Member,Group: Newbie,Posts: 0,201607,,Gambar hiasan
yokoloco,20170210,On my way,Group: Senior Member,Posts: 594,201406,"From: CatCity, Sarawak",Next Tuesday kasi sue!!!
azhan82,20170210,Getting Started,Group: Junior Member,Posts: 240,201505,From: Klang Valley,"I have no idea...PAS gave SR until 20th ish to retract the report/article and issue an apology or action would be taken..Until today, no action has been taken lolFMT and their editors...Seriously..They really like to update graphics and headings so late. At least make it proper before posting it online...."
SliparJepun,20170210,Getting Started,Group: Junior Member,Posts: 87,201306,,BR1M
news channel,20170210,New Member,Group: Newbie,Posts: 0,201607,,"Ok, Pas got how many members? Must distribute fairly."
palgo47,20170210,Getting Started,Group: Junior Member,Posts: 196,200610,,PAS logo = mata duitan
mousqy,20170210,Casual,Group: Junior Member,Posts: 492,200808,,lol tok tok agama pun leh kena beli CASH IS KING
carloz28,20170210,Getting Started,Group: Junior Member,Posts: 271,200810,"From: Kuala Lumpur, Malaysia",Then Go and sue la hamkaling. Wait for next Tuesday meh....
zeese,20170210,Warning Level,Group: Senior Member,"Posts: 1,341",200501,From: Kuala Lumpur,"You just made me curious to google for the news, because it's either the news I found is inaccurate, you just simply telling whatever you like (didnt check the fact). http://www.freemalaysiatoday.com/category/...sarawak-report/lawsuit takes time... it takes many many many years to finish. Its not like today appoint lawyer, tomorrow can trial in court already."
yugimudo,20170210,Casual,Group: Junior Member,Posts: 475,201203,,"Hari ni kelantan cuti, lawyer ofis tutup."
lunatique,20170210,Casual,Group: Junior Member,Posts: 487,201101,,"Minister say opposition parties have to generate own funds.  PAS receive donation in form of funds from ruling coalition party,  which the minister is from.  Kesimpulan:PAS = ruling coalition parties?"
hickups,20170210,Casual,Group: Junior Member,Posts: 437,200301,From: Klang,Sembang kencang lar
azhan82,20170210,Getting Started,Group: Junior Member,Posts: 240,201505,From: Klang Valley,Next Tuesday?
ALeUNe,20170210,I'm the purebred with aristocratic pedigree,Group: VIP,"Posts: 9,582",200301,From: Mongrel Isle,"Salah LGE and DAP, nonetheless."
news channel,20170210,New Member,Group: Newbie,Posts: 0,201607,,kekekekekekekekekekeke
jGuyz,20170210,New Member,Group: Junior Member,Posts: 14,201002,From: ????,
Spectreoutreach,20170210,Casual,Group: Junior Member,Posts: 348,200801,,Just sue . why talk so much
bcth928,20170210,New Member,Group: Junior Member,Posts: 25,200606,From: HELL,halal ke?
neoexcaliber,20170210,Getting Started,Group: Junior Member,Posts: 67,200501,,It doesn't take years to file a legal complaint.
cikalakacikaci,20170210,Getting Started,Group: Junior Member,Posts: 69,201306,From: kl.klang.,janji niat betolowai
carloz28,20170210,Getting Started,Group: Junior Member,Posts: 271,200810,"From: Kuala Lumpur, Malaysia","""Lawsuit takes years and year to prepare""What a load of crap from zeese. It's a simple defamation suit it's not like fckin OJ Simpson murder case or ppl vs Larry flynt case or anywhere close to that scale. Either PAS doesn't have the balls to deal with it or too illiterate to engage a lawyer. Bet their sorry asses that they are still collecting funds from various mosques to pay damages done to LGE."
MsGaijin,20170210,New Member,Group: Junior Member,Posts: 29,200812,,"Semua perli PAS tak saman SR sejak Oktober 2016, walaupun lawyer PAS, Takiyudin Hasan dah maklum PAS, through their solicitiors dah hantar Notice of Demand in Dec 16 (despite SR Editor alleged that PAS has yet to serve the notice).Kalau tu pun dah pelik, siap perli PAS macam Ah Jib dan ""Tuesday-nya"", jangan lupa pandang pelik tang DAP seperti dimaklumkan LKS dan LGE nak saman PAS over RM1.2Billion allegation, since January 2016 and more than a year later (well now we're already in Feb 2017, right?) nothing happen."
epsonstylux,20170210,"I said ""Good Day!""",Group: Senior Member,"Posts: 1,024",200710,From: Damansara,Like we did? SR claim no legal suit from PAS
and85rew,20170210,Red Devil,Group: Senior Member,Posts: 646,200605,From: Kuching,pas bodo
carloz28,20170210,Getting Started,Group: Junior Member,Posts: 271,200810,"From: Kuala Lumpur, Malaysia",Notice of demand is just a fckin notice as the name implies. It's not a document saying they are taking officially legal action towards the perpetrator. It's just a reminder which literally translates that PAS hasn't sue yet. Tolong baca sikit sebelum nak tunjuk hero
slimey,20170210,,Group: Senior Member,"Posts: 4,874",200704,,Pas bankruptBrownie points for umno. Mca and mic better watch their back
ocphangaz,20170210,On my way,Group: Senior Member,Posts: 685,200411,,ini salah DAP ma... standard.
EternalC,20170210,"Take what you can, give nothing back",Group: Senior Member,Posts: 800,200704,From: the sins never die,lks new leader of pas ka?
Big Balls Jackson,20170210,New Member,Group: Junior Member,Posts: 7,201402,,Hadi is just a cheap imitation of Dr.M
news channel,20170210,New Member,Group: Newbie,Posts: 0,201607,,I put Lim Senior there my topic can reach 3 pages.
PappyBoyington,20170210,Getting Started,Group: Junior Member,Posts: 142,201606,,Dec 20 is the deadline.. not sure what's happened sincehttp://www.themalaymailonline.com/malaysia...-sarawak-report
MsGaijin,20170210,New Member,Group: Junior Member,Posts: 29,200812,,"Eh memang pun, it is just a notice giving warning to the receiver, upon failure to fulfill the demands, legal action will be taken against the receiver. Ada ke aku kata PAS dah serve Summons ke SR? Kau ni sembang nak tunjuk hero, remind aku suruh baca, yang kau tokok tambah ayat aku siapa benarkan? BTW, aku perli DAP coz gung ho nak saman PAS pasal RM1.2billion offer by Yeastrael, jangankan saman yang harus pun tak difailkan, notis yang bersifat ""professional courtesy"" pun tak jentik."
cckkpr,20170210,Look at all my stars!!,Group: Senior Member,"Posts: 4,193",201004,,"After Tuan Guru Nik Aziz pass on, now all become Ular Maks.Sad, using religion to promote selfish needs rather than for the betterment of mankind and the country."
TheReaderReads,20170210,On my way,Group: Senior Member,Posts: 679,201101,,Ni PAS ada sembayang lagi x?
bamkai,20170210,Getting Started,Group: Junior Member,Posts: 110,201001,,Kan dah cakapMoney is king
HiroBoroi,20170212,Regular,Group: Senior Member,"Posts: 1,199",200903,,"Somehow I think PAS (the party) yang suci, didn't receive any money   . But the individual Ularmuck .... that is why rasuah tak potong tangan."
damonlbs,20170212,Casual,Group: Junior Member,Posts: 371,200505,From: KL,"Isu dana RM90 juta hanya helah Husam, kata Hadihttp://www.freemalaysiatoday.com/category/...usam-kata-hadi/KUALA LUMPUR: Tindakan Penasihat Amanah Kelantan, Datuk Husam Musa membangkitkan isu berkaitan dana RM90 juta hanyalah helah untuk tidak mahu bertanding pada Pilihan Raya Umum ke-14. Presiden PAS, Datuk Seri Abdul Hadi Awang berkata sekiranya isu RM90 juta dibawa ke mahkamah dan Husam dijatuhkan hukuman, kelayakannya untuk bertanding akan hilang. “Saya merasakan beliau (Husam) tidak mahu bertanding PRU akan datang. Jadi, beliau buat begitulah (bangkitkan isu RM90 juta). Kalau bawa ke mahkamah benda bohong, apabila kalah sudah tidak boleh bertanding dalam PRU. “Kalau tidak mahu bertanding, beritahulah supaya senang,” katanya selepas merasmikan Konvensyen Kebajikan PAS di Auditorium Majlis Perbandaran Ampang Jaya (MPAJ), hari ini. Berdasarkan Perkara 48(1)(e) Perlembagaan Persekutuan, seseorang ahli Parlimen boleh dilucutkan kelayakan jika dijatuhi hukuman penjara lebih setahun atau didenda lebih daripada RM2,000 oleh mahkamah.Sebelum ini, Husam mendakwa beliau mempunyai butiran berkaitan dana RM90 juta yang didakwa ada kaitan dengan PAS. Kata Husam, dana berkenaan disalurkan ke dalam akaun di Affin Bank.Husam sebelum ini dipecat daripada PAS pada Mei 2016 atas dakwaan melanggar disiplin membayangkan akan menjelaskan mengenai butiran dana itu menjelang PRU akan datang. Jumaat lalu, Naib Presiden PAS Datuk Tuan Ibrahim Tuan Man berkata PAS menganggap kenyataan Husam mengenai dana itu adalah rantaian daripada fitnah dibuat Sarawak Report sebelum ini. PAS menafikan sekeras-kerasnya tuduhan Husam itu. “PAS akan mengambil tindakan undang-undang ke atas beliau (Husam) sebagaimana kita ambil tindakan kepada Sarawak Report,” kata Tuan Ibrahim. Pada Ogos tahun lalu, Hadi berkata akan mengambil tindakan undang-undang terhadap Sarawak Report, laman pertama yang membangkitkan dakwaan itu. PAS menyerahkan surat tuntutan kepada editor Sarawak Report, Clare Rewcastle-Brown pada 13 Disember lalu, antaranya meminta laman itu menarik balik artikel berkaitan dan menyiarkan permohonan maaf. Setakat ini, tiada prosiding mahkamah melibatkan PAS dan Sarawak Report"
HiroBoroi,20170212,Regular,Group: Senior Member,"Posts: 1,199",200903,,"Ularmuk PAS ni paham ke English?   p/s - As for malaysian judicial system, AG pun boleh kena tendang how?    So much confidence there."
