LamboSama,20170330,Getting Started,Group: Junior Member,Posts: 67,201108,,With the amount of phones being used in cinemas.Might as well leave the lights on.
keown83,20170330,Getting Started,Group: Junior Member,Posts: 166,200909,From: penang wit love,"didnt i told already east coast states are not economically developed & connected compare to west coast states? they lack the supported infras & gateways which cost a bomb if they want it to be build which they direly needs federal help for itdo they have a capable seaport like Port Klang?do they have well-connected & systematic highways/railways from kelantan to pahang to johor?do they have international airport like KLIA & Penang?they lack all of this..not just kelantan but also terengganu & even pahangSabah is lucky becos of this; agriculture, timber, palm oil, petroleum & tourism..their land for agriculture are more vast than east coast states combined & their shore are much better then east coast..plus, kelantan dun have petroleum royalty while sabah enjoy the royalty..sabah alone have 8 portsso, thats the differentnext time, take a look at every angle"
Einjahr,20170330,New Member,Group: Junior Member,Posts: 14,201012,,"So much loser talk which sez nothing  but giving lame excuses.  In the Borneon states, we have a frigging cabbotage policy, yet  that didn't stop us.  Maybe if Kelantan was serious from the start at developing its ECONOMY, the federal government will start taking it seriously but lol what have they done for the last 60 years apart from producing tahfiz grads?  Whadda heck man, Kelantan is so much closer to highly urbanised parts of Malaysia compared to Sabah and Sarawak and they still cant pull it off ? even after 60 years?"
bigwolf,20170330,Getting Started,Group: Junior Member,Posts: 227,201108,,And their solution is? Separate moviegoers by gender & keep lights on...
weyyt,20170330,Getting Started,Group: Junior Member,Posts: 82,201202,,fuck it.I will vote BN rather than PAS.
neoFluidic,20170330,New Member,Group: Junior Member,Posts: 47,201408,,PaS/bn macai come defend???
Vape [On],20170330,Regular,Group: Senior Member,"Posts: 1,069",201511,,try again
keown83,20170330,Getting Started,Group: Junior Member,Posts: 166,200909,From: penang wit love,"like i said, those is just a few..they choose to stay with PAS..many others also born, got early education in kelantan under PAS ruling then later contributed in education, science, engineering, R&D, medical, etc2 either to other state, federal or international..& they did well..we hardly saw any of them become terrorist even though they lived under PAS ruling during their young age..they are not under political radar so they are hidden from public view, just like everyone elsedo u mean that even PKR/DAP didnt contribute anything about R&D math & science on general level?like i said..what u read in the media u choose to read doesnt necessarily means that is what it is through & throughu choose to believe in anything u want to believe based on source u choose to read..so dun blame PAS for itbtw, the bolded part..can u be more specific? when did PAS taught that in this modern days? any source?"
Einjahr,20170330,New Member,Group: Junior Member,Posts: 14,201012,,err you really cant claim credit on behalf of Kelantan for those who fled the state seeking greener pastures elsewhere. Thats because its so fail that nobody wants to go back and stay there.
SomaCruz89,20170330,Getting Started,Group: Junior Member,Posts: 218,200902,,Konlanfim keown83 is a PAS cybertrooper.Bodo
bigwolf,20170330,Getting Started,Group: Junior Member,Posts: 227,201108,,BN trooper actually. Only recently they start rahrahrah for pas. So you can guess who is abang adik now
and85rew,20170330,Red Devil,Group: Senior Member,Posts: 646,200605,From: Kuching,not even ruling the countryalready this retardwon't effect others la they said..ptuih
slimey,20170330,,Group: Senior Member,"Posts: 4,874",200704,,education is under federal. lel lel lel
empatTan,20170330,On my way,Group: Senior Member,Posts: 684,201603,,We'll all b fucking thru a hole in d sheet soon...
danieln,20170330,On my way,Group: Senior Member,Posts: 604,200802,,lol..so how sure you will be pumping the right hole then?
keown83,20170330,Getting Started,Group: Junior Member,Posts: 166,200909,From: penang wit love,???do u mean those who born & grew in kelantan shud stay in kelantan & cannot go out? Kelantan gomen can claim the credit because the kelantanese are born & grew & got early education in kelantan under PAS ruling within environment that's got PAS influence..their childhhood education under PAS ruling has helped them to be who they are now..& MOST OF THEM ARE NOT TERRORIST..thats the proof of PAS early education for themi see many sabahan working outside from sabah..are u telling me they fled from sabah becos sabah is terrible & breeding terrorist?
automan5891,20170330,New Member,Group: Junior Member,Posts: 16,200909,,"If you are an idiot and crazy, better to be the best idiot and best nut job there is!"
automan5891,20170330,New Member,Group: Junior Member,Posts: 16,200909,,separated by genderawesome!!! gay and lesbian sex time!!!
Einjahr,20170331,New Member,Group: Junior Member,Posts: 14,201012,,"You cant compare Sabah and Kelantan We are still more urbanised and practice open economy, unlike KelantanKelantan is last place in the list of GDPWhy do you think youngsters dont wanna come back ? Nobody wants to go back to that shithole"
Songlap,20170331,New Member,Group: Junior Member,Posts: 28,201302,From: Putrajaya,7 pages only
Troller,20170331,New Member,Group: Junior Member,Posts: 17,201203,,gay enjoice !!! tak payah takut kena tangkap ... semua lelaki dalam cinema ... tak bole tuduh semua gaysame goes to aweks
awongck,20170331,Casual,Group: Junior Member,Posts: 367,200706,,"Hes so holy that stupidity has enlightened him to epic levels, thats why he can spew such drivel from his stupid mouth"
