AllnGap,20170425,[ Modding with Passion(tm) ],Group: Senior Member,"Posts: 3,735",200301,From: Penangites,"answer me this 2 question first1. how is it possible to raise 70% of the population to become successful ? is it mathematically possible ? any other countries have done it ?2. why malays still feel they are poor where government every year dish out so much things to bumiputera ?3. where all these money for malays coming from1. mathematically impossiblein other countries, protection policies are meant to raise the status of the minority. not the other way round because it is mathematically impossible to do so. like in the US, they did this by giving red indian casino license, that is their privillege (population of 2%)why i said mathematically impossible ??government cant even channel money to the poor (pitiful BR1M cant even offset GST), u still wanna dream that BN can make you rich.2. bumiputera rights vs privillegenormal malays are born with position, but only those in the line of political power are given privilege.like a piece of AP license is worth RM 30k, one year basically government giving free RM 2Bil out in AP.who's getting it ? you're normal malay, need to work with normal salarySyabas CEO, one year salary with bonus is near to RM 9mil. one month 750k. his salary package is 250 ppl of RM 3k. so i give u 2 options. option 1.make that CEO rich by giving him 750k per month. he one person happy. option 2make 250 ppl richer by giving them 100% increment from 3k gaji to 6k gaji.so u prefer to make one fella super rich or make 250 fella give their family better life ??3. where all these money to lift malays coming from ??"
kidmad,20170425,Look at all my stars!!,Group: Senior Member,"Posts: 3,397",200507,,i actually starting to dislike KS... so old ady still easily get butthurt... Stop reacting to every statement especially those with racial and religion element in it la.. Parliament show monkey face adui... How la want to win GE this year..
~Sherlock~,20170425,New Member,Group: Junior Member,Posts: 39,201010,,If parliament speaker is Malay scared what? He can just disallow any bill from DAP about hak istimewa or anything controversial.
AllnGap,20170425,[ Modding with Passion(tm) ],Group: Senior Member,"Posts: 3,735",200301,From: Penangites,"all these are old mindset, only applicable apply to your atuk's time. it's all about race, NOW this country is already opened up to the world.to be honest if u see government policy now and for future1. wastage of funds and failures of projects (cow put at condo, 1mdb, felda FGV, tabung Haji related investment)2. importing of foreign worker (bangala)3. opening up to aggressive china investment that don't have spillover effects4. removal of subsidies n funds  (cooking oil, sugar, tepung) (education, hospitals)5. failure of government in controlling prices of necessity items (TNB, petrol, properties)6. government unable to absorb more civil force.7. give u BR1M but can offset GST ??8. crazy government debt expansion under najib's term9. government cut MARA n various bumiputera funding10. can you buy property with current income ? chances are, u will be crushed by poverty ( kesempitan hidup).so do u see all these as danger to your way of life ?"
AllnGap,20170425,[ Modding with Passion(tm) ],Group: Senior Member,"Posts: 3,735",200301,From: Penangites,thats the ultimate fear which is sold to the malays in order to gain power.YDPA has the ultimate say in this matter alone.
n0kur0,20170425,New Member,Group: Junior Member,Posts: 16,201408,,"tipu la,madey & moyeden terang2 ckp ko anti islam & anti melayu.takkan la madey sembang kosong selama 20thn jadi pm.lel."
Protoculture,20170425,Enthusiast,Group: Senior Member,Posts: 807,200410,From: MARS BASE,"Baca bagi habis, hadam betul2. Aku post DAP memang carbon copy PAP .. why? Sebab konsep Malaysian Malaysia tu dicanang ketika backdrop pre and post 13 May 1969. Post 13 May 1969, every non-Malay political parties had to acknowledged that Malay hegemony is the way to grip power at Federal level. Even Gerakan one of the largest non-Malay opposition party had to join BN for political survival sake.Bagi DAP, NEP adalah boogeyman ... benda ni konsisten hingga sekarang. Even DAP went apeshit as Mahathir renewed NEP for the second time in 1990s.Then Mahathir and his Mahathirisme become the new boogeyman for DAP in 1990s up to early 2000s. Then PR come and go as Najib become the new boogeyman as DAP capitalised handsomely on Chinese tsunami.Yang silapnya bila DAP acah2 cuba tunjuk lagak biadap Royal Institution in Perak dan RBA launched smear campaign against Crown Prince of Selangor. Dua kali bhai.Lepas tu tolong sama Lapuiji dan backup Langkah Kajang .... yang aftereffects finally saw PR breakup, Anwar in jail, Pas splintered .... so you think Malays in oppo pun tak notice ke?Eh aku pun lagi lama menentang UMNO regime since aku politically matured. Tapi tengok DAP punya shenanigans since 2008 macam kera dapat bunga siap acah2 biadap kat Royalty, sampai nak masuk campur games of throne dalam Malay oppo politics di Selangor sehinggalah one of the most powerful oppo blocs in history ie Pakatan Rakyat hancur lebur.So jangan cerita la idealistics or rhetorics or whatever when realpolitics shown differently.And yes, never in my 38 years of age ever seen divisiveness like the current political struggle in 2016-2017.Its all gone down to its either us vs them mentality, Malays vs Chinese ..... itu realiti kat grassroot level. Bila two thirds of Malay majority rasa DAP public enemy no. 1, things ain't that easy for DAP led PH.So hadam. DAP kena pikir along the way macam mana nak damage control a few missteps yang dilakukan from 2008 till now.Sedangkan Indonesia yang level Republik pun dah berapa kali hentak Chinese, kat Philippines Chinese pun hanya cukur dapat menten bisnes, dekat Thailand Chinese kena held in check by military and Royalty .... Malaysia?Malaysia je Chinese betul2 ada political power to atleast effects a few changes for the benefits of Chinese in Malaysia. Ada la something dari takde langsung.Even Singapore got kicked to the curb in 1965 from Malaysia should thanked its lucky stars to become the most successful Chinese polity ever sans Taiwan and China."
xcxa23,20170425,Enthusiast,Group: Senior Member,Posts: 796,201011,,"At least dap din manage to be as successful as current gomenhttps://forum.lowyat.net/index.php?showtopic=4271912&hl=Hutang Abu Dhabi US$1.2 billionAnd potential another hutang US$3.5 billionTahun Ni kena selesaikanKalau Tak, kena penalty la tuThen again, most not all Malay don't give a shit about country well-being.."
Awsomener,20170425,New Member,Group: Junior Member,Posts: 25,201210,,
buysellaccount,20170425,Getting Started,Group: Junior Member,Posts: 116,201110,,"maybe you should refrain from commenting if you're not planning to contribute.nga kor ming's talks in bercham, ipoh pulls no punches with his lawan melayu sentiment. dap is still harbouring potty mouth hew kuan yau despite all the dumb things he's said to undo all the goodwill among malays dap have worked so hard for."
@zan65,20170425,New Member,Group: Junior Member,Posts: 19,201612,From: Penang - Skudai,Throw this exact questions to the chinese. Top riches in Malaysia are chinese and what the hell they do with their money while their fella chinese still complain being discriminated till today.
LamboSama,20170425,Getting Started,Group: Junior Member,Posts: 67,201108,,Malay shouting majority rules?Aren't people who say those usually people who place democracy above all else?That's why having a majority means nothing.Minority that are in power can always take it away.
gsem984,20170425,Getting Started,Group: Junior Member,Posts: 126,201510,,"we will become like indonesia, for sure."
AllnGap,20170425,[ Modding with Passion(tm) ],Group: Senior Member,"Posts: 3,735",200301,From: Penangites,"LMAO, the complaints are government discrimination policies complaints.nobody will complain if government are helping the poor and needy."
@zan65,20170425,New Member,Group: Junior Member,Posts: 19,201612,From: Penang - Skudai,Discriminated and top riches are chinese? yeah right.
slimey,20170425,,Group: Senior Member,"Posts: 4,874",200704,,"dei bodo. millionaire represent how many % of population? you generalise, you bodo"
AllnGap,20170425,[ Modding with Passion(tm) ],Group: Senior Member,"Posts: 3,735",200301,From: Penangites,"LMAO, u think every chinese is rich ??fukken LOLyou are down right racists"
@zan65,20170425,New Member,Group: Junior Member,Posts: 19,201612,From: Penang - Skudai,So u expect every chinese have to be millionaire to justify the absence of discrimination? lel
silic0sis,20170425,New Member,Group: Junior Member,Posts: 31,200508,,"I still don't see how any of that makes DAP a carbon copy of PAP.Are you saying NEP is good or bad? You're not clear. Nothing you're saying is anything new though.Both sides have problems, both sides have corruption. What is your point here with this post? Only 1 side truly pushes racism and division of races. I think you won't deny that. The reality at grassroot level that you mention is only malay reality due to divisive politics. It's really stupid anyway, malaysian Chinese population is only 23 percent and dropping. It'll be below 20 percent before long. Chinese are not a threat to malays, the threat to malays are other malays who take advantage of malays for their own gain. Nothing I've said is counter to whatever real politics have shown."
@zan65,20170425,New Member,Group: Junior Member,Posts: 19,201612,From: Penang - Skudai,Tell that and nobody believes.
buysellaccount,20170425,Getting Started,Group: Junior Member,Posts: 116,201110,,"yes, it's true he's not a dap member anymore but he's still hanging around with his dap buddies. we'll see for ourselves in the coming election. he will be around. all political parties have use for a firebrand like him.but i'm an lge fanboy, so my delusional bubble is telling me that lge has a hands off approach with perak and he has no say over hew's conduct."
slimey,20170425,,Group: Senior Member,"Posts: 4,874",200704,,lol more bodo statement. shooting your own foot somemore.
@zan65,20170425,New Member,Group: Junior Member,Posts: 19,201612,From: Penang - Skudai,Should I response to this wasted??? hmmmm..nope. I deny myself being as low as this^
@zan65,20170425,New Member,Group: Junior Member,Posts: 19,201612,From: Penang - Skudai,"LEGAL is too much to define here. So the only conclusion is Taib is not discriminated. You can't be rich and at the same time discriminated. The two terms are not getting along.Well, there are so many statement by yours that require verified sources."
silic0sis,20170425,New Member,Group: Junior Member,Posts: 31,200508,,"I don't think anyone can deny there is discrimination. There is NEP and that is discriminatory.The only argument you can have is the level of discrimination. So, there is discrimination and you argue top riches are chinese, if that is true, what do you think is the reason malays aren't at the top together with chinese even with all the extra perks of being a bumi?"
ciwi1166,20170425,~~~Prestissimo~~~,Group: Senior Member,"Posts: 2,000",200612,From: In your head...,arguing and divided yup? looks like UMNO/BN just need to eat popcorn this coming GE.
silic0sis,20170425,New Member,Group: Junior Member,Posts: 31,200508,,"Of course you can. Let's say for example the discrimination is no chinese can enter college or university in malaysia. You can still end up being successful without having gone to college or university, but it doesn't take away the fact that there was discrimination.Discrimination makes it harder to be successful and depending on the severity of the discrimination it can make it impossible. In Malaysia it's not impossible, just harder."
@zan65,20170425,New Member,Group: Junior Member,Posts: 19,201612,From: Penang - Skudai,The extra perks of being chinese is their numbers is way smaller and the wealth distribution is way better. Whilst the bumi? the extra perks when divided into millions means almost nothing (example? Uitm).
@zan65,20170425,New Member,Group: Junior Member,Posts: 19,201612,From: Penang - Skudai,"It is not a discrimination in my view, it is a fair distribution between races so together can progress."
silic0sis,20170425,New Member,Group: Junior Member,Posts: 31,200508,,Wealth distribution is national level and inter-racial though. It's not like the malay and chinese community and businesses don't mingle it work together. We're all together in this as Malaysians. The success of malaysia is very dependant on the success of malays because of how big a majority the malays are.
slimey,20170425,,Group: Senior Member,"Posts: 4,874",200704,,more retarded statements/assumptions..........making an ass out of yourself
buysellaccount,20170425,Getting Started,Group: Junior Member,Posts: 116,201110,,lol. politically mature?like you how dismisses people's fears and worries and just shut them up by labelling them as racist like an sjw?pls dun be sinkalan.
silic0sis,20170425,New Member,Group: Junior Member,Posts: 31,200508,,"That is probably what people believed as well in the past and that is why everyone was ok with it. Non-bumis were ok with giving away some rights to help malays grow and develop because it is understood that for malaysia to progress to the next level, malays have to first develop to the next level since malays are the majority. But realistically, in nations where similar affirmative action policies have been implemented, the outcome is negative. For example with blacks in the US. There is quite a lot of research on this topic and it's heavily debate but the numbers are the numbers.The NEP was also meant to be temporary, but it didn't achieve what it set out to do. My opinion is that in general, there is no shortcut to success. For a group of people to develop and become successful, you can't give quick handouts and expect them to suddenly change and become successful. They will remain the same and instead end up relying on the handouts. You have to change the culture of the group and change the mentality and mindset, through various means like education. The change won't be instant and the results won't be instant."
+3kk!,20170425,Look at all my stars!!,Group: Senior Member,"Posts: 7,850",200605,,"simple, those 8 million jews have guns , are of different nationality and dont like muslimsthe 23% have no guns, are of the same nationality, and frankly wont want nasi lemak to fall to anyones hands especially the singaporeans."
silic0sis,20170425,New Member,Group: Junior Member,Posts: 31,200508,,He was being sarcastic but yeah your answer has some truth lol.
waiora_protuner,20170425,Getting Started,Group: Junior Member,Posts: 230,201106,,"1) The initial reasoning is not to be successful but to narrows the gap. The reason why NEP took place. After which 'big' event? Realise that.2) Dont you know that 20% have 80% of the wealth? Thus it means that 80% is in the lower median. Does what ever 'helps' the organisation done were to help this 80% populations. You dont operate a company, dont you? Should know that...3) Red indian is the 'bumis' of the US. Doesnt matter the %. Its their rights. If that so why they didnt help those minorities from Mexico, or African indeed?4) Again, you just dont know how a company works. Would you say the same thing with CEOs from US? Apple or Microsoft as an example? Doesnt matter if its GLC or not, a company is still a company. It operates that way. And luckily they hires those with their 'rights'. Like Petronas or Proton. That didnt help?5) From where those money to lift Malaysia comes from? Tell me? JJPTR?"
@zan65,20170425,New Member,Group: Junior Member,Posts: 19,201612,From: Penang - Skudai,"Wealth is not shared between races. My saving and your saving are not shared. Majority of Malays are salary people, farmers, and small-to-medium business owners whilst the chinese are way advanced in business.The fair distribution in education per your example is necessary to make sure everyone can progress fairly. In the future, let's say, the Malay is progressing overwhelmingly, the chinese rights for equal education is tightly secured."
buysellaccount,20170425,Getting Started,Group: Junior Member,Posts: 116,201110,,"see? sinkalan reply. since you're going the asperger route, i'll leave you to yourself."
+3kk!,20170425,Look at all my stars!!,Group: Senior Member,"Posts: 7,850",200605,,"theres no such thing as ""everyone can progress fairly"", that only happens if you have a situation where the government taxes the rich by a bit (the scandinavians and stuff) then hands it down to the poorbut no one likes taxesso erm ya"
hotjake,20170425,Getting Started,Group: Junior Member,Posts: 82,201011,,"there used to be sizable number of jews in irag, jordan, bahrain, jordan, kuwait, oman, qatar, saudi, uae, yemen. where are they now a? kek historians"
slimey,20170425,,Group: Senior Member,"Posts: 4,874",200704,,"lol. 1. poverty is blind to race. any one can be in poverty regardless of race. 2. NEP as a policy is a failure if it is meant to help the poor. reason : the rich continue to benefit from it. it helps a certain group regardless whether they are rich or poor. but the rich can manipulate the system and benefit more from the policy, increasing the wealth gap."
Forum68,20170425,Getting Started,Group: Junior Member,Posts: 56,201605,,When are malaysians going to be talking along non racial lines?Its not the race that is important lah -its the competency of that person to be a good leader and serve the rakyat..not own pockets. The Malays have to figure it out themselves then changes will come...education is the keyBut to be realistic..maybe we will reach that color blind status in no less than 100 years...meantime we can continue to debate until d cows come home...nothin will change in the near future.
buysellaccount,20170425,Getting Started,Group: Junior Member,Posts: 116,201110,,"yes, fair is definitely the wrong word. maybe people would be more accepting if they start calling it welfare."
slimey,20170425,,Group: Senior Member,"Posts: 4,874",200704,,you tak suka you pergi communist korea. everyone receive same salary happy?
crazee,20170425,Getting Started,Group: Junior Member,Posts: 92,200506,,This
silic0sis,20170425,New Member,Group: Junior Member,Posts: 31,200508,,"We're talking about wealth distribution right? Or wealth shared and inherited between parents and their children?My money is spent on business and products owned and produced by malays and chinese and indians. Your money is spend on business and products owned and produced by malays and chinese and indians.It's not necessary but it helps. The quota itself makes it unfair. The way it should work is based on merit system. If you do better in school, you have better chance of being accepted. That way, students end up working hard in school so they can have a place in higher education, and perhaps at a better institute.Basically, there should be personal responsibility. If you want to succeed, you have to work at it and for it. If you want to go to a top uni, you have to work hard in school."
@zan65,20170425,New Member,Group: Junior Member,Posts: 19,201612,From: Penang - Skudai,"The objective of NEP is good. To overcome income disparity between races. Why defined based on races not need? well history shows that disparity between races is very unwell for national development. But maybe the execution has not been perfect. Plus, we tend to look at the small negative sides and ignoring the positive it has created so far since sometimes it does not inline with some of need or desire. As you and I suggested, the education is one way increase the malay socio-economic so desperate the numbers is so high (increasing), institution like uitm (well you know the quality already) has to exist to cope with the Malay the whole nation want them to progress."
hotjake,20170425,Getting Started,Group: Junior Member,Posts: 82,201011,,let's promote mediocrity in the name of fairness
+3kk!,20170425,Look at all my stars!!,Group: Senior Member,"Posts: 7,850",200605,,"we did, untill political season and people listen to politicians againseriously the politicians are cancer, shut them up and we will be okbut msians love their mid evening squabbles doubt so, i posted some links and guides to donate to kelantan one point in time. got relegated to second page faster than a dupe postings.reality is, people in /k/ at least, dont really give a shit about the poor or helping people"
drajm,20170425,New Member,Group: Junior Member,Posts: 38,200712,From: Kuala Lumpur,"we should separate being successful with being rich.do you want to be a ceo/ prime minister?do you want rolex? ferarri?as i get older, i think no way. you will realise it when you get older.you just want a quieter life , see your kids grow and have comfortable, food and roof over your head. and most importantly health.so pensions, affordable housing and food and most people will be happy for life.thats what they should have done with petronas income!"
silic0sis,20170425,New Member,Group: Junior Member,Posts: 31,200508,,"Exactly. Race doesn't mean anything at all, and it shouldn't mean anything at all.If a Chinese becomes PM, and everyone becomes more successful and the country prospers and everyone is happy, why is that a bad thing?Why would you prefer to be poor and unhappy but have your race be the leader over being successful and happy but with some other race as the leader.Why is race more important then your personal well-being and the well-being of your children and family?"
Daniel John,20170425,New Member,Group: Junior Member,Posts: 38,200607,,i would like to ask...sorry for being wrong at the 1st place...to malay : why u guys afraid of other race become PM?  no to offend people...i just curious to know...because malay in power for so long yet still not all malays are competent without the tongkat...
silic0sis,20170425,New Member,Group: Junior Member,Posts: 31,200508,,"The objective is perhaps idealistic but not realistic. I think history also shows racial discrimination is unhealthy for a nation as well. I don't think it is the fault of the chinese or indians that there is racial economic disparity, so my opinion is that it is unfair to punish them for it.In solving the disparity issue, I think much of it starts with families, and with the parents. The parents have to instill the right mindset in their children from young."
slimey,20170425,,Group: Senior Member,"Posts: 4,874",200704,,even bumi companies are discriminating against bumi............i wonder why
Lyu,20170425,Getting Started,Group: Junior Member,Posts: 157,201501,,Y certain race pipu wan gile kuasa according to title of tered?They tot only Malay pipu in Malaysia?
karwaidotnet,20170425,come near me and i'll bam bam U...,Group: Senior Member,"Posts: 1,282",200301,From: inside my cozy room...,scare chinese implement non-hudud law....oh wait...actually i would think it's not the malay rakyat that is afraid but it's the certain people that has been holding this corrupting power for more than half century...
@zan65,20170425,New Member,Group: Junior Member,Posts: 19,201612,From: Penang - Skudai,"I'm talking about wealth owned/possessed by each race. That kind of disparity that created concerns. It defines poor and rich.For me, for now it is quite fair because only top malays and chinese earned seats in top university. They still compete at school level to get there.Well, merit system is not completely good if you want to progress together, especially for long-term national sustainability. You don't leave behind those that lagging (exception laziness) because of things happened he or she can't control. Their rights must be recognized. We can't be result-oriented 100% or NEP-oriented 100%. Balance has to be there.If you leave those poor souls behind without giving them chances, social problem will rise and it will affect everyone be it your are top or bottom earners."
GnomeMage,20170425,New Member,Group: Junior Member,Posts: 41,201206,,no way Chinese all vote dap lawhat about pkr/mca and gerakan?
