Topic title: Oh Toh Keong  Gerakan Serah Memorandum,"Topic posted on: 14 Feb 2017, 13:25:00",Topic link: https://forum.lowyat.net/topic/4196943,"Topic scraped on: 02 Aug 2017, 03:27:53",
username,date,avatar_title,group,post_count,join_date,from,text
ironmaid89,20170214,New Member,Group: Newbie,Posts: 0,201208,,"Oh Toh Keong Parti Gerakan negeri hari ini menyerahkan memorandum bagi menggesa Kerajaan DAP Pulau Pinang menyelesaikan pelbagai masalah yang membebankan penduduk negeri ini.Memorandum itu diserahkan Naib Pengerusi Gerakan negeri, Oh Toh Keong kepada Pegawai Penerangan Pejabat Ketua Menteri, Zahar Zainul.Penyerahan memorandum itu disertai 10 ahli Gerakan negeri sambil memegang sepanduk dan poster ‘Sayang Pulau Pinang’ dan ‘Selamatkan Pulau Pinang’.Toh Keong menegaskan, Ketua Menteri, Lim Guan Eng perlu menyelesaikan beban rakyat dengan segera sebagai membuktikan pendiriannya yang kononnya sayangkan negeri ini.“Kami tahu beliau selalu buat sidang akhbar mencanangkan banyak perkara tetapi nasib penduduk negeri ini sehingga kini banyak yang tidak terbela,” katanya di sini hari ini. - UTUSAN ONLINEhttp://www.utusan.com.my/berita/politik/ge...pinang-1.444302"
desmond2020,20170214,Getting Started,Group: Junior Member,Posts: 280,200506,,Who let the dog out.mp3
kokleong725,20170214,Getting Started,Group: Junior Member,Posts: 106,201010,From: Earth,kotor keong.. beban dompet u ke?
cedyy,20170214,Regular,Group: Senior Member,"Posts: 1,081",200906,,woof woof
myasiahobby,20170214,Casual,Group: Junior Member,Posts: 455,200912,From: Russia,Parti Gerakan also same he think his party very good..... stupid
Special Agent,20170214,Getting Started,Group: Junior Member,Posts: 76,201503,,so mana list of 10 masalah ??
Jv8888,20170214,New Member,Group: Junior Member,Posts: 46,201305,,How about memorandum to our dear leader about the whole country issue related to all Malaysian?
MishimaZ,20170214,Getting Started,Group: Junior Member,Posts: 176,201102,,"The top one will be boozing and drunk driving and gang fighting.But wait, those are legal there."
