Topic title: PM  Umno  BN Are Always Close To The People,"Topic posted on: 20 May 2017, 11:10:00",Topic link: https://forum.lowyat.net/topic/4294905,"Topic scraped on: 02 Aug 2017, 03:08:31",
username,date,avatar_title,group,post_count,join_date,from,text
ironmaid89,20170520,New Member,Group: Newbie,Posts: 0,201208,,"Datuk Seri Najib Razak said Umno, which is the backbone of the BN government, had helped the people in various matters including providing subsidy to ease the living cost of the peopleUmno and the Barisan Nasional (BN) government are always close to the people on a continuous basis unlike the opposition which only get down on the ground to meet the  people seasonally.Prime Minister Datuk Seri Najib Razak said Umno, which is the backbone of the BN government, had helped the people in various matters including providing subsidy to ease the living cost of the people.“Among the subsidies are health services where patients need to pay the minimum cost of RM1 only, housing scheme which facilitates house purchases for the medium and low-income group through the People's Housing Project (PPR), and the Federal Territory Affordable Homes or known as RUMAWIP and various facilities for the people,” said Najib, who is also Umno president.He said this in his speech before launching the programme “Umno Bantu Rakyat” (Umno Helps The People) organised by the Umno Welfare Bureau at the Sekolah Kebangsaan (SK) Taman Kosas, Ampang near here, last night.Also present were Umno Secretary-General, Datuk Seri Tengku Adnan Tengku Mansor,  Selangor Umno Liaison chairman Tan Sri Noh Omar, and Umno Welfare Bureau chairman who is also Umno Supreme Council member Datuk Dr Shamsul Anuar Nasarah.Najib said Umno would begin a national tour to get closer to the people and offer aid to the poor and the needy group, the aged and the disabled people.“I want Umno members to organise strategies by going down to meet the people and offering welfare aid through the organisation of various community programmes...Umno is always concerned about the needs of the people who only speak and spread slanders without having any clear direction,” he said.Meanwhile, Datuk Dr Shamsul Anuar Nasarah said the Umno Welfare Bureau (BIKUM) would begin the national tour series beginning tomorrow by going to Perak on its mission to get closer to the people.“It involves 35 four-wheel-drive vehicles which will go to all the states and the convoy will bring along aid and contributions specially for the needy group.“Among the aid to be given out are daily necessities such as food items besides 300 special hampers at all Umno divisions visited,” he said.“This convoy is of huge significance to Umno, a party which has transcended 71 years of existence, this is a programme for Umno to get closer to the people.“A total of 150 volunteers and convoy participants will be involved in the tour programme, and the participants will also be heading into the interior of Kinabatangan, Sabah, by boat, to ensure the contributions reach the communities there,” he added. ? Bernamahttp://www.themalaymailonline.com/malaysia...h.n120ZdIu.dpuf"
Slowpokeking,20170520,New Member,Group: Newbie,Posts: 0,201410,,"Well, need to be close to steal under their nose."
will4848,20170520,UNKNOWN,Group: Senior Member,Posts: 594,201009,From: DONT KNOW,"U tak suka, u keluar ....Yang belum keluar must be close to umno ....."
JoLee,20170520,Getting Started,Group: Junior Member,Posts: 85,200301,,You mean close to people ?
acbc,20170520,Look at all my stars!!,Group: Senior Member,"Posts: 5,124",200301,,"Close? During election got la. After election, habuk also tak ada."
nearlee,20170520,Getting Started,Group: Junior Member,Posts: 103,200905,From: iNearly,>inb4 putin bijan tuNearlee
statikinetic,20170520,Warm up. Go hot.,Group: Senior Member,"Posts: 1,159",201001,,"UMNO and BN has always been close to the people, because they always had both hands in our pockets."
