Topic title: NST  Peguam Minta Maaf kepada Anwar,"Topic posted on: 10 Jan 2017, 09:42:00",Topic link: https://forum.lowyat.net/topic/4171110,"Topic scraped on: 02 Aug 2017, 03:32:19",
username,date,avatar_title,group,post_count,join_date,from,text
unknown warrior,20170110,12 Years Member /k/ ELDER,Group: Senior Member,"Posts: 2,802",200507,,"http://www.malaysiakini.com/news/368661Peguam Ranjit Singh Mahinder Singh memohon maaf kepada Datuk Seri Anwar Ibrahim susulan kenyataannya dalam dua artikel di New Straits Times (NST) beberapa tahun lalu.NST pula mengakui artikel itu tidak berasas, sedia menyiarkan permohonan maaf Ranjit serta akan membayar RM60,000 kepada Anwar.Tulisan-tulisan itu dikatakan mengaitkan bekas ketua pembangkang itu dengan kegiatan pengubahan wang haram.Defendan-defendan juga memohon maaf kepada mendiang pemimpin DAP Karpal Singh yang didakwa menerima RM50 juta daripada Anwar untuk mempengaruhi hakim-hakim.Pasukan Ranjit diketuai beliau sendiri dan dianggotai oleh Tan Guat Cheng dan Kenail Singh. NST pula diwakili oleh M Reza Hassan, Ellia Zuraina Mat Zin dan Umni Farhana Mohd Nasir.Diketuai Sangeet Kaur Deo, pasukan Anwar pula dianggotai Ramkarpal Singh dan Yusmadi Yusof.Persetujuan direkodkan di hadapan Hakim Rosilah Yop.Sebelum itu berlangsung rundingan dua jam dalam kamar antara kedua-dua pihak.Ogos lalu, Anwar memfailkan saman RM70 juta terhadap Ranjit, NST dan dua pemberitanya susulan artikel pada 6 Ogos 2013 dan 3 Februari 2014.-----------------------------------------------------------------------------------------Waiting for the sex accusation to turn into this also."
ISawYou,20170110,Getting Started,Group: Junior Member,Posts: 270,201110,"From: Tawau -> Menumbok, Sabah(Land Below The Wind)","60k only? mulut manyak besar, pampasan ciput je."
kurangak,20170110,certified /k addict,Group: Senior Member,Posts: 701,201104,From: here and there,why suddenly change of heart? big boss no more want to cover for them?
WhitE LighteR,20170110,WhitE LighteR Is Black~,Group: Senior Member,"Posts: 7,516",200301,From: Bkt Jalil,70 mil n get 60k only.....
alien3d,20170110,Look at all my stars!!,Group: Senior Member,"Posts: 3,626",200903,,bayar lawyer fee je tu kut..   mesti ada deal lain nih
pandah,20170110,On my way,Group: Senior Member,Posts: 537,201107,,"if want screw karpal or anwar also logic sikit lor, they got 50juta transaction to deal with hakim, macc more than happy to tangkap lah"
mhisyam6,20170110,Casual,Group: Junior Member,Posts: 439,201201,,60K still macam2 can do.
lifeofkuli,20170110,New Member,Group: Junior Member,Posts: 32,201604,,lol haram sudah
hunt2sp,20170110,Always Somewhere,Group: Senior Member,Posts: 688,200301,"From: Kinrara, Puchong","ada duit, semua bole settle...tarak hal punya"
