username,time,avatar_title,group,post_count,join_date,from,text
duo_duo,"  Dec 12 2016, 08:57 PM",New Member,Group: Junior Member,Posts: 10,Joined: Mar 2016,,"Ya,  I understand the point.  But,  if you stand on consumer standpoint,  eta means is the time it will deliver until your doorstep.  Take an example,  lazada platform, eta means the stuffs reach ur hand within the time frame. Besides,  I notice prime items are their priority.  If your parcel is not prime items,  it seem it take forever.  I got 1 parcel which is not prime parcel,  until now haven't ship out yet.  While,  the rest of 3 prime items are shipping out n on the way to Malaysia.  FYI,  the non prime parcel is ordered 2 weeks earlier than 3 prime parcels."
andrekua2,"  Dec 13 2016, 12:17 AM",Look at all my stars!!,Group: Senior Member,"Posts: 6,368",Joined: Jan 2012,,"Bro,I think you need to understand the situation a little bit. You're not buying from DG65. They are helping you to buy the item from Taobao. So you pay them, they pay the seller. Not sure how their system works, but if they have to verify receive your payment then only proceed, wasted some time. After placing orders, have to wait sellers to ship to forwarding warehouse. Then they will scanned those parcels and repackaged them according to the orders. Items then be sent to custom for declaration and checks. Then only board ship and route to MY. It does take some time. That's why I encourage buyers to deal with Taobao directly. Buy with forwarding option, then pay via online banking. You can track each shipment from each seller. You can even negotiate changing colors, items in case he ran out of stock. You can also opt for refund. Then when all the items arrived in warehouse, can proceed with international forwarding. If you are urgent, you can also ship partially and leave those not urgent items for later shipment. Items arrived in warehouse can be stored there FOC up to 14days upon arrival."
kerwyn,"  Dec 15 2016, 07:49 PM",New Member,Group: New Member,Posts: 0,Joined: Nov 2016,,"Can someone advise me about the Malaysia custom tax? Let's say I buy a furniture (table) via EZBuy (aka CIBai) , when my goods arrive to Malaysia shore, will I get tax by the Malaysia custom (table worth more than RM500) . Hope someone can advise me about this . Thanks"
khai0412,"  Dec 15 2016, 09:23 PM",New Member,Group: Junior Member,Posts: 17,Joined: Nov 2014,,same situation here... i order smthing from ezbuy on 11.11 sale but until nw i still hvnt get my item as well...the ETA time was 13.12.2016...so i live chat wif their customer service...and here come the CIBAI parttheir customer service told me the ETA time change to 13/1/2017...WTF?!   dont think i will ever buy anything on Ezbuy again...?==?
^Ware^wolf,"  Dec 17 2016, 07:36 PM",Enthusiast,Group: Senior Member,Posts: 706,Joined: Jun 2012,,Forget about ezbuy . Especially ship for me . Charged me exorbitant service charge.end up i return my goods
life27,"  Dec 18 2016, 09:10 AM",Getting Started,Group: Junior Member,Posts: 77,Joined: Jan 2013,,I bought more than 100 products fro. Ezbuy .No problem alsoHahahaha
stupiak07,"  Dec 18 2016, 11:51 AM",Getting Started,Group: Junior Member,Posts: 214,Joined: Oct 2007,"From: broken heart land, single forever~","my parcel arrive much later than the promised ETAETA, it called  ETA (ESTIMATED TIME ARRIVAL ) for a reasonso go piss yourself off"
clement5949,"  Dec 19 2016, 12:04 PM",Getting Started,Group: Junior Member,Posts: 88,Joined: Jun 2013,,"But sometimes, some item we cannot even bring into malaysia de wor! like those tian mao tv box"
Aerith,"  Dec 19 2016, 02:22 PM",New Member,Group: Junior Member,Posts: 28,Joined: Dec 2010,,"""Then when all the items arrived at warehouse, can proceed with international forwarding"" you say? Can you please explain why my ship-for-me status is still ""not arrived"" when my parcels have arrived at the warehouse almost one month ago. Yes almost one freakin month liaw. My items arrived on the 26th November... until today it still sits in the warehouse. Not updated. So please tell me how do I ship my items back to Malaysia this way? Enlighten us..."
lorrydriverrocks,"  Dec 19 2016, 04:30 PM",Getting Started,Group: Junior Member,Posts: 186,Joined: May 2014,,"This will be the last time i will ever buy from them, so much hassleItem already in Malaysia since 3 weeks ago1st Delivery - They didn't update their driver on the new pickup location2nd Delivery - They didn't load my goods into the truckIt has been 2 weeks since the 2nd delivery, already chat with their support people. Until now not even an sms to reschedule the 3rd pickup. Then i requested for self collection at their warehouse, even that oso no update. Seriously pathetic their service."
lolful,"  Dec 19 2016, 06:18 PM",On my way,Group: Senior Member,Posts: 525,Joined: Apr 2012,,"Whew, luckily I found this  thread. My heart is with those who used ezbuy"
andrekua2,"  Dec 19 2016, 06:54 PM",Look at all my stars!!,Group: Senior Member,"Posts: 6,368",Joined: Jan 2012,,"Sorry, I can't help you on this. I have no idea where this warehouse were. When I first bought from Taobao, I also didn't knew need to use forwarding. So I bought one without forwarding and waited almost 2 weeks before seller contacted me via aliwangwang. I then contacted a forwarder manually via aliwangwang and they agreed to do manual tracking for me. The rest is history. Right now your case is different. You have no idea where the goods were. That's why I recommend buying direct. If you can find your item tracking no and the forwarder warehouse, then you can contact them to track the item, then pay them via Taobao, and they will shipped to you right away."
Aerith,"  Dec 20 2016, 03:15 PM",New Member,Group: Junior Member,Posts: 28,Joined: Dec 2010,,"I think we are in the wrong page on this one. I am using the ezbuy ship-for-me service. It's their forwarding service. I purchase my items in American stores and they ship to their us warehouse address. FedEx tracking confirms that my items have arrived at ezbuy us warehouse on the 26th nov. Up to today (it's almost Christmas!), ezbuy have yet to update the items that have reached their warehouse into their system. Without their update I am unable to ship it back. What's worst is I have another set of item that's also waiting to be consolidated before I can ship them back here to Malaysia together. It's been in their storage (not my fault- they took forever to update) for almost 30 days now. They gonna start charging me for storage already ! Walau I've even tried contacting them on fb and the inconsiderate ppl don't even bother to reply to help... almost a month already guys..... unbelievable... I even resort to begging them..! Begging them to help me. Beg them to update so I can bloody click on the ship it back option! What the hell man... and yet they still don't bother to help. the worst experience ever. If you're reading this ezbuy please help la aiyo just do ur job.... my Christmas presents won't arrive d this year..."
Aerith,"  Dec 20 2016, 03:18 PM",New Member,Group: Junior Member,Posts: 28,Joined: Dec 2010,,"Yeah lucky u.. I regret I never did my research first man , would've saved me a ton of trouble"
b3arbear,"  Dec 20 2016, 03:38 PM",Getting Started,Group: Junior Member,Posts: 105,Joined: Aug 2010,,"not sure if it falls under sensitive item? if its, it has extra charges for it.and might able to check with the seller. I tried to buy passport holder from TB but when make payment, system blocked me and claimed unable to send into MY.then I personally msg the seller, the seller help me put it into the parcel without state on description hehe."
JStatham,"  Dec 20 2016, 03:46 PM",New Member,Group: Junior Member,Posts: 11,Joined: Aug 2014,,Hmm im wondering if their staffs read this thread or not
glauncher,"  Dec 20 2016, 03:49 PM",Getting Started,Group: Junior Member,Posts: 93,Joined: Jan 2013,,Last time their service quite ok 1 but suddenly become so so bad. Take 1 month more than expected to arrive
clement5949,"  Dec 21 2016, 12:20 PM",Getting Started,Group: Junior Member,Posts: 88,Joined: Jun 2013,,"owh, good idea! next time i am gonna try it Thanks"
BaoFatAuto,"  Dec 27 2016, 12:32 PM",New Member,Group: New Member,Posts: 0,Joined: Jul 2015,From: Subang Jaya,"Lmao guys, even if ezbuy reads they probably couldn't care. And I understand what the former customers of ezbuy feel because I have been using their service long before when they were known as 65daigou.But now, RIP ezbuy HAHAHAHA."
foxray,"  Dec 27 2016, 10:41 PM",Getting Started,Group: Junior Member,Posts: 70,Joined: May 2011,,https://www.facebook.com/eatlicious/photos/...?type=3&theaterSeems like more problems from this site
y_ky,"  Dec 31 2016, 02:32 PM",New Member,Group: New Member,Posts: 0,Joined: Oct 2012,,"So this is gonna be a little long post, so apologies for that.After using Ezbuy's service so many times, I'd rate them between ""satisfied"" to ""yeah okay, got the work done at least"". BUT! Discover some absurd policy about their shipping this time! I ordered some plastic storage box weighing up to 5KG volumetric weight. So thinking since I'm charged volumetric might as well order something else to take advantage of the extra space (if any) since I'm charged for it anyway. And it's storage box, just put some stuff in there la right? But LO AND BEHOLD! After ordering other stuff: 11 pcs clothing; 1 heels, 1 flats; and one bag, quoted weight shoot up to 9.32 kg, chargeable weight 10.26kg. Heels got charged .72 volumetric weight, fine cause comes with box. Strapless bar  .59kg due to boxed packaging as well. So volumetric weight is about 6.5kg, remaining 3kg is for the clothes. But since my parcel is most probably being charged volumetric, and FFS the rest are clothes! So go ahead and fold it, crumple it, roll it! The actual weight shouldn't matter anymore, right? So I contacted customer service wanted to tell them give me a final quote of the consolidated parcel's volumetric weight, to my surprise I was told regardless of the volumetric weight, ANYTHING THAT GOES INTO THE SAME PARCEL WILL BE CHARGED ADDITIONAL SHIPPING. Like, WTF are you talking? Since when shipping company charge you the weight for every item inside the box after deciding to charge you on volumetric weight? Or am I missing something? Tried to ask them repack my heels inside the storage box to reduce volume, was told I will still be charged for the heels DESPITE NOT TAKING ANY EXTRA SPACE OTHER THAN SPACE IN STORAGE BOX! I'm seriously mind-blown. My mistake for not clarifying with them beforehand but who would have thought they'd be so ridiculous? Definitely not me! Or maybe I didn't understand shipping logics/rules, so someone enlighten me yeah. Don't   if I'm wrong  Conversation with CS attached!And it took me days to be able to get someone to assist me. No one ever give a damn about message dropped via their app. Website stated live chat from 10-10 Mon-Thurs, good for office time employees right? No. I tried to speak to them online Thurs around 8PM but live chat NOWHERE TO BE FOUND - they disabled it. Friday had to use my phone to go online during lunch hour for the live chat - hell of a challenge. Mobile website is not that user-friendly. 
Ka_Yan.pdf ( 82.04k )
Number of downloads: 81"
pandah,"  Jan 1 2017, 12:20 PM",On my way,Group: Senior Member,Posts: 521,Joined: Jul 2011,,"i guess they just charge to earn those extra, can cover the loss with prime unless u talk to seller ask them pack in one package and send in as 1 item only, but then if anything missing u can not do anything cuz only stated 1 item"
annmix,"  Jan 5 2017, 06:30 PM",Getting Started,Group: Junior Member,Posts: 146,Joined: Apr 2009,,"Jus use taobao forwarder direct lah so easy i dont understand why u all like to use all these 3rd party . Taobao direct forwarder only charge rmb19 per 1kg (rm13), u can keep 20days at thier warehouse to combined all your product. I normally buy clothes so they will jus put every pakage from different seller into 1 big plastic bag. Usually reach KL (Me) after 3 days from guangzhou. Jus received mine today that sent out from gz warehoure on monday. Payment n tracking also so easy ."
alucard89,"  Jan 10 2017, 10:25 AM",Look at all my stars!!,Group: Senior Member,"Posts: 2,228",Joined: Apr 2006,,"Prime membership is quite worth it, especially for really heavy items and bulky one. I've received 80? of my orders so far and they're all in great condition. Which I'm quite surprised really considering how people complain all the time about their service haha."
miyakochan89,"  Jan 17 2017, 04:30 PM",IDGAF,Group: Senior Member,Posts: 964,Joined: Aug 2008,,"is that an agent or directly from Tao Bao, I have been using Ezbuy services too but I have recently heard that shipping directly from Tao Bao is much easier and cheaper."
basilisk,"  Feb 20 2017, 06:22 PM",New Member,Group: Junior Member,Posts: 10,Joined: Apr 2013,,"thx for posting this, so now we know their tactic , ridiculous reason to charge like that."
basilisk,"  Feb 20 2017, 06:24 PM",New Member,Group: Junior Member,Posts: 10,Joined: Apr 2013,,"i buy items that are less than 0.5kg, why do i need to pay rm19 by using direct shipping from taobao.with ezbuy, they oni charge RM4.5 for 500g only, this is a way to save."
basilisk,"  Feb 20 2017, 06:27 PM",New Member,Group: Junior Member,Posts: 10,Joined: Apr 2013,,"not really, depends on how big your purchase,ezbuy will use some tactics to increase the cost of shipping."
HaMsTeYr,"  Feb 23 2017, 05:19 PM",New Member,Group: Junior Member,Posts: 36,Joined: Sep 2007,,"Wa, luckily I stumble on this thread...I'm using Taobao consolidated shipping now, so far my experiences have been quite good la, from date of item purchase to arrive malaysia need only about 7 days.Thing is though, got a lot of things (xiaomi official store power bank for example) that can't ship directly using their service. Which forwarder you guys recommend for these?Also, if can recommend one for USA also would be good. ComGateway reliable but man, my wallet feeling empty using their services..."
angelgemini,"  Feb 23 2017, 05:29 PM",...,Group: Senior Member,"Posts: 1,189",Joined: Jun 2005,From: Malaysia,"if the china seller send out fast, should reach very fast but the only problem is they lack of men power ( i guess).they need to repack all the packaging, that will take long time.currently they serving SG, MY, Aus and Thai market.The quantity of parcel they handle perday is crazy.I collect from their delivery lorry before, is like 40 people queuing to collect their parcel.whole lorry is full of item.They also make alot of mistake, i purcahse something from USA and forward to SG.they charge 10x the weight of the original item.Lucky is ship for me service that i can see the item weight from DHL website and compare with them.not easy to communicate with their CS also as many is PRC.no matter how, they still offer the best shipment in market, no choice lo."
Raymond6,"  Feb 26 2017, 10:28 PM",Getting Started,Group: Junior Member,Posts: 85,Joined: Feb 2011,,"Hey! Luckily I've searched for this thread about ezbuy before I made my purchase with them. What made me think twice before proceeding my order with them is because they don't quote you the actual total which is only the amount excluding the shipping fees as its very risky for us, it could be up to them on the shipping fees after paying the product cost. I would like to ask that if you guys have any other reliable & cheap Taobao forwarder that I could rely on? Thanks in advance."
truelife,"  Mar 1 2017, 10:22 PM",Getting Started,Group: Junior Member,Posts: 251,Joined: Sep 2009,,Items under Prime are not the cheapest though. Better buy directly from Taobao.
mrafif,"  Mar 28 2017, 08:50 AM",New Member,Group: Junior Member,Posts: 31,Joined: Oct 2007,From: Bathroom,"So, does it still ok to use their services?"
jmas,"  Mar 28 2017, 09:25 AM",Getting Started,Group: Junior Member,Posts: 149,Joined: Mar 2010,,"Gave up on using their service months ago, their service is getting worse and worse...I paid extra for express air shipping, but get my item after 1mths.. I check with them, always say ""according to our system, we sent out the item""..."
freeman1,"  Mar 28 2017, 09:35 AM",New Member,Group: Junior Member,Posts: 39,Joined: Mar 2015,,"If count like this, all air fowarder will bankrupt, go check how much dhl or fedex charge before u troll here..."
e_mc_square,"  Mar 28 2017, 01:28 PM",Casual,Group: Junior Member,Posts: 369,Joined: Dec 2008,,"Thanks for replying my ancient post     I know exactly what is ""Volumetric weight"" and ""Actual weight"" mean."
e_mc_square,"  Mar 28 2017, 01:29 PM",Casual,Group: Junior Member,Posts: 369,Joined: Dec 2008,,
mrafif,"  Mar 29 2017, 01:56 AM",New Member,Group: Junior Member,Posts: 31,Joined: Oct 2007,From: Bathroom,"omg, thanks for your quick response. appreciate it."
zhiawen,"  Apr 24 2017, 09:41 PM",New Member,Group: New Member,Posts: 1,Joined: May 2012,,"Totally agree, they are loosing the regulars"
davido,"  May 15 2017, 09:21 PM",New Member,Group: Junior Member,Posts: 26,Joined: Dec 2004,,"It appears you guys haven't much exposure buying stuffs from China or even from overseas. Even if you buy from ebay, delivery can take a long time. Its not the seller or website's fault, but its the circumstances of shipping. Sometimes even Kastam Malaysia can hold your package even with Express delivery, it can take over a month."
Hummingbird,"  May 20 2017, 03:17 PM",Casual,Group: Junior Member,Posts: 418,Joined: Nov 2006,,"Please be noted that they have changed the home delivery policy for prime user. Previously it was RM8 per checkout to deliver the item from their warehouse to your home, and now it is changed to charge based on weight, and the minimum charge is RM8.Good try ezbuy, there is no point to buy item from Taobao thru you as most of the cost saving has been charged up by your agent fee, lower than the market conversion rate, shipping fee, delivery fee and etc..."
afieQ,"  May 22 2017, 07:57 AM",Casual,Group: Junior Member,Posts: 370,Joined: Mar 2008,From: Everywhere and nowhere,Lol whats the use of prime anymore if this is true
adamw,"  May 23 2017, 09:10 AM",Back to serve justice to those PKHKC corrupted ministers!,Group: Senior Member,"Posts: 1,275",Joined: Dec 2006,,How often you buy from China Mr Expert?  Just because you have bad user experience does not means you can justified a Sub-standard service from this agent by blaming custom etc.
davido,"  May 30 2017, 09:04 PM",New Member,Group: Junior Member,Posts: 26,Joined: Dec 2004,,"I have bought from China many, many, many times - I lost count. Mostly from Ebay, also used ezbuy.I never said I blamed the agent. On the contrary I said slow shipping is not the agent's fault.Please read my post properly as I think you misunderstood."
adamw,"  Jun 1 2017, 12:18 PM",Back to serve justice to those PKHKC corrupted ministers!,Group: Senior Member,"Posts: 1,275",Joined: Dec 2006,,I do mean it's the agent's fault since so many complaints
miyakochan89,"  Jun 1 2017, 12:39 PM",IDGAF,Group: Senior Member,Posts: 964,Joined: Aug 2008,,"Used to get my stuff from ezbuy a lot until I learned that Tao bao starts shipping directly to me. Since then I never look back and Tao bao direct shipping is crazy fast. And they don't repackage your stuffs to make shipping more expensive because ezbuy always did that. They repackaged into a box so big and charged you more. But I also know that this is what most forwarders do. Just that since Tao Bao does direct now, this seems kinda redundant now."
10996455,"  Jun 2 2017, 04:00 PM",On my way,Group: Senior Member,Posts: 516,Joined: Apr 2014,,Okay ezibye day are numbered
coolstore,"  Jun 3 2017, 02:37 PM",Regular,Group: Senior Member,"Posts: 1,330",Joined: Apr 2008,,"not juz ezibye instead all parties involved in china stuffs biz - from shippers, shipper agent, forwarder, distributor to last mile dealer, bcoz of malaysia dftz project in sepang with jack ma step in to build first distribution warehouse out of chinait would just take months to complete the warehouse and operate soonguess 2108 would be fully operationalalready got see one dealer clearing his factory warehouse stocks with clearance sale, these ppl are prepare in advancesome juz wait till the doom day to come"
10996455,"  Jun 3 2017, 02:42 PM",On my way,Group: Senior Member,Posts: 516,Joined: Apr 2014,,Clearance sale not betul betul one they still make money. Luckily my business not sangkut with china goods
boxer07,"  Jul 2 2017, 08:35 PM",Casual,Group: Junior Member,Posts: 487,Joined: Feb 2007,,"actual price to get from taobao:RM50  + RM13 =63. somemore this is sensitive goods,some forwarder doesn't want to accept .ezbuy end up only pay rm37 ,of course with Rm30 cash voucher ..using sea shipping."
huaweie5830,"  Yesterday, 08:04 AM",Enthusiast,Group: Senior Member,Posts: 910,Joined: Jan 2013,,"Hilarous , I think anyone who wears a pair of 7kg shoes would not be able to walk at allRIP Ur leg"
