Topic title: Gomen BN mesra pelabur  terus alu alukan FDI  PM,"Topic posted on: 20 Jun 2017, 16:03:00",Topic link: https://forum.lowyat.net/topic/4333044,"Topic scraped on: 02 Aug 2017, 03:03:35",
username,date,avatar_title,group,post_count,join_date,from,text
soowky,20170620,New Member,Group: Junior Member,Posts: 10,200907,From: /kay/,"KUALA LUMPUR - Barisan Nasional (BN) akan kekal menjadi kerajaan yang mesra pelabur, menjadikan Malaysia destinasi menarik untuk pelaburan langsung asing (FDI) dari seluruh dunia, kata Perdana Menteri Datuk Seri Najib Tun Razak hari ini.Beliau berkata, Malaysia akan terus mengalu-alukan para pelabur dari luar negara, dan untuk bekerja dengan kalangan peniaga Malaysia demi untuk manfaat pelabur dan juga rakyat tempatan.""Sama ada pelaburan itu adalah dari China, Jepun, Arab Saudi, Amerika Syarikat atau Singapura, mereka menambah nilai kepada ekonomi kita, mewujudkan lebih banyak kerja, membawa teknologi-teknologi baharu. Anda pastinya amat dialu-alukan untuk melabur di Malaysia,"" katanya semasa merasmikan upacara pecah tanah bagi pembangunan Bukit Bintang City Centre (BBCC) dan Mitsui Shopping Park LaLaport KL (LaLaport KL) di sini.Najib berkata, perbadanan global yang lain dari seluruh dunia akan dapat melihat bahawa Malaysia terus menjadi destinasi pelaburan menarik.Memberikan contoh syarikat seperti Mitsui Fudosan, yang telah membangunkan Mitsui Outlet Park yang pertama dekat Lapangan Terbang Antarabangsa KL secara usahasama dengan Malaysia Airports Holdings Berhad pada 2015 dan peluasan fasa kedua yang dijadual dibuka pada awal tahun depan, Najib berkata, pelaburan berterusan sedemikian merupakan bukti keyakinan pelabur terhadap prospek jangka panjang Malaysia. - Bernamasos"
s@ni,20170620,Gambar Di Lesen Kereta Saya,Group: Senior Member,"Posts: 2,682",200506,From: Seasaw,continuation of good practice by mahathir
will4848,20170620,UNKNOWN,Group: Senior Member,Posts: 594,201009,From: DONT KNOW,FDI or donation to i ??
pandah,20170620,On my way,Group: Senior Member,Posts: 537,201107,,Mitsui bagus ke? Heard got some discount
@zan65,20170620,New Member,Group: Junior Member,Posts: 19,201612,From: Penang - Skudai,"from china, by china, for china...gth"
abgropi,20170620,New Member,Group: Newbie,Posts: 0,201706,,investor first .
Timemuffin,20170620,Getting Started,Group: Junior Member,Posts: 84,201107,,tbhproperty development is the worst kind of FDI lorwhat transfer of tech there is leh
