Topic title: LGE will challenge MACC Act,"Topic posted on: 25 Apr 2017, 12:33:00",Topic link: https://forum.lowyat.net/topic/4274527,"Topic scraped on: 02 Aug 2017, 03:14:15",
username,date,avatar_title,group,post_count,join_date,from,text
PappyBoyington,20170425,Getting Started,Group: Junior Member,Posts: 142,201606,,"http://www.malaysiakini.com/news/380213The High Court in Penang has fixed July 26 for case management on the corruption trial of Penang Chief Minister Lim Guan Eng and businesswoman Phang Li Koon.The move is to allow the appeal by Lim and Phang to challenge the Malaysian Anti-Corruption Commission (MACC) Act 2009.This is to be heard on April 27, in the Court of Appeal in Putrajaya.""We plan to challenge the MACC Act up to the Federal Court,"" Lim's legal counsel RSN Rayer said after the date was fixed before High Court judge Hadhariah Syed Ismail.Phang was represented by Hisham Teh, while DPP Masry Daud appeared for the prosecution.Last month, Justice Hadhariah allowed the application by Lim's counsel Gobind Singh Deo to stay the corruption trial pending the outcome of their appeal in the Court of Appeal.This followed the High Court's March 7 rejection of the petitions by Lim and Phang to have Section 62 of the MACC Act declared ""unconstitutional and void'.Section 62 states that once the prosecution submits documents pursuant to Section 51A of the Criminal Procedure Code, the accused shall, before the trial begins, submit (a) a statement of defence and (b) a copy of any document that can be presented as part of the evidence for the defence.Read more: https://www.malaysiakini.com/news/380213#ixzz4fETvJ7nC"
KoChun,20170425,On my way,Group: Senior Member,Posts: 688,201402,,Guess someone did not learn from the Anwar example.  LOL
MsGaijin,20170425,New Member,Group: Junior Member,Posts: 29,200812,,This is gonna be FUN!
keny2020j,20170425,Getting Started,Group: Junior Member,Posts: 276,200906,,wonder what powerpoint slide will be provided this time
BlueButtBaboon,20170425,FEEL WITH IT,Group: Senior Member,Posts: 516,201408,From: hutan lipor,Need 1week for pandan mp announce Following week he will show his tumbdriveA week after that he say will pass it to relevent authority.
myasiahobby,20170425,Casual,Group: Junior Member,Posts: 455,200912,From: Russia,the court belong to bijan LGE sure die kaw kaw
MsGaijin,20170425,New Member,Group: Junior Member,Posts: 29,200812,,So are you saying Ah Jib actually donated RM300k to LGE?» Click to show Spoiler - click again to hide... «http://www.freemalaysiatoday.com/category/...uit-against-bh/
LivingActive,20170425,New Member,Group: Junior Member,Posts: 10,201504,From: RobotPencariEmel.com,belum take over federal dah songlap. sigh
