Topic title: TPM  Sekarang Masa Terbaik Bagi Parti Komponen BN,"Topic posted on: 29 Jul 2017, 13:42:00",Topic link: https://forum.lowyat.net/topic/4373200,"Topic scraped on: 02 Aug 2017, 02:52:24",
username,date,avatar_title,group,post_count,join_date,from,text
ironmaid89,20170729,New Member,Group: Newbie,Posts: 0,201208,,"TIMBALAN Perdana Menteri, Datuk Seri Dr Ahmad Zahid Hamidi (kiri) berucap pada Majlis Perasmian Mesyuarat Perwakilan UMNO Bahagian Kota Melaka di Hotel Mahkota, Banda Hilir.Datuk Seri Dr Ahmad Zahid Hamidi berkata, inilah waktu terbaik semua jentera parti komponen Barisan Nasional (BN) untuk bersatu meruntuhkan kubu pembangkang yang diketuai DAP.Naib Presiden UMNO yang menjalankan tugas Timbalan Presiden berkata, tempoh dua penggal pembangkang memberi pelbagai janji palsu dalam Pilihan Raya Umum (PRU) Ke-12 dan Ke-13 sudah berlalu, dan mandat sebenarnya harus dikembalikan kepada BN.""Saya khuatir jika BN tidak bekerja keras, kita akan disejarahkan dan dikecundangkan. Cukup-cukuplah... kita belajar daripada pengalaman (lalu), terbuai daripada mimpi terdahulu.""Tugas-tugas kita dalam parti UMNO untuk membantu calon BN. Begitu jugalah kepemimpinan komponen lain untuk membantu calon UMNO dalam PRU akan datang.""Tolonglah... inilah ketikanya zaman DAP mula merudum dan empayar 'Dinasti Lim' akan pecah dan runtuh dalam PRU-14,"" katanya ketika berucap pada perasmian Mesyuarat Perwakilan UMNO Bahagian Kota Melaka di Hotel Mahkota di sini, hari ini.Yang hadir sama, Pengerusi Badan Perhubungan UMNO Melaka yang juga Ketua Menteri, Datuk Seri Idris Haron; Ketua UMNO Bahagian Kota Melaka, Datuk Wira Latiff Tamby Chik; Ketua UMNO Bahagian Masjid Tanah, Datuk Seri Ab Rauf Yusoh; Ketua UMNO Bahagian Jasin, Datuk Seri Ahmad Hamzah dan Ketua UMNO Bahagian Alor Gajah, Datuk Seri Abdul Ghafaar Atan.Kira-kira 500 perwakilan UMNO menghadiri mesyuarat berkenaan yang membabitkan 65 cawangan Bahagian Kota Melaka bagi mendengar amanat Timbalan Perdana Menteri.Dalam pada itu, Ahmad Zahid turut menyeru semua kepemimpinan parti untuk memberi tumpuan terhadap persiapan PRU-14, berbanding cuba untuk melobi dalam pemilihan parti.""Apa maknanya menjadi ketua bahagian kalau tidak merampas semula kerusi yang kalah. Saya menyeru kepada diri saya dan rakan-rakan lain untuk mengutamakan PRU-14, ketepikan pemilihan parti.""Saya tahu ada sesetengah tokoh cuba melobi (jawatan). Ada yang jumpa tiga kali, nak rancang jumpa pun ada. Saya tahu, sebab saya Menteri Dalam Negeri,"" katanya.http://www.bharian.com.my/berita/politik/2...payar-dap-zahid"
will4848,20170729,UNKNOWN,Group: Senior Member,Posts: 594,201009,From: DONT KNOW,then when is bn turn ??
cant think of a username,20170729,New Member,Group: Junior Member,Posts: 40,201504,,fuck i want all these old fags runtuh
YellowKingValley,20170729,Casual,Group: Junior Member,Posts: 398,201412,,Jika DAP tu empayar apa pula BN?
Donphatz,20170729,New Member,Group: Junior Member,Posts: 26,200901,From: PJ,"""Saya tahu ada sesetengah tokoh cuba melobi (jawatan). Ada yang jumpa tiga kali, nak rancang jumpa pun ada. Saya tahu, sebab saya Menteri Dalam Negeri,"" katanya.Semua benda dia tahu. Arab 2.6b donor pn dia tahu and dh jumpa. Amazing guy. Very well connected. Dosa je mungkin dia tak tahu."
bereev,20170729,Getting Started,Group: Junior Member,Posts: 53,201112,,again one more divert target to DAPsee that BN totally dun wellcome others race to become better
honorable thief,20170729,New Member,Group: Junior Member,Posts: 6,201704,,"Kenapa takut DAP? Sebab DAP parti Cina? Cina minoriti kat Malaysia, apasal kaum majoriti geruni kaum minoriti?Kenapa orang kita diam saja bila UMNO kasi projek, jual tanah, Proton dan Edra kepada Komunis Cina Tongshan? Siap nak undi lagi UMNO. Kelakar sangat bila orang kita nak minta parti penjual aset negara untuk protek hak dan ketuanan mereka."
incubus_skj,20170729,Casual,Group: Junior Member,Posts: 384,200902,,Jangan persoal U x suka u keluar
