username,time,avatar_title,group,post_count,join_date,from,text
et29tan,"  Jul 28 2016, 12:02 PM",New Member,Group: New Member,Posts: 1,Joined: Sep 2015,,"I have been using ezbuy but I think the days have to come to an end. Compared to other agents, they charge a slightly lower shipping rate, but they charge you an incredibly high conversion rate, which end up is more expensive compared to others and/or direct buy from taobao. Besides, I have experienced many times about their poor customer service. They never hear your complaints, although the delivery was late than promised date, they never say sorry, they only say the parcel has been prioritized, they can't do anything at the moment, except for a sound-like-computerized apology. So what for to set the date while can't even stick with it for many times? As for their email response, I can say that is the worst email customer service I ever encountered. Normal company takes max 2 days to respond, they have to take 5-7 days. There was one time I immediately send my email within 1 min after I received a response from ezbuy, as I was aware of their inattentive. However, despite my instant reply, I had to wait for few days for them to answer my simple question, which is regarding miscalculation of amount (if you do not double check the amount especially amount after conversion, you may lose some money). Calling them can be even worse, the staff is not informative, and not responsive. I have no where to get a satisfied customer experience from this agent. Email, call, online chat, none of them help.If you don't believe me, you can try to use taobao direct buy and you can see the total price including international shipping before you checkout, and then you compare with the price that you pay to ezbuy.Lastly, they have really bad management in terms of warehouse and their affiliates. There was one time I checked with them about my parcel, later they told me it was just arrived in their warehouse in KL and they would arrange a delivery to my house ASAP. After 2 days, I didn't receive my parcel so I checked with them again, this time they told me the parcel JUST arrived their warehouse and they will arrange a delivery to my house ASAP. WTF the stories are the same, 2 days passed and the parcel was still JUST ARRIVED. I could not hold myself but to scold them WTF last 2 days I checked you told me it was arrived, then no response from them anymore. I tirelessly checked with them again, then this time they told me they would prioritize the parcel, but no apology, no sincere, nothing.Think twice if you want to use this agent."
bb100,"  Jul 29 2016, 08:11 AM",Editable...finally!,Group: Senior Member,"Posts: 1,357",Joined: Jan 2011,"From: Ipoh, Perak","LYN got Taobao agents wan, why don't wanna use their service?Some of them are /k/tards too.One trustable one is wenten.My friends and myself bought quite a few times with him, all very satisfied."
wenten,"  Jul 29 2016, 11:44 AM",Getting Started,Group: Junior Member,Posts: 161,Joined: Apr 2012,From: Pahang?KL?<=>Selangor?PC?,
andrekua2,"  Jul 29 2016, 07:47 PM",Look at all my stars!!,Group: Senior Member,"Posts: 6,368",Joined: Jan 2012,,"I think many use forwarder because they want flexibility in ordering more items later. I only had two bad experiences and both were related to Taobao global shipping. First time they forgot one of the bag. Second time they refused to accept xiaomi usb chargers shipment. Had to filed for return and waste shipping. If you want to use forwarder, I must strongly recommend 4px. Their service is really top notch. I never had any problem with them. I had chargers shipped, even a sex toys that came with small tube of lubricant also get through. Never tio tax also. They declare the whole list cheap 2."
pisces88,"  Jul 30 2016, 02:06 AM",Look at all my stars!!,Group: Senior Member,"Posts: 2,390",Joined: Nov 2007,,how bout buying phones from them? i see their thread is pinned in the mobile phone section. anyone got experience?
BaoFatAuto,"  Jul 30 2016, 11:04 AM",New Member,Group: New Member,Posts: 0,Joined: Jul 2015,From: Subang Jaya,"In case you didn't read my post properly, it's a *SHIP-FOR-ME* service. Ezbuy is responsible to repack ALL items under that category ?"
BaoFatAuto,"  Jul 30 2016, 11:07 AM",New Member,Group: New Member,Posts: 0,Joined: Jul 2015,From: Subang Jaya,"Wtf... How come so CB. Before this when I complain regarding my problem and gave one-star rating, their rep called me immediately and offered me a 15% refund as a form of apology. Which was RM1.XX only ha ha ha."
BaoFatAuto,"  Jul 30 2016, 11:12 AM",New Member,Group: New Member,Posts: 0,Joined: Jul 2015,From: Subang Jaya,"PREACH!! Their customer service is literally shit. The only thing they could do is only say 'We will try our best, we will try our best' and offer minor compensation rather than really fixing the problem.With all the money spent on advertising, why won't they ever upgrade their services instead? I also switched to other import provider instead as I'm so so so disappointed with them after giving them countless chances."
jiayi0528,"  Aug 2 2016, 04:46 PM",Getting Started,Group: Junior Member,Posts: 78,Joined: Feb 2013,,"Dear All, just a sharing of a terribly bad experience I have with EZBuy Malaysia too. Before this I had a few purchases from them and the experiences are from good to average. However, the most recent parcel I received from them is the MOST FRUSTRATING AND THE WORST experience I ever had for online shopping. I ordered a pair of 30kg dumbbell in late June 2016 and I select the option of self collection. On 26 July 2016, I received sms from EZBuy that the parcel is finally arrived and I collected the parcel on 27 July at McD Prima Saujana. The item I received is not as description (the dumbbell only come with 3 x 2.5kg weight plate which is definitely far from the description of 30kg) and I called to their customer service (Mandy) on the above matter and also sent them an email to seek for a solution on this matter. Even though I am not happy with it but I am still able to tolerate with this as I understand that human tend to have mistakes.Now the worst thing, on 28 July 2016, I received a call from PosLaju Malaysia informing me I have a parcel with them sent from Cheras to an address at Prima Saujana but they are unable to deliver as the address is incomplete and request me to self collect from their Bangi branch. At first I thought that it is a scam call and I did not ask much about it. After I got home I got curious what it might be and started to have a bad feeling about it that it might be the remaining weight plates of my dumbbell, so I search for EZBuy address and realise that their office is actually located at Taman Maluri Cheras and it further convinced me that it is my remaining weight plates. It then took me more than 20 calls to trace back the number that called me to get the tracking number of the parcel and another 2 hours to collect the parcel on the next day.    How can EZBuy be so IRRESPONSIBLE and send out a parcel which I already indicated in my remarks by self collection? And the worse thing, send to an address which I do not know how they get it. Before this I had a few parcels from EZBuy which were sent directly to my house and they definitely have the record of my address, even if they don't, they have my contact number to confirm on what address to send to. Why the hell are they sending it to a McD!? I AM EXTREMELY DISSATISFIED AND PISSED OFF BY THIS!!!    And the name!! They put my name as my Login ID!! Which I need to explain to the PosLaju officer during the collection. They are lucky as I take up the initiative to trace back the parcel and my Login ID is actually the combination of my name and birthday. What are they going to do if the parcel is no where to trace or I am unable to collect the parcel? Are they going to do full refund?After collection of the 2nd parcel of the dumbbell, the item is still different from the description. The weight plate is different from their description but I do not intend to look into this matter as long as the weight is as per my order which is 30kg. Unfortunately, the item is still short of 1 x 2.5kg plate after all the hassle. I email to them again to complaint about this but to date do not have any response from them yet. I do not have the intention to bad mouth about any one here but this is just a sharing of experience I had with them so others will take note on this before order anything from them. Actually I even started to get impatient with them even before i received the parcel, but if i tell all the grandmother's story here it will be few pages long. Of course, before this parcel I do have some good experiences with them as well but this 1 will definitely make me think twice before I order anything else with them again. Thought i can make use of their Prime membership to set up my home gym in the future, but they have failed the test even for just a pair of dumbbell."
KYLau,"  Aug 3 2016, 02:52 PM",New Member,Group: New Member,Posts: 0,Joined: May 2016,,"Slow service response, took at least 3 days to response email."
liquidsny,"  Aug 3 2016, 02:59 PM",Casual,Group: Junior Member,Posts: 393,Joined: Apr 2007,,"heh.. luckily all of my prime item arrived in safe manner.all the stuff i bought quite big too.. treadmill, shelf, computer table.but that was prime items only for their buyforme service is a lot expensive than taobao direct itself even with free agent fee offer"
munlok30,"  Aug 7 2016, 09:26 PM",WishingToBeHappy,Group: Senior Member,"Posts: 1,039",Joined: Oct 2011,,"total bought 30 +++ item from ezbuy , all safety arrive .. no problem also @.@ ..  just it take time .. really take time .. but those things are not urgent ..  roughly around 2-4 weeks ..  quality depend  lor , but i advise don't buy TOO CHEAP , hahahahha ..  good luck"
sotplug,"  Aug 27 2016, 04:28 PM",The old noobie...,Group: Senior Member,Posts: 919,Joined: Dec 2005,"From: Seri Kembangan, Selangor",I'll most probably stop using their service.Did I misunderstood the conversation?Or is it that they are just 24 hours in defensive mode towards their customers?
annoymous1234,"  Aug 27 2016, 08:58 PM",? SAFE TRADER,Group: Senior Member,"Posts: 4,707",Joined: Mar 2009,,Lol they literally don't give a shit
BaoFatAuto,"  Aug 29 2016, 12:57 PM",New Member,Group: New Member,Posts: 0,Joined: Jul 2015,From: Subang Jaya,Wtf weih. Straight call them regarding the problem and tell them you want to arrange economy air instead for all items. How come they still can have the balls to say they don't understand the problem despite you telling them multiple times?
Devil7801,"  Sep 26 2016, 02:58 PM",New Member,Group: Junior Member,Posts: 45,Joined: May 2012,"From: Kuantan, Pahang","Damn it!!I should have read this thread earlier..I just top up to their system and order some AC component..Looking at how you guys were treated, I believe mine will be a hassle as well..DAMN!!"
BaoFatAuto,"  Sep 29 2016, 08:22 AM",New Member,Group: New Member,Posts: 0,Joined: Jul 2015,From: Subang Jaya,"Sometimes, some lucky customers won't face too much problem so don't worry. But if there's really any problem, just call them directly and push them to fix your problem because they're so darn reluctant!"
xtxjim,"  Oct 8 2016, 04:27 AM",New Member,Group: New Member,Posts: 1,Joined: Jun 2010,,"Can contact me,im china logistics (China To Malaysia,Thailand,SG)1KG-RM13.50 (3~5Days)Pm Me More Detail."
jeremy05,"  Oct 10 2016, 05:40 PM",web developer,Group: Senior Member,"Posts: 1,841",Joined: Apr 2005,From: Kepong,"damn shit, me too victim.payment made on 21/09, ETA is 04/10, still haven't get my item until today 10/10."
dopp,"  Oct 11 2016, 09:33 PM",Regular,Group: Senior Member,"Posts: 1,468",Joined: Jan 2003,From: Penang,"same problem with hopshopgo.Overcharge all shipping, and claim the volume metric bullshit.."
uoxtremor,"  Oct 12 2016, 02:49 AM",New Member,Group: Junior Member,Posts: 12,Joined: Jan 2012,,how about sgshop . com . my ? any problem with them ?
big[1],"  Oct 12 2016, 05:43 AM",On my way,Group: Senior Member,Posts: 583,Joined: Jun 2015,,it is normalimagine you have something very very big but light.you still take up the space.
Sedih,"  Oct 12 2016, 11:36 AM",New Member,Group: Junior Member,Posts: 13,Joined: Mar 2015,,"Bought a xiaomi from them. Ordered on friday, then on Wednesday only they proceed my order. That is after i emailed them because so slow."
1KL,"  Oct 12 2016, 11:57 AM",New Member,Group: Junior Member,Posts: 43,Joined: Feb 2015,,so many people get cheated by ez-buy
tangenttheta,"  Oct 19 2016, 10:09 AM",New Member,Group: Junior Member,Posts: 31,Joined: Dec 2013,,Hi do u ship to Hong Kong or knows anyone who does? Thanksss
numbertwo,"  Oct 27 2016, 05:00 PM",Regular,Group: Senior Member,"Posts: 1,597",Joined: Mar 2009,From: PJ lamansara... :D,The chat seems to be offline all the time now and the phone no. is always on offhours mode... something fishy here?
jeins,"  Nov 2 2016, 01:10 PM",New Member,Group: Junior Member,Posts: 4,Joined: Jun 2009,From: Kuala Lumpur,"I really disappointed with them... I used their service twice, twice with different problem. the last time, they lost a parcel of 30+KG , and blamed it to pos laju. and when you contacted them, no one is really helpful. I asked them to gimme prove of passing to poslaju, they can't too. really something fishy....."
wezzien,"  Nov 8 2016, 09:37 AM",New Member,Group: New Member,Posts: 0,Joined: Jun 2011,,"This is the first time i'm using ezbuy and I believe it would be the last too. First of all, I tracked my items which already arrived at the warehouse, & was wondering why the status in Ezbuy is still under ""not reached"". So I tried talked to the customer service via FB messenger, and guess, the customer service told me, we need 5-7 days to update the system! So, my question to the customer service, so which means my things will be staying in your warehouse for a week without I can proceeding any further? And, IF my items lost in somewhere, I can only being notify after a week? So the lead time stated in the page is 5days which is even shorter than the warehouse take to update the system?So ridiculous for the service. I have been using other forwarder for many times, usually they will update latest after a week n then i can just proceed to ship it back. I try Ezbuy just because I saw them frequently pop out in my FB wall. Well after I make noise for 3days which the system still blank! Finally the 5th day it was updated! So I quickly proceed for delivery, and again it took me 2 days to arrange... another day to ship.... and I use priority air, which means is 3-5 working days as per mentioned. but after 3days, still I couldn't check on the status. The tracking status is still ""sorry, no information on this shipment"". Can anyone tell me after how many days of shipment only you guys get to track your parcel? I would says, the whole process before ship already took up to a week for me to settle... and another 1 week for shipment (hopefully it is a week, dare not imagine if it will takes more than a week... )Well, I can confirm, the really spent a lot on marketing! I would rather opt for any small forwarder, they are much efficient and have much better customer service! Oh, and their price are relatively quite competitive too! Certain forwarder, their sender will even send me at 9pm to my doorstep! Text me before they are coming to ensure I'm home.... Ezbuy, sh** forwarder ever!"
J1g54w,"  Nov 8 2016, 11:54 AM",Getting Started,Group: Junior Member,Posts: 85,Joined: Jul 2015,,shoes weigh 8kg? maybe they seludup dadah with your shoes lol
getfromme,"  Nov 10 2016, 10:20 AM",New Member,Group: Junior Member,Posts: 25,Joined: Jun 2009,,May I know which fwd agent u use if buying from taobao? How we can contact the forwarder or can pick directly from taobao when check out?
andrekua2,"  Nov 10 2016, 03:21 PM",Look at all my stars!!,Group: Senior Member,"Posts: 6,368",Joined: Jan 2012,,Taobao system is really good. You must choose the forwarding agent when you place order. The forwarding agent will update your taobao delivery page when your item arrive in their warehouse.
RallyNight,"  Nov 10 2016, 05:22 PM",New Member,Group: Junior Member,Posts: 26,Joined: Nov 2015,,kecian kena conned
nomad90,"  Nov 10 2016, 09:51 PM",New Member,Group: New Member,Posts: 1,Joined: Nov 2016,,but how you know wihich to choose?
andrekua2,"  Nov 10 2016, 10:01 PM",Look at all my stars!!,Group: Senior Member,"Posts: 6,368",Joined: Jan 2012,,"Huh? I'm not sure what are you referring to. I don't use daigou, but more towards recommending buyer to deal direct with Taobao and it's affiliated forwarder. This give you more freedom to add more stuffs and then ship them here in one go. Sometimes can also utiliz the shipping discount and coupons offered by sellers on Taobao.Personally I had really good experience with 4PX."
tblover123,"  Nov 10 2016, 10:02 PM",New Member,Group: New Member,Posts: 0,Joined: Nov 2016,,"ohhhh okay okay, then how bout shopback? are they forwarding agent also? i saw their ads on taobao"
Aerith,"  Nov 28 2016, 04:32 PM",New Member,Group: Junior Member,Posts: 28,Joined: Dec 2010,,"I have the worse experience with them too! Stupid EZbuy ! I will never use their services ever again. SO FRUSTRATING! I was using the Ship-For-Me services to ship some items I've purchase from USA to their USA Warehouse. ITems arrived at their warehouses on time but until today they have yet to update my Ship-for-me details to allow me to begin to consolidate my items to get them shipped back to malaysia. I have asked them to update the details twice ! TWICE! and they said yes yes we will update it asap. And up till today, nothing!   How the hell am I supposed to ship it back when I can't even see my items in the ""Arrived"" Panel . This is so frustrating. And worst of all, their online chat system is so shit. You have to wait forever to finally get a guy to talk to you. And when he does he gives you empty promises (""Yea It will be updated asap"") they promised twice and nothing! BS   I'll never recommend their services to anybody. If you dare to try it go ahead. Don't say we never warned you hahaha"
Aerith,"  Nov 28 2016, 04:40 PM",New Member,Group: Junior Member,Posts: 28,Joined: Dec 2010,,OMG we have the same problem with them!! the worse forwarders ever...   I will never recommend their shit services to anyone.
CatCanFly_,"  Dec 1 2016, 03:38 PM",New Member,Group: Junior Member,Posts: 15,Joined: Sep 2015,,You may request for repack actually
CatCanFly_,"  Dec 1 2016, 03:40 PM",New Member,Group: Junior Member,Posts: 15,Joined: Sep 2015,,"Due to overload of order, it will take slightly longer time for the warehouse to check and update on the received parcel. https://ezbuy.sg/cms/page?cmskey=1111_field_report"
PL71,"  Dec 1 2016, 08:39 PM",New Member,Group: New Member,Posts: 0,Joined: Dec 2016,,"Hi, to anyone who wants to use ezbuy malaysia, beware and avoid using their service! I went through them to make a purchase on 2nd Nov for some party favours for a kid's party on first week Dec.. And the confirmation was made only on the 7th after they asked for payment which was made on 3rd, and went through all the back and forth. I had also stated that this is quite urgent as we need it as soon as possible. On 23rd, they claimed that the shipment just left Guangzhou, of course we already got a nasty surprise as we had made several calls on the same week to ask for the estimated arrival date and was advised that it was arriving already! That is not the worst part, since 27th we started checking on the delivery schedule as there was a message in my account stated that the parcel was out for delivery. However none of the customer service officers could tell me when it will be delivered. On 30th, we called again and they claimed they could not contact the delivery man and thus could not check and unsure the whereabout of my parcel. Today we had to chase for the delivery man who was out and about town in Kuala Lumpur to retrieve our parcel!! This is ridiculous and unprofessional. We had paid rm170 just for shipping. This was already too expensive in my previous experiences shopping directly with 65daigou which is now Ezbuy Singapore or Taobao in Singapore. And I did not experience any incidents like this in my years of shopping online too. Talking about professionalism, Ez buy MY should not continue in this market if they cannot handle simple customer service.. or is not serious about running the business. This is my first time writing a negative review as I always think there should be a second chance given. The Singapore counter part is quite sloppy and slow, but still deliver its promise. I seriously think that the Ez Buy My management is not doing checks on the way the business is managed. Nor do they addressed the underlying issues. DO NOT use Ez Buy My service unless you have lots of time and spare cash to waste and like to make calls to check on them and do car chase with their driver. Talking about retail therapy??"
b0rhui,"  Dec 2 2016, 09:27 PM",On my way,Group: Senior Member,Posts: 508,Joined: Apr 2012,,"Some of my 1111 parcels have yet to arrive in my account (it says received by ezbuy but pending weight measurement and stuff). Luckily I have received part of my orders a week after 1111.Well they must have shitload of parcel to process I'm sure because when I ordered on 1111, some items actually arrived on 1211/1311 and those have been forwarded back alreadyFacepalm but what to do, their price is too competitive hence so people hired them"
vanpersie91,"  Dec 4 2016, 07:06 AM",Regular-ly posting shits and stuffs,Group: Senior Member,"Posts: 1,294",Joined: Jan 2009,From: Hurr Durr Herp Derp Land,Kasut sampai 8kg
alucard89,"  Dec 6 2016, 09:16 PM",Look at all my stars!!,Group: Senior Member,"Posts: 2,228",Joined: Apr 2006,,"Bravo ezbuyBought my item with discounted price during black friday from last weekToday my order got cancelled without my acknowledgement, apparently i had to topup more since i have to pay for full price when i clearly bought that with discounted price.Just how slow is their response when taking orders? Like a week delay?"
duo_duo,"  Dec 9 2016, 05:41 PM",New Member,Group: Junior Member,Posts: 10,Joined: Mar 2016,,Speechless on EZbuy system. My first and last orders with them.
andrekua2,"  Dec 9 2016, 07:03 PM",Look at all my stars!!,Group: Senior Member,"Posts: 6,368",Joined: Jan 2012,,"That's why it is ETA. You need to understand the term well.Generally stuffs do arrived within this time frame but there's chances of delay on seller's processing time after receiving order. There also could be delay in custom check in China before boarding. After it arrived in klia, another check going to happen. After everything cleared, then only can release to distribution center. If it fall on a public holiday, further delays. I do suggest buyer lower their expectation when it comes to these slow mail delivery. They only charge you 15-20 bucks per kg whereas local poslaju already cost RM7.50 per kg."
Aerith,"  Dec 10 2016, 07:56 AM",New Member,Group: Junior Member,Posts: 28,Joined: Dec 2010,,"What a load of bullshit. Too late to help ur company get better reviews la k? Don't come in here and bs bs Ship-for-me shit service My first set of stuff arrived at their warehouse on the 19th nov, only updated after 2 weeks.Then 2nd set of stuff arrived on the 26th nov, up to today they haven't updated it. It's fucking 10th December already ! No way for me to consolidate my items to even start to get it to be shipped over to Malaysia. ? This is too much guys... don't do this to people la... we spend money on these things ... hard earned money guys...? Worst of all they have taken down all the means of contacting them. No more online chat to ask them to assist u. Don't reply emails don't answer calls. They are seriously asking for a law-suit. Just wait someone else who has worse anger management issues would take these guys on in court. The amount of negligence here is just overwhelming.If u believe this guy go ahead. Taste the ez-buy pain. Don't say we never warn u haha"
b0rhui,"  Dec 10 2016, 10:42 AM",On my way,Group: Senior Member,Posts: 508,Joined: Apr 2012,,Don't vent your frustration on me you dlkhead.It was facts that they used to be good hence the customer baseI currently have 3 unarrived parcels ordered since the 1111 and they all arrived at the warehouse on 14/11. Yes they are so bad. Won't even use them for 1212 even if they credited promotion voucher into my account
nevill83,"  Dec 10 2016, 01:32 PM",New Member,Group: New Member,Posts: 0,Joined: Dec 2016,,order item from ezbuy on november and until today still in prepare shipment!!!!!!!!!send msg to customer service but no one fucking reply my msg until today!!!!:angry:    i don't know why they take so long to ship my item to malaysia..they service now so damn slow  i really don't know what the customer service is doing!!!   maybe i have to wait my item to be ship out on year 2017!!!!!cause they are doing a lot a event 12.12.  really frustrating   i can see will be more ezbuy customer stop using they service in future if they still can't handle they service properly .
