Topic title: Kenapa belum dakwa pemimpin Umno Melaka  soal PKR,"Topic posted on: 28 Apr 2017, 11:14:00",Topic link: https://forum.lowyat.net/topic/4277346,"Topic scraped on: 02 Aug 2017, 03:11:40",
username,date,avatar_title,group,post_count,join_date,from,text
joe_mamak,20170428,Casual,Group: Junior Member,Posts: 333,200612,,"http://www.malaysiakini.com/news/380500Kenapa belum dakwa pemimpin Umno Melaka, soal PKR27 Apr 2017Ahli Parlimen Bukit Katil, Shamsul Iskandar Mohd Akin mempersoalkan tindakan Suruhanjaya Pencegahan Rasuah Malaysia (SPRM) yang belum mendakwa pemimpin Umno Melaka atas tuduhan terbabit dalam dua kes rasuah melibatkan nilai rampasan RM150 juta.Menurut laporan akhbar tempatan semalam, mahkamah majistret di negeri itu telah mengeluarkan waran tangkap namun gagal diserahkan kepada lelaki terbabit.""Saya mendesak SPRM tampil dengan segera memberikan penjelasan terhadap kelewatan mendakwa pemimpin terbabit bagi mengelakkan sebarang spekulasi timbul.""Saya juga mendesak agar menghentikan sebarang percubaan 'cover-up' oleh pihak tertentu untuk menyelamatkan pemimpin terbabit,"" kata beliau dalam kenyataan.Shamsul Iskandar yang juga naib presiden PKR berkata, kegagalan mendakwa pemimpin terbabit menimbulkan pelbagai persoalan kepada orang ramai khususnya rakyat Melaka.Ahli politik yang dipercayai mempunyai kaitan dengan pegawai atasan kerajaan Melaka dikatakan akan didakwa mengikut Akta Pencegahan Pengubahan Wang Haram 2001.Mengulas lanjut, Shamsul Iskandar berkata, beliau berasa terkejut dengan laporan akhbar mengenai pemimpin tersebut yang belum lagi didakwa walaupun waran tangkap telah dikeluarkan terhadapnya.""Adalah menjadi rahsia umum bahawa pegawai berkenaan mempunyai hubungan rapat dengan (Ketua Menteri Melaka, Datuk Seri) Idris Haron memandangkan Idris sendiri telah diminta memberikan kerjasama oleh SPRM berkaitan dengan kes rasuah pemimpin UMNO Melaka itu pada awal tahun ini,"" tambahnya.Shamsul Iskandar turut membangkitkan persoalan bagaimana pemimpin itu masih bebas walaupun waran tangkap telah dikeluarkan dan dimana beliau sehinggakan pihak berkuasa gagal menangkapnya.""Apakah beliau dilindungi pimpinan atasan kononnya beliau punyai hubungan secara langsung dengan ketua menteri kerana bimbang Idris akan diheret sama,"" jelas beliau."
keny2020j,20170428,Getting Started,Group: Junior Member,Posts: 276,200906,,"if lge, tomorrow get info, yesterday already catch"
EternalC,20170428,"Take what you can, give nothing back",Group: Senior Member,Posts: 800,200704,From: the sins never die,and previous week sudah penjara
thepark,20170428,New Member,Group: Junior Member,Posts: 8,200907,,And last month sudah kena soal
Jackie-Cham,20170428,Getting Started,Group: Junior Member,Posts: 180,200601,,"They were hoping that you'd forget.Now it's been brought up again, they will make some excuses to delay and try to make you forget again."
ikankering,20170428,New Member,Group: Newbie,Posts: 3,201701,,melaka always good.
joe_mamak,20170504,Casual,Group: Junior Member,Posts: 333,200612,,No news already.......
