Topic title: PKR Adun  Janji PRU13 BN Jadi Projek Gajah Putih,"Topic posted on: 07 May 2017, 23:00:00",Topic link: https://forum.lowyat.net/topic/4283942,"Topic scraped on: 02 Aug 2017, 03:11:14",
username,date,avatar_title,group,post_count,join_date,from,text
ironmaid89,20170507,New Member,Group: Newbie,Posts: 0,201208,,"PKR mendakwa setelah empat tahun pasca PRU13, BN masih tidak menepati janjinya untuk merealisasikan segala manifesto yang mereka janjikan.Adun Batu Tiga, Rodziah Ismail mendakwa semasa berkempen dalam PRU13, Datuk Seri Najib Razak selaku Pengerusi BN, telah menagih pelbagai janji kepada pengundi.""Namun sehingga hari ini malah sudah hampir menjelang PRU14, janji hanya tinggal janji tidak juga ditunaikan,"" katanya dalam satu kenyataan hari ini.Katanya lagi, masalah rakyat di negara ini semakin meruncing tanpa penambahbaikan dengan janjinya dalam beberapa aspek.""Iaitu menyediakan rumah mampu milik: Statistik Jabatan Insolvensi Malaysia pada tahun 2014 menunjukkan 17.6 peratus golongan muflis antara umur 33 hingga 40 tahun disebabkan oleh pinjaman perumahan,""katanya.Mengulas lanjut, Rodziah berkata hakikatnya, ramai golongan muda tidak mampu memiliki rumah disebabkan kelemahan polisi perumahan rakyat yang membiarkan projek-projek perumahan pemaju swasta tidak dikawal harga.""Peluang Mendapat Perkhidmatan Kesihatan Berkualiti: Awal tahun ini, rakyat dikejutkan dengan isu kenaikan caj hospital kerajaan, meskipun melibatkan wad kelas 1 dan 2,"" katanya.Katanya, 'kualiti' juga perlu termasuk kecekapan dan kecepatan layanan perkhidmatan hospital terhadap pelanggan, bukannya membiarkan pesakit tunggu berjam-jam lamanya untuk mendapatkan rawatan.Dalam pada itu, katanya, BN juga dilihat tidak meningkatkan keselamatan dan ketenteraman awam.""Saya hargai usaha pihak polis dan tentera selama ini untuk menjaga keamanan.""Bagaimanapun, saya mengkritik BN yang tidak begitu responsif dalam isu penambahan aset ketenteraan, pembangunan logistik mahupun pengendalian isu-isu besar seperti kehadiran kapal perang China di perairan Sarawak baru-baru ini,"" katanya lagi.Ujarnya, perkara sama berlaku dalam memperkasakan penyertaan wanita dan aspek pemuliharaan sumber semula jadi.http://www.sinarharian.com.my/edisi/selang...-putih-1.671021"
Reckoning,20170507,New Member,Group: Junior Member,Posts: 36,201310,,Can someone check back manifesto by oenang and selangor gov for me please
ikankering,20170508,New Member,Group: Newbie,Posts: 3,201701,,ppl still will vote bn coz don't want become kelantan pas.
xcxa23,20170508,Enthusiast,Group: Senior Member,Posts: 796,201011,,"Dah malas..If anyone think current market n economy gd, and feel barang turun dahContinue vote bn."
@zan65,20170508,New Member,Group: Junior Member,Posts: 19,201612,From: Penang - Skudai,"U can janji u akan fix the housing price and show me the way, I vote you!"
drowning,20170508,New Member,Group: Junior Member,Posts: 16,201303,,BR1M kan ada
