Topic title: Survey claims Malay support for BN and Harapan alm,"Topic posted on: 21 Jul 2017, 09:42:00",Topic link: https://forum.lowyat.net/topic/4365660,"Topic scraped on: 02 Aug 2017, 02:54:58",
username,date,avatar_title,group,post_count,join_date,from,text
upcars,20170721,New Member,Group: Newbie,Posts: 3,201702,,"MH5OlyI_7pQSurvey claims Malay support for BN and Harapan almost equalPublished on Jul 20, 2017A survey by PKR-linked Invoke claims that Pakatan Harapan may be able to win the next election, with ""Malay"" support for the opposition bloc and BN almost neck and neck.According to the survey, support among Malays - which also included Sabah and Sarawak bumiputera - for Harapan is 36 percent, and BN 35 percent.Among Chinese and Indians, support for Harapan was at 53 percent and 42 percent respectively.Support for BN was at 22 percent among Chinese respondents, and 42 percent among Indians."
amxpayne67,20170721,The Coon,Group: Senior Member,Posts: 683,201003,From: Puchong Extreme,ini kalilahberapa kali dah
ibnunarsim,20170721,Getting Started,Group: Junior Member,Posts: 211,201201,From: Klang - KL - Klang,By INVOKE... HAHAHAHAHA....
tupaiterbang,20170721,Getting Started,Group: Junior Member,Posts: 60,201203,,bangla punya percentage mana? cakap bangla pun vote..
LamboSama,20170721,Getting Started,Group: Junior Member,Posts: 67,201108,,Survey. ...why not use /k poll.
Kaerna,20170721,Getting Started,Group: Junior Member,Posts: 282,200802,,Never trust survey or opinion polls.They say Hillary will win and Trump GG.
Darth Gaylord,20170721,New Member,Group: Newbie,Posts: 2,201307,,well.. we all know that no matter how.. BN still gonna win this term....in a very bad way..
