username,date,text
论坛咨询,2017-3-2 10:54 AM,"2017-3-2 10:53 AM 上传
下载附件 (63.72 KB)






马华前总会长翁诗杰以专注文化商务工作，并认为自己不适合政治游戏为由，已于两个月前的1月2日，退出马华。

翁诗杰接受《中国报》访问时说，由于觉得本身并不适合继续留在马华，所以毅然辞职。

“对，（退党）今年1月2日开始生效，我已经不是马华党员，我觉得不适合留下来。”

没计划加入其他政党

翁诗杰说，他退党后没有计划加入其他政党，只会专注在文化和商务工作，并计划写书。

“我退党没有对外宣布，我想当个普通老百姓，我不适合政治游戏，我从1981年从政至今，已经36年。”

他暗示，有人不让他在大选时上阵，一小撮人还认为他胜算不高，所以他认为，自己留在马华也已无意思。

谴责政府滥用国安法

翁诗杰现年61岁，他于2008年大选后出任交通部长，并在同年10月的马华党选胜选，担任马华第8任总会长。

不过，他在2010年的马华特大重选中捍卫总会长一职失利，由蔡细历取得代之。

翁诗杰接着在2013年马华党选中再竞逐总会长一职，但他一样在三角战中落败。

虽然翁诗杰（见图右）之后就不在政坛活跃，但他于2015年与数名前国阵老大召开记者会，严厉谴责政府滥用国安法。

他当时说，若他是马华现任领导，可能就会在党内或华社发动公投，以了解党员或华社是否认同马华脱离国阵。

新闻转载自：当今大马"
JackKoh,2017-3-2 02:35 PM,"玩了这么久，你才说你不适合。。。
是因为赚够了吧！"
JackKoh,2017-3-2 02:35 PM,"要不然就是，明争暗斗里，
斗输了吧？"
Alt,2017-3-2 06:22 PM,"本帖最后由 Alt 于 2017-3-2 06:25 PM 编辑 

也算是个贤才吧，可惜没有贤君，只能像楚霸王那样感叹时不利兮骓不逝，不善拉拢人心搞群体抵制的人，也只能这样了。"
wz_lambo,2017-3-2 08:32 PM,政治都是自私自利...人心險惡...要贏一定要奸詐...狡猾...還要靠運氣...
qwqwqwqw,2017-3-3 10:40 AM,捞够了就走咯..可以享福了
space_boy_88,2017-3-4 03:43 PM,都玩了36年，现在才说不适合，是不是有点奇怪
