username,date,text
论坛咨询,2017-2-20 04:57 PM,"2017-2-20 04:57 PM 上传
下载附件 (663.3 KB)






伊斯兰党在上周六发动支撑修改355法令大集会，结果出席人数比30万目标人数差了一大截，时评员认为伊党大势已去，若在全国大选单打独斗，伊党将会惨败。

国民大学大马与国际研究系教授法沙哈兹斯向Malay Mail Online指出，根据报导，有关大集会只有两万人出席，这显示伊党修改355法令的议程没有获得全国穆斯林的支持。

“355法令修正案是伊党的政治命根，如果伊党吸引不到穆斯林出席大集会，这显示城市地区的选民不支持伊党。”

他更预测，伊党予人“最有影响力的马来政党”形象可能因此破灭，那么伊党真的以不结盟方式上阵大选，伊党一定会输得很惨。

南洋理工大学拉惹勒南国际研究院（RSIS）高级院士兼时评人吴逸山也说，以目前的情况来看，如果伊党无法与巫统结成选举结盟，那么下届大选将会是伊党的大灾难。

他说，无可置疑，伊党在一些州属的确有一定的支持率，但是就没有全国性的影响力。

至于355法令修正法案会否在下个月的国会下议院会议被提呈，他表示难以预测，但是如果该法案真的被提呈，穆斯林国会议员的确不可投反对票，否则会被标签为叛教。

“在这个越来越保守的马来社会，穆斯林政治人物无法承受叛教的罪名。”

新闻转载自：M中文网"
JackKoh,2017-2-20 07:09 PM,左反右翻，结果国家不进步。。。反而越走越倒退！
sung11,2017-2-20 08:33 PM,如果伊党一上阵会变三角战或更多这样国阵很容易赢
