username,date,text
论坛咨询,2016-2-27 11:39 AM,"2016-2-27 11:39 AM 上传
下载附件 (28.64 KB)






被巫統凍結署理主席職的丹斯里慕尤丁宣稱，前總檢察長丹斯里阿都干尼曾經向他出示證據和告知，由SRC國際有限公司匯入首相拿督斯里納吉的戶頭是刑事罪，他為此感到驚訝（Saya beristighfar）。

慕尤丁也是前副首相，他今日發表文告指出， 他對巫統最高理事會凍結其黨職的決定不感到驚訝，這早在他預料之中。

他說，自他在內閣改組中被除名后，他已被阻止執行署理主席職工作，也被阻止出席黨活動，一些為他而舉行的黨活動，也受指示取消。

“支持我的黨員也受到恐嚇，身為署理主席，我更被阻止在巫統大會上發言，這是歷史上第一次。”


新闻转载自：《中国报》
原文链接：http://www.chinapress.com.my/?p=593217"
JackKoh,2016-2-27 12:48 PM,"说他有罪就是罪，首相怎能被定罪？
说他有罪怕得罪，首相人好哪有罪？
说他有罪就犯罪，首相不可能认罪！
说他有罪变没罪，首相叫人来顶罪！"
AMBER_YIN,2016-2-27 10:16 PM,在无所不能的大马，你的相信对他们来说是毫无价值的。
chuahoe,2016-3-2 11:56 AM,"这社会原本就是真真假假,"
