title,time,page no,link
Does Starbucks taste like shit?,"Yesterday, 12:53 PM",17,https://forum.lowyat.net/Kopitiam/topic/4341833
7-11 tutup kedai completely in Indonesia,"Jun 27 2017, 12:10 AM",17,https://forum.lowyat.net/Kopitiam/topic/4340397
Guangzhou will run MRT at 160 km/h!,"Jun 23 2017, 10:24 PM",17,https://forum.lowyat.net/Kopitiam/topic/4337691
New Years Resolution,"Yesterday, 01:25 PM",17,https://forum.lowyat.net/Kopitiam/topic/4341873
Holidays of the undergrad and unemployed,"Yesterday, 09:23 AM",17,https://forum.lowyat.net/Kopitiam/topic/4341642
MY upgraded to Tier 2 in US Trafficking Report,"Yesterday, 12:57 PM",17,https://forum.lowyat.net/Kopitiam/topic/4341837
MR DIY pros and cons,"Jun 27 2017, 08:44 PM",17,https://forum.lowyat.net/Kopitiam/topic/4341375
Blue beard man rants in fluent Hokkien. Funny!,"Yesterday, 12:42 PM",17,https://forum.lowyat.net/Kopitiam/topic/4341823
Malaysia Fintech Firm Soft Space Raises USD 5mill,"Yesterday, 12:59 PM",17,https://forum.lowyat.net/Kopitiam/topic/4341840
Old funny chinese movie,"Yesterday, 03:04 AM",17,https://forum.lowyat.net/Kopitiam/topic/4341565
malay and chinese is becoming indistinguishable,"Jun 27 2017, 06:37 PM",17,https://forum.lowyat.net/Kopitiam/topic/4341262
Do U agree with this article ?,"Yesterday, 12:25 PM",17,https://forum.lowyat.net/Kopitiam/topic/4341803
Lonely bachelor gave life savings to Nigerian scam,"Yesterday, 12:49 PM",17,https://forum.lowyat.net/Kopitiam/topic/4341829
Who is working today ?,"Yesterday, 08:35 AM",17,https://forum.lowyat.net/Kopitiam/topic/4341615
planning a scam,"Yesterday, 12:59 PM",17,https://forum.lowyat.net/Kopitiam/topic/4341841
Why kl ppl not nice?,"Jun 27 2017, 10:46 AM",17,https://forum.lowyat.net/Kopitiam/topic/4340642
From gangster to law degree holder,"Yesterday, 12:39 PM",17,https://forum.lowyat.net/Kopitiam/topic/4341821
China risk lurks behind robust Japan stock market!,"Yesterday, 12:53 PM",17,https://forum.lowyat.net/Kopitiam/topic/4341834
EhCBai (EzBuy) so lousy one,"Nov 23 2016, 11:14 AM",17,https://forum.lowyat.net/Kopitiam/topic/4122852
34yo singki arrested in Cambodia for cheating $4M,"Yesterday, 12:27 PM",17,https://forum.lowyat.net/Kopitiam/topic/4341805
Nigerian fraudster face jail in UK over 10m fraud,"Yesterday, 12:47 PM",18,https://forum.lowyat.net/Kopitiam/topic/4341827
SINGAPORE EPF HAVE lifelong monthly payout!,"Jun 23 2017, 10:02 AM",18,https://forum.lowyat.net/Kopitiam/topic/4337087
Timex Expedition Field Chronograph,"Sep 21 2015, 08:59 PM",18,https://forum.lowyat.net/Kopitiam/topic/3719701
MY man shares heartwarming story of helping two,"Yesterday, 12:37 PM",18,https://forum.lowyat.net/Kopitiam/topic/4341819
couch,"Jun 27 2017, 11:44 PM",18,https://forum.lowyat.net/Kopitiam/topic/4341490
Mr. DIY fanclub V1,"May 2 2014, 11:52 AM",18,https://forum.lowyat.net/Kopitiam/topic/3211741
Thai & Vietnam movies with English subtitles,"Apr 27 2017, 10:15 PM",18,https://forum.lowyat.net/Kopitiam/topic/4277082
Annual Leaves,"Yesterday, 09:47 AM",18,https://forum.lowyat.net/Kopitiam/topic/4341655
Persona 5 is the best! Sapa Dah main?,"May 3 2017, 03:09 PM",18,https://forum.lowyat.net/Kopitiam/topic/4280856
do u like packaging Pan Mee?,"Yesterday, 11:02 AM",18,https://forum.lowyat.net/Kopitiam/topic/4341715
Custom tshirt service. Can recommend?,"Jun 26 2017, 11:35 AM",18,https://forum.lowyat.net/Kopitiam/topic/4339712
Dash Cam (Car Video Recorder),"Apr 23 2014, 02:23 PM",18,https://forum.lowyat.net/Kopitiam/topic/3202809
"kl kopitiam sell penang food, but not sinki food","Yesterday, 11:51 AM",18,https://forum.lowyat.net/Kopitiam/topic/4341776
When you tender for resignation,"Yesterday, 10:07 AM",18,https://forum.lowyat.net/Kopitiam/topic/4341673
line walker 2 october on!so late!,"Yesterday, 01:40 AM",18,https://forum.lowyat.net/Kopitiam/topic/4341542
"G20 host city sends Berlin cops home after booze,","Yesterday, 10:02 AM",18,https://forum.lowyat.net/Kopitiam/topic/4341669
Guys with no cars and small cars,"Jun 27 2017, 08:50 PM",18,https://forum.lowyat.net/Kopitiam/topic/4341380
What do you do with your old phones?,"Yesterday, 09:46 AM",18,https://forum.lowyat.net/Kopitiam/topic/4341653
Women-only subway carriages in China,"Yesterday, 11:45 AM",18,https://forum.lowyat.net/Kopitiam/topic/4341768
The best gift for guys,"Yesterday, 11:12 AM",18,https://forum.lowyat.net/Kopitiam/topic/4341729
Splitting Electric bills for rent house,"Yesterday, 10:19 AM",18,https://forum.lowyat.net/Kopitiam/topic/4341679
"Anyone got SINUS problem, surgery experience?","May 9 2017, 01:28 PM",18,https://forum.lowyat.net/Kopitiam/topic/4285120
Car Accident,"Yesterday, 09:49 AM",18,https://forum.lowyat.net/Kopitiam/topic/4341659
WOI malays!,"Yesterday, 10:51 AM",18,https://forum.lowyat.net/Kopitiam/topic/4341703
Mod come in,"Jun 27 2017, 05:27 PM",18,https://forum.lowyat.net/Kopitiam/topic/4341204
niama! housemate no check pocket before washing,"Jun 27 2017, 10:35 PM",18,https://forum.lowyat.net/Kopitiam/topic/4341441
Being an introvert during Eid SUCKS,"Yesterday, 12:29 AM",18,https://forum.lowyat.net/Kopitiam/topic/4341509
Peguam Negara Apandi: Tindakan Saman Sivil Terbaru,"Jun 27 2017, 03:10 PM",18,https://forum.lowyat.net/Kopitiam/topic/4340967
Filipino civilians forced to join Isil,"Yesterday, 08:50 AM",18,https://forum.lowyat.net/Kopitiam/topic/4341625
Choosing massage chair,"Sep 3 2016, 12:22 AM",18,https://forum.lowyat.net/Kopitiam/topic/4045689
"Why the shock, when we taught them how to bully?","Yesterday, 10:00 AM",19,https://forum.lowyat.net/Kopitiam/topic/4341668
Charging Shipping Certificate,"Yesterday, 10:25 AM",19,https://forum.lowyat.net/Kopitiam/topic/4341683
My recently went to Tokyo & Hokkaido,"Jun 24 2017, 01:29 PM",19,https://forum.lowyat.net/Kopitiam/topic/4338146
How come money game die so fast,"Yesterday, 10:10 AM",19,https://forum.lowyat.net/Kopitiam/topic/4341675
tourism tax delay until 1 ogos,"Yesterday, 09:33 AM",19,https://forum.lowyat.net/Kopitiam/topic/4341645
Why is the IDP so ugly?,"Yesterday, 10:14 AM",19,https://forum.lowyat.net/Kopitiam/topic/4341677
The two faces of Malaysia,"Yesterday, 09:55 AM",19,https://forum.lowyat.net/Kopitiam/topic/4341664
Escalator strike again,"Jun 27 2017, 09:58 PM",19,https://forum.lowyat.net/Kopitiam/topic/4341420
WHAT IS THE HIGHEST RETURN PER ANNUM,"Jun 25 2017, 11:11 PM",19,https://forum.lowyat.net/Kopitiam/topic/4339445
Miranda Kerr Hands Over $8.1 Million in Jewelry,"Jun 27 2017, 10:10 AM",19,https://forum.lowyat.net/Kopitiam/topic/4340610
Whos Danny and whys he buried next to,"Jun 27 2017, 04:58 PM",19,https://forum.lowyat.net/Kopitiam/topic/4341141
Anjing gigit.,"Jun 27 2017, 04:15 PM",19,https://forum.lowyat.net/Kopitiam/topic/4341042
Accidental sieg heil,"Yesterday, 08:44 AM",19,https://forum.lowyat.net/Kopitiam/topic/4341621
Girl share how to hide bloated tummy,"Yesterday, 09:29 AM",19,https://forum.lowyat.net/Kopitiam/topic/4341643
"Movida attack: 1 year on, couple speak of pain","Yesterday, 09:45 AM",19,https://forum.lowyat.net/Kopitiam/topic/4341650
Aunty squeeze arm and thigh,"Yesterday, 09:20 AM",19,https://forum.lowyat.net/Kopitiam/topic/4341640
why hate hadi/pas?,"Jun 24 2017, 08:18 PM",19,https://forum.lowyat.net/Kopitiam/topic/4338429
Cute Raya look,"Yesterday, 08:09 AM",19,https://forum.lowyat.net/Kopitiam/topic/4341602
Trump kantoi-ed himself again,"Jun 21 2017, 09:49 AM",19,https://forum.lowyat.net/Kopitiam/topic/4333810
Investors upbeat about Malaysian property,"Yesterday, 09:18 AM",19,https://forum.lowyat.net/Kopitiam/topic/4341637
watch the mummy or pirates of the Caribbean?,"Yesterday, 07:54 AM",19,https://forum.lowyat.net/Kopitiam/topic/4341597
only if i hv gf like this,"Jun 26 2017, 10:04 PM",19,https://forum.lowyat.net/Kopitiam/topic/4340332
Science or business path?,"Jun 27 2017, 01:42 AM",19,https://forum.lowyat.net/Kopitiam/topic/4340440
LOOK OUT POINT AMPANG,"Jan 15 2016, 05:39 PM",19,https://forum.lowyat.net/Kopitiam/topic/3838775
Elizabeth Tan inside man's car!,"Jun 27 2017, 04:58 PM",19,https://forum.lowyat.net/Kopitiam/topic/4341143
Conflicting tunnel project info,"Yesterday, 08:48 AM",19,https://forum.lowyat.net/Kopitiam/topic/4341624
Can I Watch Astro On TV Box?,"Feb 13 2017, 12:05 AM",19,https://forum.lowyat.net/Kopitiam/topic/4195815
Woman caught driving wrong way on highway,"Jun 27 2017, 02:18 AM",19,https://forum.lowyat.net/Kopitiam/topic/4340453
Building underground train interchange in 1900,"Jun 26 2017, 12:09 PM",19,https://forum.lowyat.net/Kopitiam/topic/4339758
Porn,"Jun 27 2017, 02:27 PM",19,https://forum.lowyat.net/Kopitiam/topic/4340911
SG Fresh grads' starting pay hits $3360 minimum,"Jun 27 2017, 01:11 PM",20,https://forum.lowyat.net/Kopitiam/topic/4340821
BITCOIN - SANDWICH,"Jun 24 2017, 04:40 PM",20,https://forum.lowyat.net/Kopitiam/topic/4338264
Okamoto condom,"Jun 26 2017, 12:13 PM",20,https://forum.lowyat.net/Kopitiam/topic/4339765
Rekomen the best energy drink in Malaysia,"Jun 27 2017, 10:12 PM",20,https://forum.lowyat.net/Kopitiam/topic/4341427
Why girl ask u,"Jun 26 2017, 11:50 AM",20,https://forum.lowyat.net/Kopitiam/topic/4339729
I smashed my Mi Note,"Jun 3 2017, 08:30 PM",20,https://forum.lowyat.net/Kopitiam/topic/4309929
Genting/Guerrilla Gamblers Club XL+V,"Jan 21 2016, 11:55 AM",20,https://forum.lowyat.net/Kopitiam/topic/3846257
Boys VS Girls,"Yesterday, 01:04 AM",20,https://forum.lowyat.net/Kopitiam/topic/4341530
Why babies laugh a lot?,"Jun 27 2017, 09:20 AM",20,https://forum.lowyat.net/Kopitiam/topic/4340578
my aunt ask me why i still single this raya,"Jun 27 2017, 04:19 PM",20,https://forum.lowyat.net/Kopitiam/topic/4341053
"Samsung DeX, i almost jizzed in pants","Apr 1 2017, 01:16 AM",20,https://forum.lowyat.net/Kopitiam/topic/4244454
Can argue?,"Jun 26 2017, 01:28 AM",20,https://forum.lowyat.net/Kopitiam/topic/4339511
Malaysia Fuel Price APP,"May 9 2017, 09:43 AM",20,https://forum.lowyat.net/Kopitiam/topic/4284913
car is a lifestyle,"Jun 27 2017, 04:38 PM",20,https://forum.lowyat.net/Kopitiam/topic/4341102
Sarawak CM Abang Johari: Unaware Of Trip,"Jun 27 2017, 09:44 AM",20,https://forum.lowyat.net/Kopitiam/topic/4340595
Takde Civic Co-Incidents,"Jun 27 2017, 10:27 PM",20,https://forum.lowyat.net/Kopitiam/topic/4341438
My salary expectation,"Jun 27 2017, 09:33 PM",20,https://forum.lowyat.net/Kopitiam/topic/4341401
Taib Mahmud Wife Raghad Kurdi And Son Sulaiman,"Jun 26 2017, 09:34 PM",20,https://forum.lowyat.net/Kopitiam/topic/4340315
working in singapore fun?,"Jun 27 2017, 09:05 PM",20,https://forum.lowyat.net/Kopitiam/topic/4341388
I made a donation of RM100 to charity today,"Jun 27 2017, 09:23 PM",20,https://forum.lowyat.net/Kopitiam/topic/4341398
vietmoi,"Jun 27 2017, 11:42 PM",20,https://forum.lowyat.net/Kopitiam/topic/4341488
starting pay isn't low in malaysia,"Jun 27 2017, 02:41 PM",20,https://forum.lowyat.net/Kopitiam/topic/4340928
Grandfather of the CRT LED LCD OLED,"Jun 27 2017, 11:48 PM",20,https://forum.lowyat.net/Kopitiam/topic/4341493
Fast n Furious: Belarus Edition,"Jun 27 2017, 11:44 PM",20,https://forum.lowyat.net/Kopitiam/topic/4341489
Oi Penang people,"Jun 27 2017, 04:02 PM",20,https://forum.lowyat.net/Kopitiam/topic/4341009
Tolong! Help me :(,"Jun 27 2017, 03:06 AM",20,https://forum.lowyat.net/Kopitiam/topic/4340477
Tmr Plus Jam or not ?,"Jun 26 2017, 10:21 PM",20,https://forum.lowyat.net/Kopitiam/topic/4340339
What kind of colleague you dislike the most?,"Jun 27 2017, 11:54 AM",20,https://forum.lowyat.net/Kopitiam/topic/4340738
where to buy PS4 now?,"Jun 27 2017, 10:36 PM",20,https://forum.lowyat.net/Kopitiam/topic/4341443
Ktards = arrogant. Ask for help cannot.,"Jun 27 2017, 09:40 PM",20,https://forum.lowyat.net/Kopitiam/topic/4341405
Why korean dramas are so nice?,"Jun 27 2017, 09:23 PM",21,https://forum.lowyat.net/Kopitiam/topic/4341399
Michelle Yeoh in new Star Trek TV Series!,"Jun 27 2017, 01:42 PM",21,https://forum.lowyat.net/Kopitiam/topic/4340851
Hai....how do you do?,"Jun 27 2017, 09:17 PM",21,https://forum.lowyat.net/Kopitiam/topic/4341395
Unifi Lite 10mbps,"Mar 29 2017, 05:38 PM",21,https://forum.lowyat.net/Kopitiam/topic/4241765
Anyone still has the Casio F91W?,"Jun 27 2017, 10:43 PM",21,https://forum.lowyat.net/Kopitiam/topic/4341446
Quhitam making Watson msia under fire?,"Jun 7 2017, 10:13 PM",21,https://forum.lowyat.net/Kopitiam/topic/4317689
Traditional way of catching crabs,"Jun 27 2017, 09:48 PM",21,https://forum.lowyat.net/Kopitiam/topic/4341411
Stupid things you do when you were young/school,"Jun 27 2017, 12:50 AM",21,https://forum.lowyat.net/Kopitiam/topic/4340424
U in love with ur GF..can u accept she piap girl?,"Jun 25 2017, 11:10 PM",21,https://forum.lowyat.net/Kopitiam/topic/4339443
how long do u take bath?,"Jun 27 2017, 08:23 PM",21,https://forum.lowyat.net/Kopitiam/topic/4341362
what mat motor do that car people dont like?,"Jun 22 2017, 01:42 AM",21,https://forum.lowyat.net/Kopitiam/topic/4335093
Why shopping mall ppl like to block path,"Jun 27 2017, 10:38 AM",21,https://forum.lowyat.net/Kopitiam/topic/4340632
Gambar gambar raya 1 kat kampung,"Jun 27 2017, 10:05 PM",21,https://forum.lowyat.net/Kopitiam/topic/4341422
My ugly friend like beautiful girl,"Jun 27 2017, 09:56 PM",21,https://forum.lowyat.net/Kopitiam/topic/4341418
another sohai FF inspired movie,"Jun 27 2017, 09:52 PM",21,https://forum.lowyat.net/Kopitiam/topic/4341414
where to buy cheapest carton of beer?,"Jun 25 2017, 12:19 PM",21,https://forum.lowyat.net/Kopitiam/topic/4338814
NEW SONG! POP DIVA of Malaysia 2017! MUACKS!,"Jun 27 2017, 09:36 PM",21,https://forum.lowyat.net/Kopitiam/topic/4341403
White Police in St.Louis Shoots Off-Duty colleague,"Jun 27 2017, 07:51 PM",21,https://forum.lowyat.net/Kopitiam/topic/4341335
Ai de jiu shi ni :),"Jun 27 2017, 09:54 PM",21,https://forum.lowyat.net/Kopitiam/topic/4341416
Aku jadi tekanan bila baca isu semasa sekarang ni,"Jun 26 2016, 12:30 AM",21,https://forum.lowyat.net/Kopitiam/topic/3985233
Budak dilanyak kereta. Sarahan siape?,"Jun 27 2017, 11:48 AM",21,https://forum.lowyat.net/Kopitiam/topic/4340733
Gillette cartridge price (price confusing),"Jun 27 2017, 09:25 PM",21,https://forum.lowyat.net/Kopitiam/topic/4341400
Banana has seed,"Jun 27 2017, 08:27 PM",21,https://forum.lowyat.net/Kopitiam/topic/4341366
Help me start dating hi quality men,"Jun 27 2017, 07:37 PM",21,https://forum.lowyat.net/Kopitiam/topic/4341322
old tapi gold,"Jun 27 2017, 09:16 PM",21,https://forum.lowyat.net/Kopitiam/topic/4341394
note 4 screen rosak,"Jun 27 2017, 09:14 PM",21,https://forum.lowyat.net/Kopitiam/topic/4341392
China asks India to withdraw troops from Nathu La,"Jun 27 2017, 04:42 PM",21,https://forum.lowyat.net/Kopitiam/topic/4341109
Is it fair to work extra on weekend?,"Jun 27 2017, 10:50 AM",21,https://forum.lowyat.net/Kopitiam/topic/4340647
Malindo Air OD132 engine failure,"Jun 27 2017, 09:11 PM",21,https://forum.lowyat.net/Kopitiam/topic/4341391
KL ppl are selfish and weak,"Jun 27 2017, 07:49 PM",21,https://forum.lowyat.net/Kopitiam/topic/4341332
After raya,"Jun 27 2017, 08:49 PM",22,https://forum.lowyat.net/Kopitiam/topic/4341379
Who is he?,"Jun 27 2017, 12:26 PM",22,https://forum.lowyat.net/Kopitiam/topic/4340773
Cancellation of trips by Chinese tourists alarming,"Jun 27 2017, 07:43 PM",22,https://forum.lowyat.net/Kopitiam/topic/4341328
Success with dropshipping?,"Jun 27 2017, 08:13 PM",22,https://forum.lowyat.net/Kopitiam/topic/4341358
Average monthly data usage,"Jun 27 2017, 08:24 PM",22,https://forum.lowyat.net/Kopitiam/topic/4341364
Most phone data used,"Jun 27 2017, 05:57 PM",22,https://forum.lowyat.net/Kopitiam/topic/4341228
Explosion heard from ship,"Jun 27 2017, 06:08 PM",22,https://forum.lowyat.net/Kopitiam/topic/4341239
Foreign workers hangout in KL,"Jun 27 2017, 12:06 PM",22,https://forum.lowyat.net/Kopitiam/topic/4340747
KL cabbies to protest against Isa Samads SPAD,"Jun 27 2017, 06:35 PM",22,https://forum.lowyat.net/Kopitiam/topic/4341261
how fast to drive on highway?,"Jun 27 2017, 04:36 PM",22,https://forum.lowyat.net/Kopitiam/topic/4341097
Minchen tumbuk.,"Jun 27 2017, 05:26 PM",22,https://forum.lowyat.net/Kopitiam/topic/4341203
todei i watch king arthur,"May 20 2017, 11:31 PM",22,https://forum.lowyat.net/Kopitiam/topic/4295840
To the Bone,"Jun 27 2017, 07:59 PM",22,https://forum.lowyat.net/Kopitiam/topic/4341343
Star Wars Battlefront 2,"Jun 27 2017, 07:55 PM",22,https://forum.lowyat.net/Kopitiam/topic/4341340
"Alhamdulillah Maria, sayang pandan Maria","Jun 27 2017, 07:56 PM",22,https://forum.lowyat.net/Kopitiam/topic/4341342
want to ask about postage,"Jun 27 2017, 07:51 PM",22,https://forum.lowyat.net/Kopitiam/topic/4341336
Please troll this,"Jun 27 2017, 04:32 PM",22,https://forum.lowyat.net/Kopitiam/topic/4341089
will u start ur business with take franchise?,"Jun 27 2017, 12:51 AM",22,https://forum.lowyat.net/Kopitiam/topic/4340425
Teddy going thailand but can't make it,"Jun 27 2017, 07:37 PM",22,https://forum.lowyat.net/Kopitiam/topic/4341323
What jobs should we automate next?,"Jun 27 2017, 07:02 PM",22,https://forum.lowyat.net/Kopitiam/topic/4341285
"Habis, all kena tipu","Jun 27 2017, 11:29 AM",22,https://forum.lowyat.net/Kopitiam/topic/4340702
Pan Borneo,"Jun 27 2017, 02:12 PM",22,https://forum.lowyat.net/Kopitiam/topic/4340892
Probes into AirAsia engine failure,"Jun 27 2017, 05:17 PM",22,https://forum.lowyat.net/Kopitiam/topic/4341189
"Who here like Cili Padi/Belacan, but also easily","Jun 27 2017, 06:45 PM",22,https://forum.lowyat.net/Kopitiam/topic/4341270
How can foreigners get mobile and data?,"Jun 27 2017, 06:53 PM",22,https://forum.lowyat.net/Kopitiam/topic/4341278
Information about Riau Nation Independence,"Jun 27 2017, 07:11 PM",22,https://forum.lowyat.net/Kopitiam/topic/4341297
Terapi Urutan Malaysia kini produk pelancongan,"Jun 27 2017, 06:45 PM",22,https://forum.lowyat.net/Kopitiam/topic/4341269
what so great bout christopher reeve superman?,"Jun 27 2017, 10:26 AM",22,https://forum.lowyat.net/Kopitiam/topic/4340622
1 Belt 1 Road doomed to fail?,"Jun 27 2017, 02:12 PM",22,https://forum.lowyat.net/Kopitiam/topic/4340891
These few days comfirm KL is jam free?,"Jun 27 2017, 06:25 PM",22,https://forum.lowyat.net/Kopitiam/topic/4341248
Top 10 PEWDIEPIE videos,"Jun 27 2017, 05:33 PM",23,https://forum.lowyat.net/Kopitiam/topic/4341207
kesah sejuk kazen hotstuff,"Jun 27 2017, 05:07 PM",23,https://forum.lowyat.net/Kopitiam/topic/4341161
maxis fiber with,"Jun 27 2017, 06:29 PM",23,https://forum.lowyat.net/Kopitiam/topic/4341252
Any Sembo Block player?,"Jun 27 2017, 06:26 PM",23,https://forum.lowyat.net/Kopitiam/topic/4341249
Indonesian police find ISIS propaganda books,"Jun 27 2017, 06:06 PM",23,https://forum.lowyat.net/Kopitiam/topic/4341235
"Brunei economy surpasses Japan, Italy and Malaysia","Jun 27 2017, 11:56 AM",23,https://forum.lowyat.net/Kopitiam/topic/4340740
Asia Top 10 Countries by Avg Monthly Net Salary,"Jun 27 2017, 11:45 AM",23,https://forum.lowyat.net/Kopitiam/topic/4340727
Wednesday blues.......,"Jun 27 2017, 05:40 PM",23,https://forum.lowyat.net/Kopitiam/topic/4341215
Khalid to Hadi: We never asked anyone to colonise,"Jun 24 2017, 11:24 PM",23,https://forum.lowyat.net/Kopitiam/topic/4338535
Simple question about battery capacity,"Jun 20 2017, 05:54 PM",23,https://forum.lowyat.net/Kopitiam/topic/4333351
Rape survivor says was forced into 12 abortions,"Jun 27 2017, 04:38 PM",23,https://forum.lowyat.net/Kopitiam/topic/4341100
Teenage boy kills his father for raping his sister,"Jun 27 2017, 04:34 PM",23,https://forum.lowyat.net/Kopitiam/topic/4341091
Jho Low enjoice Miranda siham 1 year,"Jun 27 2017, 02:46 PM",23,https://forum.lowyat.net/Kopitiam/topic/4340935
Watching porn make u respect women less?,"Jun 27 2017, 11:31 AM",23,https://forum.lowyat.net/Kopitiam/topic/4340704
More trouble for 1MDB-linked Red Granite Pictures,"Jun 27 2017, 05:07 PM",23,https://forum.lowyat.net/Kopitiam/topic/4341160
Where to find laksam and chendol in kedah?,"Jun 27 2017, 05:20 PM",23,https://forum.lowyat.net/Kopitiam/topic/4341196
Pinjaman wang berlesen tanpa payslip,"Nov 12 2014, 02:46 AM",23,https://forum.lowyat.net/Kopitiam/topic/3407699
Can recommend watch for outdoor use?,"Jun 27 2017, 04:30 PM",23,https://forum.lowyat.net/Kopitiam/topic/4341085
Credit Card bank mana paling bagus / teruk,"Jun 27 2017, 03:03 PM",23,https://forum.lowyat.net/Kopitiam/topic/4340957
A friend of 10 years who recently became a REN is,"Jun 25 2017, 06:58 PM",23,https://forum.lowyat.net/Kopitiam/topic/4339324
Denise Jie Jie mummy birthday,"Jun 27 2017, 05:10 PM",23,https://forum.lowyat.net/Kopitiam/topic/4341169
Good luck Egypt..,"Jun 27 2017, 12:31 AM",23,https://forum.lowyat.net/Kopitiam/topic/4340413
Sick Rohingya childs family trying to con,"Jun 27 2017, 05:04 PM",23,https://forum.lowyat.net/Kopitiam/topic/4341154
Who do you support,"Jun 27 2017, 04:57 PM",23,https://forum.lowyat.net/Kopitiam/topic/4341138
UFC Fighter TerAmmoShaf During Choke Hold,"Jun 26 2017, 09:02 PM",23,https://forum.lowyat.net/Kopitiam/topic/4340284
Anyone knows about fintech and blockchain here?,"Jan 19 2017, 10:04 PM",23,https://forum.lowyat.net/Kopitiam/topic/4179352
An Elevator That Actually Goes Sideways,"Jun 27 2017, 04:33 PM",23,https://forum.lowyat.net/Kopitiam/topic/4341090
How to find rich girlfriend?,"Jun 22 2017, 12:07 AM",23,https://forum.lowyat.net/Kopitiam/topic/4335007
how to convince awek,"Jun 27 2017, 02:18 PM",23,https://forum.lowyat.net/Kopitiam/topic/4340902
salary no.1 factor u choose a job?,"Jun 27 2017, 04:14 PM",23,https://forum.lowyat.net/Kopitiam/topic/4341039
#doneshopping #goldcart guess where (drillz ada),"Jun 27 2017, 02:54 PM",24,https://forum.lowyat.net/Kopitiam/topic/4340943
Why wimminz like to yell and slam doors?,"Jun 27 2017, 02:58 PM",24,https://forum.lowyat.net/Kopitiam/topic/4340947
takkan holiday gone like tht jer?,"Jun 27 2017, 04:16 PM",24,https://forum.lowyat.net/Kopitiam/topic/4341045
thailand immigration corruption?,"Jun 27 2017, 01:03 PM",24,https://forum.lowyat.net/Kopitiam/topic/4340809
Niama Cina also off!,"Jun 26 2017, 12:56 PM",24,https://forum.lowyat.net/Kopitiam/topic/4339814
Heard this koran song,"Jun 27 2017, 01:13 PM",24,https://forum.lowyat.net/Kopitiam/topic/4340824
Tamiya in puchong,"Jun 27 2017, 03:52 PM",24,https://forum.lowyat.net/Kopitiam/topic/4341000
GENTING NOW HAS 5 CONDO PROJECT!,"Jan 15 2015, 12:24 AM",24,https://forum.lowyat.net/Kopitiam/topic/3470389
Fire employee who OT,"Jun 27 2017, 02:05 PM",24,https://forum.lowyat.net/Kopitiam/topic/4340883
i need to bleach my eye stappppppppp,"Jun 27 2017, 01:52 PM",24,https://forum.lowyat.net/Kopitiam/topic/4340869
It's weird when people love you,"Jun 27 2017, 03:25 PM",24,https://forum.lowyat.net/Kopitiam/topic/4340980
P10,"Jun 27 2017, 03:32 PM",24,https://forum.lowyat.net/Kopitiam/topic/4340985
U know about Shopee? Ok or not?,"Jun 27 2017, 01:16 PM",24,https://forum.lowyat.net/Kopitiam/topic/4340827
War for the Planet of the Apes,"Jun 27 2017, 12:54 PM",24,https://forum.lowyat.net/Kopitiam/topic/4340803
I wanna Hippo!,"Jun 27 2017, 03:01 PM",24,https://forum.lowyat.net/Kopitiam/topic/4340951
Rate my el cheapo camera quality.,"Jun 26 2017, 10:35 PM",24,https://forum.lowyat.net/Kopitiam/topic/4340353
I will stand up for myself #sayno2bullies,"Jun 26 2017, 11:33 PM",24,https://forum.lowyat.net/Kopitiam/topic/4340376
COD: WW2 also cant save COD loh,"Jun 27 2017, 12:24 PM",24,https://forum.lowyat.net/Kopitiam/topic/4340768
need help to find the name of taiwan singer,"Jun 27 2017, 12:42 PM",24,https://forum.lowyat.net/Kopitiam/topic/4340789
"where is hap chai,thailand?map not found","Apr 30 2015, 12:57 PM",24,https://forum.lowyat.net/Kopitiam/topic/3566089
CNN terkantoi,"Jun 27 2017, 02:45 PM",24,https://forum.lowyat.net/Kopitiam/topic/4340934
Malindo VS AirAsia,"Jun 27 2017, 09:19 AM",24,https://forum.lowyat.net/Kopitiam/topic/4340576
do vegans eat subway?,"Jun 27 2017, 01:25 PM",24,https://forum.lowyat.net/Kopitiam/topic/4340833
Lower-income Singaporeans to receive GST vouchers,"Jun 27 2017, 12:25 PM",24,https://forum.lowyat.net/Kopitiam/topic/4340770
HAHAHAHAHHAHA,"Jun 27 2017, 02:40 PM",24,https://forum.lowyat.net/Kopitiam/topic/4340923
is FFk a bannable offense at garage sales?,"Jun 27 2017, 02:17 PM",24,https://forum.lowyat.net/Kopitiam/topic/4340899
AIRASIA X WASHING MACHINE / MASSAGE CHAIR VIDEO,"Jun 26 2017, 04:59 AM",24,https://forum.lowyat.net/Kopitiam/topic/4339552
Dangerous Taxi driver HBB5991,"Jun 27 2017, 02:26 PM",24,https://forum.lowyat.net/Kopitiam/topic/4340910
PPAP Pikotaro To Perform At Japan Expo Malaysia,"Jun 27 2017, 01:13 PM",24,https://forum.lowyat.net/Kopitiam/topic/4340823
SHE At Yoga Lin/Kiki Ting Wedding Reception,"Jun 27 2017, 11:17 AM",24,https://forum.lowyat.net/Kopitiam/topic/4340685
Extremely close call!,"Jun 27 2017, 02:07 PM",25,https://forum.lowyat.net/Kopitiam/topic/4340887
Poly zeh zeh kym?,"Jun 26 2017, 01:11 PM",25,https://forum.lowyat.net/Kopitiam/topic/4339824
Sabah to get priority in infrastructure spending,"Jun 27 2017, 02:08 PM",25,https://forum.lowyat.net/Kopitiam/topic/4340888
No firecracker tered?,"Jun 27 2017, 01:49 PM",25,https://forum.lowyat.net/Kopitiam/topic/4340865
TVB Heart And Greed 3 (3),"Jun 27 2017, 01:33 PM",25,https://forum.lowyat.net/Kopitiam/topic/4340843
Is anyone feeling generous or want to help?,"Jun 24 2017, 11:04 PM",25,https://forum.lowyat.net/Kopitiam/topic/4338526
Farking scary bungee jump accident,"Jun 27 2017, 12:52 PM",25,https://forum.lowyat.net/Kopitiam/topic/4340802
how can i get a gf like those in this thread?,"Jun 26 2017, 09:09 PM",25,https://forum.lowyat.net/Kopitiam/topic/4340291
Department of Justice complaint on 1MDB,"Jun 20 2017, 09:23 PM",25,https://forum.lowyat.net/Kopitiam/topic/4333532
"Najib bercuti Bali, Perth","Jun 27 2017, 12:49 PM",25,https://forum.lowyat.net/Kopitiam/topic/4340797
Hadi bantah campur tangan asing dalam skandal 1MDB,"Jun 24 2017, 05:44 PM",25,https://forum.lowyat.net/Kopitiam/topic/4338328
