title,time,page no,link
Accident 101: i teach u claim loss of use,"Oct 1 2014, 09:59 AM",1,https://forum.lowyat.net/Kopitiam/topic/3365413
Duit Raya Tered,"Jun 21 2017, 10:22 AM",1,https://forum.lowyat.net/Kopitiam/topic/4333873
Malaysia Weekly Fuel Price Update,"May 17 2017, 09:38 AM",1,https://forum.lowyat.net/Kopitiam/topic/4292391
Serious Guys ... This kids need Help from Us..,"Jun 13 2017, 10:05 PM",1,https://forum.lowyat.net/Kopitiam/topic/4325367
/k TV Series Guide,"Oct 8 2015, 04:34 PM",1,https://forum.lowyat.net/Kopitiam/topic/3737709
[REPORT] Kenderaan Guna Laluan Kecemasan,"May 23 2016, 09:10 PM",1,https://forum.lowyat.net/Kopitiam/topic/3955723
What is your forum.lowyat.net story?,"Apr 27 2012, 11:12 AM",1,https://forum.lowyat.net/Kopitiam/topic/2323531
Facebook Video Embedding Tutorial [New],"Mar 24 2017, 05:44 PM",1,https://forum.lowyat.net/Kopitiam/topic/4232904
Come Rate My Food Thread v1,"Sep 4 2015, 12:34 PM",1,https://forum.lowyat.net/Kopitiam/topic/3699930
Chaos....,"Today, 07:12 PM",1,https://forum.lowyat.net/Kopitiam/topic/4343309
Remember back then astro or local channel,"Today, 07:52 PM",1,https://forum.lowyat.net/Kopitiam/topic/4343332
Tesla Stopped Model S Delivery to Malaysia,"Today, 07:35 PM",1,https://forum.lowyat.net/Kopitiam/topic/4343318
"Hong Kong ""pro-democracy"" protests","Today, 01:25 PM",1,https://forum.lowyat.net/Kopitiam/topic/4342934
Say no to FEMINISM,"Today, 03:25 PM",1,https://forum.lowyat.net/Kopitiam/topic/4343114
tips mengandung tanpa berjimak,"Today, 07:15 PM",1,https://forum.lowyat.net/Kopitiam/topic/4343311
"Lazada Discussion V18, Buy first Regret later!","Jun 15 2017, 12:34 PM",1,https://forum.lowyat.net/Kopitiam/topic/4327388
Breaking News:Hi Tech Radar equipment goes missing,"Today, 10:16 AM",1,https://forum.lowyat.net/Kopitiam/topic/4342664
"Malay Muslims fleeing Malaysia, Chinese rushing in","Today, 07:25 PM",1,https://forum.lowyat.net/Kopitiam/topic/4343314
p10 plus warranty issue,"Today, 08:39 AM",1,https://forum.lowyat.net/Kopitiam/topic/4342565
my mlm cousin finally got his big break,"Yesterday, 03:09 PM",1,https://forum.lowyat.net/Kopitiam/topic/4341992
"U swim swim, then dis waitress cum serve food kym?","Today, 05:53 PM",1,https://forum.lowyat.net/Kopitiam/topic/4343261
Sg Documentary - Orang Asli eviction in Kelantan,"Today, 01:26 PM",1,https://forum.lowyat.net/Kopitiam/topic/4342935
I will never fly AirAsia ever again,"Today, 07:43 AM",1,https://forum.lowyat.net/Kopitiam/topic/4342540
girl now high demand sial,"Today, 06:16 PM",1,https://forum.lowyat.net/Kopitiam/topic/4343276
Rekomen good burger place,"Today, 06:37 PM",1,https://forum.lowyat.net/Kopitiam/topic/4343290
Buy ipad in USA is it cheaper or SG?,"Today, 04:28 PM",1,https://forum.lowyat.net/Kopitiam/topic/4343189
The very first book to learn Pali Language,"Today, 03:19 PM",1,https://forum.lowyat.net/Kopitiam/topic/4343111
THANK ME,"Today, 07:35 PM",1,https://forum.lowyat.net/Kopitiam/topic/4343317
Man reunited with camera lost in Tennessee River,"Today, 07:15 PM",1,https://forum.lowyat.net/Kopitiam/topic/4343312
"RM115k Proton. Expensive than Honda City, Jazz","Today, 06:42 PM",1,https://forum.lowyat.net/Kopitiam/topic/4343293
Money Poll: How much money have you earned so far,"Yesterday, 01:13 AM",1,https://forum.lowyat.net/Kopitiam/topic/4341536
Feng Shui Master Recomendation,"Jun 1 2017, 04:07 PM",1,https://forum.lowyat.net/Kopitiam/topic/4306465
Lowyat Muslim Fellowship,"Sep 24 2014, 07:58 PM",1,https://forum.lowyat.net/Kopitiam/topic/3359194
Free Grab Code to Airport,"Yesterday, 10:17 AM",1,https://forum.lowyat.net/Kopitiam/topic/4341678
PC Specs for Retail Business,"Jun 27 2017, 04:36 PM",1,https://forum.lowyat.net/Kopitiam/topic/4341098
LYN OFFICIAL VAPING THREAD V35,"Apr 12 2017, 03:06 PM",2,https://forum.lowyat.net/Kopitiam/topic/4264361
Why I refuse to commit into a relationship,"Today, 03:28 PM",2,https://forum.lowyat.net/Kopitiam/topic/4343118
 /Kaki Spotify Family plan ,"Oct 8 2016, 10:33 AM",2,https://forum.lowyat.net/Kopitiam/topic/4076777
Lelaki dilanggar bas.,"Today, 06:42 PM",2,https://forum.lowyat.net/Kopitiam/topic/4343294
looking someone with same music taste as me,"Today, 07:01 PM",2,https://forum.lowyat.net/Kopitiam/topic/4343300
Office Workers League V142,"Feb 27 2017, 12:24 PM",2,https://forum.lowyat.net/Kopitiam/topic/4208388
tax submission ( looking for people),"Today, 04:05 PM",2,https://forum.lowyat.net/Kopitiam/topic/4343155
Military Thread V24,"Mar 17 2017, 02:46 AM",2,https://forum.lowyat.net/Kopitiam/topic/4225445
Hail Siti Kasim,"Jun 23 2017, 01:43 PM",2,https://forum.lowyat.net/Kopitiam/topic/4337312
"Hoi, Minah, pakai apa tu? Tak boleh lah!","Today, 06:04 PM",2,https://forum.lowyat.net/Kopitiam/topic/4343265
8 signs your bf is a feminist,"Today, 06:34 PM",2,https://forum.lowyat.net/Kopitiam/topic/4343287
High speed train models of Asia,"Today, 06:17 PM",2,https://forum.lowyat.net/Kopitiam/topic/4343277
/kbikers V43,"Mar 27 2017, 11:08 AM",2,https://forum.lowyat.net/Kopitiam/topic/4238913
Newfags cause cancer,"Today, 07:08 PM",2,https://forum.lowyat.net/Kopitiam/topic/4343306
How Long Will Take to get Ripped,"Today, 06:05 PM",2,https://forum.lowyat.net/Kopitiam/topic/4343269
Which brand of power-bank is good now?,"Today, 04:56 PM",2,https://forum.lowyat.net/Kopitiam/topic/4343219
OPS LALANG 2.0 is coming before GE14!,"Today, 05:00 PM",2,https://forum.lowyat.net/Kopitiam/topic/4343221
"/k if lose key card, will hotel demand payment?","Today, 05:22 PM",2,https://forum.lowyat.net/Kopitiam/topic/4343242
Income: $67k CPF Contribution: $13k Income Tax: $0,"Jun 25 2017, 05:33 PM",2,https://forum.lowyat.net/Kopitiam/topic/4339237
what is the future for Taiwan?,"Today, 06:04 PM",2,https://forum.lowyat.net/Kopitiam/topic/4343266
"Captain, crew did their best: AirAsia passenger","Today, 04:16 PM",2,https://forum.lowyat.net/Kopitiam/topic/4343171
HOW TO GET RID OF BED BUGS (Damn it wasnt lipas),"Jul 25 2016, 02:06 PM",2,https://forum.lowyat.net/Kopitiam/topic/4012542
"You now have RM5,000,000 cash in your bank","Today, 01:36 PM",2,https://forum.lowyat.net/Kopitiam/topic/4342963
Is Acer laptop good,"Yesterday, 10:39 PM",2,https://forum.lowyat.net/Kopitiam/topic/4342397
English classic songs,"Today, 09:08 AM",2,https://forum.lowyat.net/Kopitiam/topic/4342589
Duterte railway megaproject starts!,"Today, 06:52 PM",2,https://forum.lowyat.net/Kopitiam/topic/4343297
Can I mix ron95 with ron97,"Today, 05:00 PM",2,https://forum.lowyat.net/Kopitiam/topic/4343223
Form 1 students masterbed in front of KPop teacher,"Today, 05:14 PM",2,https://forum.lowyat.net/Kopitiam/topic/4343236
Should we promote LTZ to Major rank?,"Today, 10:32 AM",2,https://forum.lowyat.net/Kopitiam/topic/4342679
Singapore  MRT getting worst,"Jun 19 2017, 07:13 PM",2,https://forum.lowyat.net/Kopitiam/topic/4331145
"What if your Mom force you to marry this XMM, kym?","Today, 05:57 PM",3,https://forum.lowyat.net/Kopitiam/topic/4343262
 Sarawak Thread Version V88 ,"Sep 9 2015, 12:00 PM",3,https://forum.lowyat.net/Kopitiam/topic/3705220
Report: Ringgit strongest currency in Asia,"Today, 11:27 AM",3,https://forum.lowyat.net/Kopitiam/topic/4342752
Rake mah Flied Lice!,"Today, 02:56 PM",3,https://forum.lowyat.net/Kopitiam/topic/4343080
Curi ayam,"Today, 06:38 PM",3,https://forum.lowyat.net/Kopitiam/topic/4343291
Miss University Malaya winners,"Today, 06:04 PM",3,https://forum.lowyat.net/Kopitiam/topic/4343268
Canteen Operator Was Told To Convert To Islam,"Today, 05:30 PM",3,https://forum.lowyat.net/Kopitiam/topic/4343248
"Malay guys, would u consider the ice cream seller.","Today, 06:18 PM",3,https://forum.lowyat.net/Kopitiam/topic/4343279
xiao mi remote,"Today, 09:46 AM",3,https://forum.lowyat.net/Kopitiam/topic/4342621
M'sian gone crazy as new 100AES will be installed,"Yesterday, 11:32 PM",3,https://forum.lowyat.net/Kopitiam/topic/4342442
Cb fb page scammed me,"Today, 06:20 PM",3,https://forum.lowyat.net/Kopitiam/topic/4343280
Three Final Fantasy themed mobile games,"Today, 09:45 AM",3,https://forum.lowyat.net/Kopitiam/topic/4342618
Jilake prompuan,"Today, 01:49 PM",3,https://forum.lowyat.net/Kopitiam/topic/4342980
What happen if not money to pay toll?,"Today, 04:19 PM",3,https://forum.lowyat.net/Kopitiam/topic/4343177
Britney kondem SG street food,"Yesterday, 07:04 PM",3,https://forum.lowyat.net/Kopitiam/topic/4342256
Alleged phone theft minah tortured with hair up,"Today, 05:27 PM",3,https://forum.lowyat.net/Kopitiam/topic/4343244
Why people despise MLM?,"Yesterday, 04:54 PM",3,https://forum.lowyat.net/Kopitiam/topic/4342091
Why some guys wear tight shirt,"Today, 01:25 PM",3,https://forum.lowyat.net/Kopitiam/topic/4342933
[Updated] Digimon V-Pet 20th anniversary,"Dec 17 2016, 12:11 PM",3,https://forum.lowyat.net/Kopitiam/topic/4150071
Why can a girl kiss you passionately on your lips,"Today, 05:03 PM",3,https://forum.lowyat.net/Kopitiam/topic/4343226
J.K. Rowling reveals .....,"Jun 26 2017, 12:36 PM",3,https://forum.lowyat.net/Kopitiam/topic/4339792
Cantonese v Mandarin,"Today, 04:53 PM",3,https://forum.lowyat.net/Kopitiam/topic/4343218
Delete post,"Yesterday, 11:16 PM",3,https://forum.lowyat.net/Kopitiam/topic/4342433
Do you agree most men kenot pakai one?,"Today, 01:18 PM",3,https://forum.lowyat.net/Kopitiam/topic/4342922
Feel so demotivated,"Jun 26 2017, 03:23 AM",3,https://forum.lowyat.net/Kopitiam/topic/4339544
Ethereum die,"Today, 09:10 AM",3,https://forum.lowyat.net/Kopitiam/topic/4342591
Malaysian horror short films,"Apr 5 2017, 02:31 AM",3,https://forum.lowyat.net/Kopitiam/topic/4248568
AirAsia X Touches Down In Honolulu Hawaii,"Today, 11:01 AM",3,https://forum.lowyat.net/Kopitiam/topic/4342725
Will uber shut down? At least in malaysia?,"Today, 01:35 PM",3,https://forum.lowyat.net/Kopitiam/topic/4342961
U know why Causeway always jam?,"Today, 02:23 PM",3,https://forum.lowyat.net/Kopitiam/topic/4343027
What you will do if .....,"Today, 02:32 PM",4,https://forum.lowyat.net/Kopitiam/topic/4343040
If you are dying tomorrow,"Today, 03:56 PM",4,https://forum.lowyat.net/Kopitiam/topic/4343138
sabah 88 lottery 6/45,"Jan 15 2016, 10:08 AM",4,https://forum.lowyat.net/Kopitiam/topic/3838153
sulli,"Today, 04:40 PM",4,https://forum.lowyat.net/Kopitiam/topic/4343203
Rm3.90 dim sum at Bandar puteri Puchong?,"Jun 26 2017, 05:20 PM",4,https://forum.lowyat.net/Kopitiam/topic/4340058
How much would you go for a Proposal ring,"Today, 11:41 AM",4,https://forum.lowyat.net/Kopitiam/topic/4342768
MY man's fiance demands only the best for,"Today, 12:20 PM",4,https://forum.lowyat.net/Kopitiam/topic/4342839
SG mum and daughter detained in MY for shoplifting,"Today, 12:37 PM",4,https://forum.lowyat.net/Kopitiam/topic/4342867
Countries with most powerful military in the world,"Yesterday, 12:55 PM",4,https://forum.lowyat.net/Kopitiam/topic/4341836
Infinity Multi Communication Sdn Bhd,"Today, 12:14 PM",4,https://forum.lowyat.net/Kopitiam/topic/4342827
When celebrity caught ambil dadah,"Today, 03:59 PM",4,https://forum.lowyat.net/Kopitiam/topic/4343143
Can PH win fed without Pas? win 112 parlimen seats,"Jun 27 2017, 05:36 AM",4,https://forum.lowyat.net/Kopitiam/topic/4340512
Automation may cause poorer nation poor,"Jun 22 2017, 07:02 PM",4,https://forum.lowyat.net/Kopitiam/topic/4336291
Is this racism?,"Yesterday, 10:20 PM",4,https://forum.lowyat.net/Kopitiam/topic/4342388
What is the latest law on tinting %?,"Today, 05:10 PM",4,https://forum.lowyat.net/Kopitiam/topic/4343234
DAP not really wanna become government,"Yesterday, 02:41 PM",4,https://forum.lowyat.net/Kopitiam/topic/4341970
go open house menteri get RM20 duit raya,"Today, 03:51 PM",4,https://forum.lowyat.net/Kopitiam/topic/4343131
"Miss Astro 2016 vs 2017, which one better?","Jun 26 2017, 08:09 PM",4,https://forum.lowyat.net/Kopitiam/topic/4340254
Hong Kong losing traditional trades,"Today, 04:24 PM",4,https://forum.lowyat.net/Kopitiam/topic/4343185
"People pay to eat this dog poop, find out why","Today, 04:34 PM",4,https://forum.lowyat.net/Kopitiam/topic/4343194
roti canai transfer road,"Today, 12:34 PM",4,https://forum.lowyat.net/Kopitiam/topic/4342862
"Nurul Izzah: No Point Hating Dr Mahathir,","Today, 04:02 PM",4,https://forum.lowyat.net/Kopitiam/topic/4343151
Fuh.. Public parking in Kl Naik harga?,"Today, 09:57 AM",4,https://forum.lowyat.net/Kopitiam/topic/4342644
Have anyone heard about AQ Services ?,"Mar 24 2014, 12:44 PM",4,https://forum.lowyat.net/Kopitiam/topic/3170850
Program Khas Haji: Impian PM telah tercapai,"Today, 05:02 PM",4,https://forum.lowyat.net/Kopitiam/topic/4343225
Cat VS Snoad (Snake + Toad),"Today, 05:00 PM",4,https://forum.lowyat.net/Kopitiam/topic/4343222
Robot can make pizza in 4 minutes,"Today, 04:36 PM",4,https://forum.lowyat.net/Kopitiam/topic/4343197
REDMI 4X,"Today, 12:30 PM",4,https://forum.lowyat.net/Kopitiam/topic/4342853
why i hardly use my headphones,"Today, 02:43 PM",4,https://forum.lowyat.net/Kopitiam/topic/4343064
kodak exec panic....when this zoom lens,"Today, 02:24 PM",4,https://forum.lowyat.net/Kopitiam/topic/4343031
"Go gym for a year, no result.","Yesterday, 08:52 PM",5,https://forum.lowyat.net/Kopitiam/topic/4342341
For those that say Msia economy dying,"Today, 11:04 AM",5,https://forum.lowyat.net/Kopitiam/topic/4342730
ade ang moh cun kat belakang aku ni,"Today, 02:56 PM",5,https://forum.lowyat.net/Kopitiam/topic/4343079
Which telco provide the best installment plan?,"Yesterday, 06:00 PM",5,https://forum.lowyat.net/Kopitiam/topic/4342169
Youtubber Kat & Sid,"Today, 04:16 PM",5,https://forum.lowyat.net/Kopitiam/topic/4343172
"What happened to Empire City, Damansara Perdana?","Yesterday, 09:17 PM",5,https://forum.lowyat.net/Kopitiam/topic/4342356
Continental CC6,"Jun 27 2017, 10:41 PM",5,https://forum.lowyat.net/Kopitiam/topic/4341444
Red Bean Army (RBA),"Yesterday, 09:09 PM",5,https://forum.lowyat.net/Kopitiam/topic/4342352
Taiwan will set up trade office in Panama,"Today, 03:53 PM",5,https://forum.lowyat.net/Kopitiam/topic/4343136
Supply First or Demand First?,"Mar 22 2017, 11:24 PM",5,https://forum.lowyat.net/Kopitiam/topic/4231270
"gua dgr cite kan, abe jibby nk step daun","Yesterday, 07:28 PM",5,https://forum.lowyat.net/Kopitiam/topic/4342281
Khaleesi talked about her first time..,"Today, 04:04 PM",5,https://forum.lowyat.net/Kopitiam/topic/4343153
Lim Sian See identity revealed,"Jun 21 2017, 12:10 PM",5,https://forum.lowyat.net/Kopitiam/topic/4334063
pilot statement make airasia boss a shrink,"Today, 01:07 AM",5,https://forum.lowyat.net/Kopitiam/topic/4342486
Man struck by falling aircon unit,"Today, 12:09 PM",5,https://forum.lowyat.net/Kopitiam/topic/4342817
travel agency agent,"Today, 03:02 PM",5,https://forum.lowyat.net/Kopitiam/topic/4343086
interesting talks on politiks,"Today, 04:15 PM",5,https://forum.lowyat.net/Kopitiam/topic/4343169
Sgboys,"Dec 28 2015, 11:35 AM",5,https://forum.lowyat.net/Kopitiam/topic/3817639
Manja manja girls,"Today, 03:57 PM",5,https://forum.lowyat.net/Kopitiam/topic/4343142
Chinese girl,"Today, 03:07 PM",5,https://forum.lowyat.net/Kopitiam/topic/4343099
How come we can afford fried chicken everyday,"Today, 03:01 PM",5,https://forum.lowyat.net/Kopitiam/topic/4343085
What scares you when you ride plane?,"Today, 02:41 PM",5,https://forum.lowyat.net/Kopitiam/topic/4343056
Are you a good dancer?,"Today, 03:59 PM",5,https://forum.lowyat.net/Kopitiam/topic/4343144
"/k, where can get this bluetooth speaker","Today, 03:45 PM",5,https://forum.lowyat.net/Kopitiam/topic/4343126
Kastam expert come in,"Today, 02:37 PM",5,https://forum.lowyat.net/Kopitiam/topic/4343048
Someone made unauthorized transaction with my cc,"Today, 02:13 PM",5,https://forum.lowyat.net/Kopitiam/topic/4343014
Federal Prosecutor charged President for bribery,"Today, 03:21 PM",5,https://forum.lowyat.net/Kopitiam/topic/4343113
Friend Got Dupe By Employer,"Today, 02:37 PM",5,https://forum.lowyat.net/Kopitiam/topic/4343047
Parking nearby KL Sentral,"Sep 27 2016, 11:13 AM",5,https://forum.lowyat.net/Kopitiam/topic/4066380
Bezza vs myvi,"Today, 01:49 PM",5,https://forum.lowyat.net/Kopitiam/topic/4342979
"Priest Pedo, guess where? x masuk rugi","Today, 03:03 PM",6,https://forum.lowyat.net/Kopitiam/topic/4343089
nm7 (a.k.a HyundaiMY) = New Everest?,"Today, 12:44 PM",6,https://forum.lowyat.net/Kopitiam/topic/4342877
Nasi kandar review tered. Number of review:2,"Yesterday, 07:06 PM",6,https://forum.lowyat.net/Kopitiam/topic/4342258
 Thai Love,"Jan 18 2017, 05:42 AM",6,https://forum.lowyat.net/Kopitiam/topic/4177944
are you looking for an audiophile grade headphone?,"Today, 02:09 PM",6,https://forum.lowyat.net/Kopitiam/topic/4343006
Maggie Ayam Goreng,"Today, 02:21 PM",6,https://forum.lowyat.net/Kopitiam/topic/4343022
how come mamakspecial kennot xcess,"Today, 03:01 PM",6,https://forum.lowyat.net/Kopitiam/topic/4343083
Thai woman who lost legs in MRT earn $40k monthly!,"Today, 12:34 PM",6,https://forum.lowyat.net/Kopitiam/topic/4342863
Medical Card with Saving?,"Yesterday, 01:02 PM",6,https://forum.lowyat.net/Kopitiam/topic/4341845
Will Coyote Peterson die young?,"Today, 02:40 PM",6,https://forum.lowyat.net/Kopitiam/topic/4343052
AMOI MAYBANK SUPER CANTEK & SUPER BAIK,"Oct 22 2016, 10:25 AM",6,https://forum.lowyat.net/Kopitiam/topic/4089463
Picture,"Today, 03:06 PM",6,https://forum.lowyat.net/Kopitiam/topic/4343094
/k/ help!,"Today, 03:00 PM",6,https://forum.lowyat.net/Kopitiam/topic/4343081
raya bergelandangan,"Today, 12:56 PM",6,https://forum.lowyat.net/Kopitiam/topic/4342892
Moto G5 Plus available for pre-order,"May 29 2017, 07:55 PM",6,https://forum.lowyat.net/Kopitiam/topic/4304166
What are hashtags for?,"Today, 01:09 PM",6,https://forum.lowyat.net/Kopitiam/topic/4342909
"Macha rage,HP stolen","Yesterday, 10:05 PM",6,https://forum.lowyat.net/Kopitiam/topic/4342380
WhatsApp camera problems /help,"Today, 01:31 PM",6,https://forum.lowyat.net/Kopitiam/topic/4342953
Personal Money Magazine Died?,"Today, 12:17 PM",6,https://forum.lowyat.net/Kopitiam/topic/4342833
"Amoi go wet,eat Facebook pill","Today, 02:11 PM",6,https://forum.lowyat.net/Kopitiam/topic/4343010
2017 Jan-Dec MY car sales,"Mar 2 2017, 04:22 PM",6,https://forum.lowyat.net/Kopitiam/topic/4211979
Ringgit is Asia's strongest currency,"Today, 09:22 AM",6,https://forum.lowyat.net/Kopitiam/topic/4342600
Wats meaning of vala dohairis and vala borguris?,"Jun 27 2017, 01:58 PM",6,https://forum.lowyat.net/Kopitiam/topic/4340877
R Indon chinese allowed to have Chinese name now?,"Jun 26 2017, 09:41 PM",6,https://forum.lowyat.net/Kopitiam/topic/4340320
Old Coins,"Today, 11:40 AM",6,https://forum.lowyat.net/Kopitiam/topic/4342766
PC mastarrace kambing,"Jul 19 2016, 04:31 PM",6,https://forum.lowyat.net/Kopitiam/topic/4007745
F&B boss has the best revenue to counter inflation,"Today, 10:14 AM",6,https://forum.lowyat.net/Kopitiam/topic/4342661
Flight D7237 ... compensation,"Today, 08:12 AM",6,https://forum.lowyat.net/Kopitiam/topic/4342553
"Move over, yogurt: Probiotic beer is NUS","Today, 08:55 AM",6,https://forum.lowyat.net/Kopitiam/topic/4342573
Proton Iriz Brake Replacement,"Yesterday, 10:40 PM",6,https://forum.lowyat.net/Kopitiam/topic/4342398
Rumah Terbuka AidilFitri Dato Sri Jamal Yunos,"Today, 02:06 PM",7,https://forum.lowyat.net/Kopitiam/topic/4343003
Qantas emergency landing!,"Today, 01:50 PM",7,https://forum.lowyat.net/Kopitiam/topic/4342981
ASEAN car sales 2014-2016,"Today, 02:01 PM",7,https://forum.lowyat.net/Kopitiam/topic/4342997
I would like to predict winnings in SEA games,"Today, 02:03 PM",7,https://forum.lowyat.net/Kopitiam/topic/4342999
"Yan dao man seduces, cheats $$ from over 10 ladies","Today, 12:32 PM",7,https://forum.lowyat.net/Kopitiam/topic/4342857
U know girl who left her bf because she found more,"Yesterday, 11:45 PM",7,https://forum.lowyat.net/Kopitiam/topic/4342453
bingding want frame ironmaid89 for spam reporting,"Apr 7 2017, 07:20 PM",7,https://forum.lowyat.net/Kopitiam/topic/4254756
Precious Stone Shop Enquiry,"Today, 10:21 AM",7,https://forum.lowyat.net/Kopitiam/topic/4342671
Angry biker confront BMW driver who nearly hit hmi,"Today, 12:13 PM",7,https://forum.lowyat.net/Kopitiam/topic/4342824
"TO IRONMAID89, STOP REPORTING!","Jun 24 2017, 12:58 PM",7,https://forum.lowyat.net/Kopitiam/topic/4338126
Kia cerato 1.6 roof noisy during rain,"Today, 02:35 AM",7,https://forum.lowyat.net/Kopitiam/topic/4342504
THE WASHING MACHINE CREW,"Yesterday, 08:38 AM",7,https://forum.lowyat.net/Kopitiam/topic/4341617
"DEAR K, SHE'S NOT HAVING SEX WITH ME....","Oct 9 2016, 10:52 AM",7,https://forum.lowyat.net/Kopitiam/topic/4077580
DEATH @ PENANG .. 16th Floor..,"Yesterday, 05:44 PM",7,https://forum.lowyat.net/Kopitiam/topic/4342153
Go menteri open house get duit raya rm20,"Today, 02:06 PM",7,https://forum.lowyat.net/Kopitiam/topic/4343002
HK and Macau use simplified or traditional chinese,"Jun 26 2017, 08:24 PM",7,https://forum.lowyat.net/Kopitiam/topic/4340261
Mustafar Ali: Jabatan Imigresen Cadang Kena,"Today, 01:54 PM",7,https://forum.lowyat.net/Kopitiam/topic/4342989
Latest Shinkansen,"Today, 01:46 PM",7,https://forum.lowyat.net/Kopitiam/topic/4342976
credit card questions,"Today, 12:07 PM",7,https://forum.lowyat.net/Kopitiam/topic/4342812
jilake nm7,"Today, 01:11 PM",7,https://forum.lowyat.net/Kopitiam/topic/4342913
Want to find: lori sewa,"Today, 01:38 PM",7,https://forum.lowyat.net/Kopitiam/topic/4342965
Need to go bank opening branch to renew card?,"Today, 08:23 AM",7,https://forum.lowyat.net/Kopitiam/topic/4342559
Clean eating - mat lei geh,"Today, 12:42 PM",7,https://forum.lowyat.net/Kopitiam/topic/4342875
Fake Time magazine cover at Trump properties,"Today, 01:17 PM",7,https://forum.lowyat.net/Kopitiam/topic/4342921
Elizabeth Tan punya sanity :),"Today, 12:43 PM",7,https://forum.lowyat.net/Kopitiam/topic/4342876
the tered bout my housemate P all over toilet seat,"Yesterday, 08:00 PM",7,https://forum.lowyat.net/Kopitiam/topic/4342307
'Maybank goddess is in Malaysia meeting fans! OMG!,"Today, 12:16 PM",7,https://forum.lowyat.net/Kopitiam/topic/4342831
/k wiminz come in,"Yesterday, 11:21 AM",7,https://forum.lowyat.net/Kopitiam/topic/4341740
India to generate 6.5mill tourist annually by 2020,"Today, 12:56 PM",7,https://forum.lowyat.net/Kopitiam/topic/4342893
Suaram condemns illegal detention of 2 S'poreans,"Jun 26 2017, 03:48 PM",7,https://forum.lowyat.net/Kopitiam/topic/4339969
mface - my friend invest rm17k.,"May 23 2013, 12:43 AM",8,https://forum.lowyat.net/Kopitiam/topic/2821976
Lovesick guy try win back exGF with 99 watermelon,"Today, 12:26 PM",8,https://forum.lowyat.net/Kopitiam/topic/4342846
Yoyo Chen reveals her number 1 beauty secret,"Today, 12:30 PM",8,https://forum.lowyat.net/Kopitiam/topic/4342854
Where to change notes to coins,"Today, 12:35 PM",8,https://forum.lowyat.net/Kopitiam/topic/4342865
celebrity fitness merge with fitness first,"Feb 24 2017, 12:12 AM",8,https://forum.lowyat.net/Kopitiam/topic/4205575
Selamat hari raya aidilfitri ke 5,"Today, 12:32 PM",8,https://forum.lowyat.net/Kopitiam/topic/4342858
MKH  housing  n apartment,"Today, 12:26 PM",8,https://forum.lowyat.net/Kopitiam/topic/4342847
"If they slipped from a carpark rooftop, it could","Today, 12:40 PM",8,https://forum.lowyat.net/Kopitiam/topic/4342873
NA car dabao Turbo car : No Replacement,"Jun 26 2017, 01:59 PM",8,https://forum.lowyat.net/Kopitiam/topic/4339866
Subway self- cleaning,"Today, 11:40 AM",8,https://forum.lowyat.net/Kopitiam/topic/4342767
Japanese star Rina Nanase extreme plastic surgery,"Today, 12:23 PM",8,https://forum.lowyat.net/Kopitiam/topic/4342843
Kind soul raises funds for animals through Bigo,"Today, 12:11 PM",8,https://forum.lowyat.net/Kopitiam/topic/4342821
"Jamal Yunos: DOJ, Mana Bukti PM Najib","Jun 21 2017, 05:57 PM",8,https://forum.lowyat.net/Kopitiam/topic/4334578
ANYOne going Pink Dot 2017?,"Today, 05:01 AM",8,https://forum.lowyat.net/Kopitiam/topic/4342517
Malaysia's opposition to launch roadshow to spread,"Today, 01:39 AM",8,https://forum.lowyat.net/Kopitiam/topic/4342497
Military Uprising in Venezuela,"Yesterday, 07:54 PM",8,https://forum.lowyat.net/Kopitiam/topic/4342303
WHY NOW?,"Jun 21 2017, 09:51 PM",8,https://forum.lowyat.net/Kopitiam/topic/4334840
G-Shock digital or analog,"Yesterday, 12:55 PM",8,https://forum.lowyat.net/Kopitiam/topic/4341835
Jessica Jung Orchard 1st July,"Jun 27 2017, 04:36 PM",8,https://forum.lowyat.net/Kopitiam/topic/4341095
Wife Maybe Having Affair,"Yesterday, 06:52 PM",8,https://forum.lowyat.net/Kopitiam/topic/4342243
[Rant] People in my house keep throwing rice,"Jun 27 2017, 03:35 PM",8,https://forum.lowyat.net/Kopitiam/topic/4340987
NASI LEMAK NAIK HARGA,"Today, 09:25 AM",8,https://forum.lowyat.net/Kopitiam/topic/4342603
Najib Razak Twitter Followers,"Today, 11:00 AM",8,https://forum.lowyat.net/Kopitiam/topic/4342723
is true love still exist?,"Today, 09:19 AM",8,https://forum.lowyat.net/Kopitiam/topic/4342597
Raifiz: Minyak turun harga barang turun,"Today, 09:54 AM",8,https://forum.lowyat.net/Kopitiam/topic/4342636
ROLEX at KLCC,"Jun 27 2017, 03:15 PM",8,https://forum.lowyat.net/Kopitiam/topic/4340970
Warlord or SecretLab Gaming chair,"Today, 11:46 AM",8,https://forum.lowyat.net/Kopitiam/topic/4342779
JJPTR reached TAIWAN....,"Yesterday, 05:41 PM",8,https://forum.lowyat.net/Kopitiam/topic/4342148
"If you going to kill someone, do it in Norway","Today, 10:57 AM",8,https://forum.lowyat.net/Kopitiam/topic/4342719
Nur Ain Ibrahim .. got drillz,"Today, 07:53 AM",8,https://forum.lowyat.net/Kopitiam/topic/4342546
Help ayam rekemen headphone,"Today, 08:57 AM",9,https://forum.lowyat.net/Kopitiam/topic/4342577
would you pay RM 26 for this Haraju cube loaf,"Today, 12:48 AM",9,https://forum.lowyat.net/Kopitiam/topic/4342477
Is it ok if gf set high standards for u?,"Today, 06:50 AM",9,https://forum.lowyat.net/Kopitiam/topic/4342523
My Bank RM asked me to migrate with my wealth,"Today, 10:54 AM",9,https://forum.lowyat.net/Kopitiam/topic/4342714
