title,time,page no,link
Suasana di Hari Raya. jom gempak beb!,"Jun 25 2017, 11:38 PM",33,https://forum.lowyat.net/Kopitiam/topic/4339456
Tongsan officially bought over Proton liao!,"Jun 24 2017, 07:44 PM",33,https://forum.lowyat.net/Kopitiam/topic/4338414
Why in 2015 gomen don wanna peg MYR to USD?,"Jun 25 2017, 04:33 PM",33,https://forum.lowyat.net/Kopitiam/topic/4339172
Wednesday,"Jun 25 2017, 10:54 PM",33,https://forum.lowyat.net/Kopitiam/topic/4339438
9 girls,"Jun 26 2017, 12:03 AM",33,https://forum.lowyat.net/Kopitiam/topic/4339476
"Lepas time Ramadhan, mana nak cari bazaar Melayu?","Jun 25 2017, 08:13 PM",33,https://forum.lowyat.net/Kopitiam/topic/4339384
"I told her ""I miss you""","Jun 25 2017, 11:40 PM",33,https://forum.lowyat.net/Kopitiam/topic/4339460
Is recording a phonecall legal for my side?,"Jun 25 2017, 10:38 PM",33,https://forum.lowyat.net/Kopitiam/topic/4339432
Must police negotiator honor deal with criminals?,"Jun 25 2017, 10:52 PM",33,https://forum.lowyat.net/Kopitiam/topic/4339437
What is the meaning of these slang terms?,"Jun 25 2017, 11:12 PM",33,https://forum.lowyat.net/Kopitiam/topic/4339446
Why is mooncakes so expensive?,"Aug 25 2016, 02:18 PM",33,https://forum.lowyat.net/Kopitiam/topic/4038442
the brutal truth between IQ and life achievement,"Jun 24 2017, 09:17 PM",33,https://forum.lowyat.net/Kopitiam/topic/4338462
I am on the weird side of the net. demn.,"Jun 25 2017, 10:42 PM",33,https://forum.lowyat.net/Kopitiam/topic/4339433
Posted already?  Guy almost hung himself......,"Jun 25 2017, 11:40 PM",33,https://forum.lowyat.net/Kopitiam/topic/4339459
How is your duit raya collection so far?,"Jun 25 2017, 06:42 PM",33,https://forum.lowyat.net/Kopitiam/topic/4339312
Tonight got Miss Astro 2017,"Jun 25 2017, 03:15 PM",34,https://forum.lowyat.net/Kopitiam/topic/4339018
Bought medium sized pineapple 14pcs for RM10 only,"Jun 25 2017, 10:52 PM",34,https://forum.lowyat.net/Kopitiam/topic/4339436
sniper divine + aghanim style worth playing on,"Jun 25 2017, 11:31 PM",34,https://forum.lowyat.net/Kopitiam/topic/4339451
Who is inventor of coffee?,"Jun 25 2017, 09:34 PM",34,https://forum.lowyat.net/Kopitiam/topic/4339411
"this robot worth buying? costs rm 25 , in 7-11","Jun 25 2017, 08:12 PM",34,https://forum.lowyat.net/Kopitiam/topic/4339383
most painful thing,"Jun 25 2017, 02:58 AM",34,https://forum.lowyat.net/Kopitiam/topic/4338614
Accomodation near genting,"Jun 25 2017, 09:32 PM",34,https://forum.lowyat.net/Kopitiam/topic/4339409
Truth be told...,"Jun 25 2017, 10:37 PM",34,https://forum.lowyat.net/Kopitiam/topic/4339431
it's ok u earn peanut,"Jun 25 2017, 08:24 PM",34,https://forum.lowyat.net/Kopitiam/topic/4339386
Is it illegal to Pirate the new Pirates movie?,"Jun 25 2017, 10:46 PM",34,https://forum.lowyat.net/Kopitiam/topic/4339435
Dat catwoman cosplay,"Jun 25 2017, 09:52 PM",34,https://forum.lowyat.net/Kopitiam/topic/4339416
Grab kasi I promo code,"Jun 25 2017, 10:37 PM",34,https://forum.lowyat.net/Kopitiam/topic/4339429
Gangster COO,"Jun 24 2017, 06:28 PM",34,https://forum.lowyat.net/Kopitiam/topic/4338368
why those stay with parents one always complain?,"Jun 25 2017, 04:22 PM",34,https://forum.lowyat.net/Kopitiam/topic/4339149
USD in malaysia,"Jun 25 2017, 04:55 PM",34,https://forum.lowyat.net/Kopitiam/topic/4339209
"bingding, coup de grace, ironmaid, vape on","Mar 2 2017, 12:04 PM",34,https://forum.lowyat.net/Kopitiam/topic/4211701
Obama hisap,"Jun 25 2017, 10:27 PM",34,https://forum.lowyat.net/Kopitiam/topic/4339425
Food / Item from Penang,"Jun 25 2017, 09:11 PM",34,https://forum.lowyat.net/Kopitiam/topic/4339404
TYT Sarawak Taib Mahmud Hari Raya Open House,"Jun 25 2017, 06:09 PM",34,https://forum.lowyat.net/Kopitiam/topic/4339276
amoi pdRm hnggghhh pegang mp4 mp5 mp3,"Jun 25 2017, 07:56 PM",34,https://forum.lowyat.net/Kopitiam/topic/4339381
This guy jilat game is stronk!,"Jun 12 2017, 11:15 PM",34,https://forum.lowyat.net/Kopitiam/topic/4323506
dashcam for car? u really need it?,"Jun 25 2017, 09:17 PM",34,https://forum.lowyat.net/Kopitiam/topic/4339406
Selamat Hari Raya all,"Jun 25 2017, 09:52 AM",34,https://forum.lowyat.net/Kopitiam/topic/4338714
Abang Johari: Sarawak Wont Roll Out Tourism Tax,"Jun 25 2017, 07:18 PM",34,https://forum.lowyat.net/Kopitiam/topic/4339353
Kena look down bcuz no car,"Jun 24 2017, 10:46 AM",34,https://forum.lowyat.net/Kopitiam/topic/4338000
Do you agree if colleagues with family,"Jun 25 2017, 07:13 PM",34,https://forum.lowyat.net/Kopitiam/topic/4339348
67 better or 69 better?,"Jun 25 2017, 09:09 PM",34,https://forum.lowyat.net/Kopitiam/topic/4339401
I am almost certain.. (chat),"Jun 25 2017, 02:29 PM",34,https://forum.lowyat.net/Kopitiam/topic/4338951
JAV bukake lemas...,"Jun 25 2017, 09:00 PM",34,https://forum.lowyat.net/Kopitiam/topic/4339395
11street - clickasia,"Jun 23 2017, 09:37 PM",34,https://forum.lowyat.net/Kopitiam/topic/4337667
Cops uncover lead on Pastor Koh's abduction,"Jun 25 2017, 02:58 PM",35,https://forum.lowyat.net/Kopitiam/topic/4338998
Sultan shopping for books..!,"Jun 15 2015, 10:20 PM",35,https://forum.lowyat.net/Kopitiam/topic/3609562
Happy Maulidur Rasul day!,"Dec 24 2015, 01:59 PM",35,https://forum.lowyat.net/Kopitiam/topic/3814309
come on dude,"Jun 25 2017, 02:59 PM",35,https://forum.lowyat.net/Kopitiam/topic/4339002
Food Ranger need eatery recommendation,"Jan 9 2017, 08:09 PM",35,https://forum.lowyat.net/Kopitiam/topic/4170805
Guys suggest any good card games,"Jun 25 2017, 06:44 PM",35,https://forum.lowyat.net/Kopitiam/topic/4339314
Question: Why is arcade claw machine not gambling,"Jun 25 2017, 07:23 PM",35,https://forum.lowyat.net/Kopitiam/topic/4339360
"Ehh,where handbrake ?","Jun 25 2017, 01:51 PM",35,https://forum.lowyat.net/Kopitiam/topic/4338925
Hari Raya di China ,"Jun 24 2017, 01:47 PM",35,https://forum.lowyat.net/Kopitiam/topic/4338165
Are revolvers really that high powered?,"Jun 25 2017, 01:38 PM",35,https://forum.lowyat.net/Kopitiam/topic/4338912
I realise /k every day same topic for years,"Jun 25 2017, 07:06 PM",35,https://forum.lowyat.net/Kopitiam/topic/4339340
Caltex: Retailers took us to court over a dispute,"Jun 24 2017, 06:31 PM",35,https://forum.lowyat.net/Kopitiam/topic/4338371
Alien Isolation vs Prey,"Jun 21 2017, 09:27 AM",35,https://forum.lowyat.net/Kopitiam/topic/4333781
"Abang Johari Welcomes Over 10,000 Guests At","Jun 25 2017, 07:33 PM",35,https://forum.lowyat.net/Kopitiam/topic/4339370
Selamat Hari Raya Aidilfitri,"Jun 25 2017, 12:05 PM",35,https://forum.lowyat.net/Kopitiam/topic/4338796
This guy is one lucky sonofabitch.,"Jun 25 2017, 06:15 PM",35,https://forum.lowyat.net/Kopitiam/topic/4339282
Does malaysia food culture encourages obesity?,"Feb 13 2017, 11:09 PM",35,https://forum.lowyat.net/Kopitiam/topic/4196615
Wireless device interference,"Jun 25 2017, 07:06 PM",35,https://forum.lowyat.net/Kopitiam/topic/4339339
So I queued up for One plus 5 today,"Jun 22 2017, 06:28 AM",35,https://forum.lowyat.net/Kopitiam/topic/4335295
Zakir Naik boasts of citizenship offers from 10,"Jun 25 2017, 05:48 PM",35,https://forum.lowyat.net/Kopitiam/topic/4339252
Heavy,"Jun 25 2017, 05:47 PM",35,https://forum.lowyat.net/Kopitiam/topic/4339251
Before you make fun of anyone's English watch this,"Jun 25 2017, 03:44 PM",35,https://forum.lowyat.net/Kopitiam/topic/4339075
Fat girl cute guy,"Jun 25 2017, 06:24 PM",35,https://forum.lowyat.net/Kopitiam/topic/4339292
"History video of Malaya, Singapore and Sumatra","Jun 25 2017, 06:45 PM",35,https://forum.lowyat.net/Kopitiam/topic/4339315
are you asshole  :angry:,"Jun 25 2017, 06:42 PM",35,https://forum.lowyat.net/Kopitiam/topic/4339311
This is how Miss Malaysia training and exercise!,"Jun 25 2017, 02:55 PM",35,https://forum.lowyat.net/Kopitiam/topic/4338993
Learn new language,"Jun 25 2017, 05:58 PM",35,https://forum.lowyat.net/Kopitiam/topic/4339265
"BIAR PAPA, ASALKAN BERGAYA NEW SAMSUNG!","Jun 24 2017, 05:41 PM",35,https://forum.lowyat.net/Kopitiam/topic/4338322
indon raya terror attack,"Jun 25 2017, 01:27 PM",35,https://forum.lowyat.net/Kopitiam/topic/4338901
Was Michael Jackson killed by Iran?,"Jun 25 2017, 11:11 AM",35,https://forum.lowyat.net/Kopitiam/topic/4338754
clinic for STD test,"Nov 23 2016, 04:32 PM",36,https://forum.lowyat.net/Kopitiam/topic/4123209
Adidas Yeezy,"Jun 25 2017, 11:56 AM",36,https://forum.lowyat.net/Kopitiam/topic/4338788
"Why SK n JP currency so small, yet still so rich?","Jun 25 2017, 05:22 PM",36,https://forum.lowyat.net/Kopitiam/topic/4339227
Cum play doto 2 wif me,"Jun 24 2017, 02:16 PM",36,https://forum.lowyat.net/Kopitiam/topic/4338179
Home alone during Raya,"Jun 25 2017, 05:23 PM",36,https://forum.lowyat.net/Kopitiam/topic/4339228
Air Asia shake crazy like vibrator,"Jun 25 2017, 05:36 PM",36,https://forum.lowyat.net/Kopitiam/topic/4339239
Cybercriminals now target IoT devices,"Jun 25 2017, 01:49 PM",36,https://forum.lowyat.net/Kopitiam/topic/4338922
TPM Zahid: Accept ROHINGYA minority as CITIZENS !,"Mar 17 2017, 09:12 AM",36,https://forum.lowyat.net/Kopitiam/topic/4225697
Where to buy Decaff Tea?,"Jun 25 2017, 03:44 PM",36,https://forum.lowyat.net/Kopitiam/topic/4339074
Pregnant woman among 3 to die in crash,"Jun 25 2017, 05:11 PM",36,https://forum.lowyat.net/Kopitiam/topic/4339223
balik kampung,"Jun 25 2017, 04:20 PM",36,https://forum.lowyat.net/Kopitiam/topic/4339142
Booking carpark with legs,"Jun 25 2017, 08:34 AM",36,https://forum.lowyat.net/Kopitiam/topic/4338694
Zeti says BankNegara powerless to act against 1MDB,"Jun 25 2017, 11:00 AM",36,https://forum.lowyat.net/Kopitiam/topic/4338750
Ppl just want to go home and be lazy,"Jun 25 2017, 12:10 PM",36,https://forum.lowyat.net/Kopitiam/topic/4338804
How much to pay to Grab a Beer around the world?,"Jun 25 2017, 04:28 PM",36,https://forum.lowyat.net/Kopitiam/topic/4339162
2015 oil crash made Najib worse than Dr. M?,"Jun 25 2017, 04:15 PM",36,https://forum.lowyat.net/Kopitiam/topic/4339129
Tongsan company potek org kite..,"Jun 25 2017, 02:49 PM",36,https://forum.lowyat.net/Kopitiam/topic/4338983
Genting highland,"Jun 25 2017, 03:41 PM",36,https://forum.lowyat.net/Kopitiam/topic/4339068
Boy playing with firecrackers dies,"Jun 25 2017, 03:55 PM",36,https://forum.lowyat.net/Kopitiam/topic/4339093
Best feeling ever,"Jun 25 2017, 08:23 AM",36,https://forum.lowyat.net/Kopitiam/topic/4338690
LIM SIAN SEE DAH MUNCUL,"Jun 25 2017, 03:16 PM",36,https://forum.lowyat.net/Kopitiam/topic/4339020
I accidentally call bigshot her name instead of,"Jun 25 2017, 11:42 AM",36,https://forum.lowyat.net/Kopitiam/topic/4338777
Who wanna keep fit with Tiffany Amoi?,"Jun 25 2017, 03:31 PM",36,https://forum.lowyat.net/Kopitiam/topic/4339045
"Couple makes rape video, blackmail milf victim for","Jun 25 2017, 03:05 PM",36,https://forum.lowyat.net/Kopitiam/topic/4339006
bapak terkejut anak membakar mercun,"Jun 23 2017, 09:27 PM",36,https://forum.lowyat.net/Kopitiam/topic/4337664
Anda mangsa ahlong?,"Jun 25 2017, 02:34 PM",36,https://forum.lowyat.net/Kopitiam/topic/4338957
Whats your favourite drink?,"Jun 25 2017, 02:09 PM",36,https://forum.lowyat.net/Kopitiam/topic/4338936
Where Does Cowboy Bebop Come From?,"Jun 19 2017, 01:29 AM",36,https://forum.lowyat.net/Kopitiam/topic/4329972
"Cute Goh Liu Ying: Selamat Hari Raya Idul Fitri,","Jun 25 2017, 11:57 AM",36,https://forum.lowyat.net/Kopitiam/topic/4338789
Low quality news from M.kini.,"Jun 25 2017, 12:08 PM",36,https://forum.lowyat.net/Kopitiam/topic/4338800
Aiyoyo...,"Jun 25 2017, 02:27 PM",37,https://forum.lowyat.net/Kopitiam/topic/4338947
"sorry man, still lunch time, 2 more mins.","Jun 24 2017, 07:17 PM",37,https://forum.lowyat.net/Kopitiam/topic/4338397
I can sense pastor koh is still alive too,"May 24 2017, 02:12 PM",37,https://forum.lowyat.net/Kopitiam/topic/4299421
Thousands Throng PM Najib Seri Perdana,"Jun 25 2017, 01:14 PM",37,https://forum.lowyat.net/Kopitiam/topic/4338893
Khairy Jamaluddin: Tradisi Sarapan Raya Bersama,"Jun 25 2017, 12:19 PM",37,https://forum.lowyat.net/Kopitiam/topic/4338815
GSC Maxx,"Jun 25 2017, 02:25 PM",37,https://forum.lowyat.net/Kopitiam/topic/4338943
Beijing soaring above the sky,"Jun 25 2017, 10:50 AM",37,https://forum.lowyat.net/Kopitiam/topic/4338743
Selamat hari raya guise,"Jun 25 2017, 08:21 AM",37,https://forum.lowyat.net/Kopitiam/topic/4338689
22 Jun-2 Julai tiada tambah nilai di tol,"Jun 14 2017, 10:59 AM",37,https://forum.lowyat.net/Kopitiam/topic/4326429
Want to Apply for IDP,"Feb 11 2016, 06:13 PM",37,https://forum.lowyat.net/Kopitiam/topic/3865855
Morning dearest /K :),"Jun 25 2017, 11:14 AM",37,https://forum.lowyat.net/Kopitiam/topic/4338755
Re-rate Kong: Skull Island,"Jun 25 2017, 12:27 PM",37,https://forum.lowyat.net/Kopitiam/topic/4338831
Housemate play mobile legend with max volume...,"Jun 23 2017, 06:25 PM",37,https://forum.lowyat.net/Kopitiam/topic/4337557
Where to buy black plastic cutleries?,"Jun 23 2017, 01:18 PM",37,https://forum.lowyat.net/Kopitiam/topic/4337295
Japan to launch 5G telecom soon,"Jun 25 2017, 10:03 AM",37,https://forum.lowyat.net/Kopitiam/topic/4338721
Pretty unknown girl wanna add me in fb,"Jun 25 2017, 12:42 PM",37,https://forum.lowyat.net/Kopitiam/topic/4338859
20-year-old Sabahan auditioned for Miss Universe,"Jun 24 2017, 11:01 PM",37,https://forum.lowyat.net/Kopitiam/topic/4338522
apa phone rm250,"Jun 22 2017, 01:14 AM",37,https://forum.lowyat.net/Kopitiam/topic/4335066
MAS CEO: new direct aisle access seat for 737 MAX,"Jun 25 2017, 01:12 PM",37,https://forum.lowyat.net/Kopitiam/topic/4338889
Hong Kong: 20 years since handover,"Jun 24 2017, 05:35 PM",37,https://forum.lowyat.net/Kopitiam/topic/4338314
closed,"Jun 25 2017, 11:50 AM",37,https://forum.lowyat.net/Kopitiam/topic/4338783
Hanfu Movement in Malaysia,"Apr 3 2017, 11:09 AM",37,https://forum.lowyat.net/Kopitiam/topic/4246547
HO MAI GAWD! PITCH PERFECT 3 TRAILER OUT!,"Jun 25 2017, 10:45 AM",37,https://forum.lowyat.net/Kopitiam/topic/4338740
If ur sisters like this what meaning?,"Jun 25 2017, 11:15 AM",37,https://forum.lowyat.net/Kopitiam/topic/4338756
Amoi Big Eater,"Jun 25 2017, 09:36 AM",37,https://forum.lowyat.net/Kopitiam/topic/4338711
Friends,"Jun 25 2017, 11:55 AM",37,https://forum.lowyat.net/Kopitiam/topic/4338787
5 SQ zeh zeh for you to choose.,"Jun 25 2017, 11:26 AM",37,https://forum.lowyat.net/Kopitiam/topic/4338764
Holiday,"Jun 25 2017, 11:25 AM",37,https://forum.lowyat.net/Kopitiam/topic/4338763
OMG 17yo raped while being treated in hospital ICU,"Jun 24 2017, 09:40 PM",37,https://forum.lowyat.net/Kopitiam/topic/4338474
can we still apply brim?,"Jun 23 2017, 12:21 PM",37,https://forum.lowyat.net/Kopitiam/topic/4337226
Sidek Hassan: Royal Commission Of Inquiry (RCI) On,"Jun 25 2017, 12:24 AM",38,https://forum.lowyat.net/Kopitiam/topic/4338563
Mahathir forgets script in adorable Raya video,"Jun 25 2017, 10:02 AM",38,https://forum.lowyat.net/Kopitiam/topic/4338720
Next big thing.AI in smartphone.,"Jun 25 2017, 10:57 AM",38,https://forum.lowyat.net/Kopitiam/topic/4338747
F1 2017,"Jun 25 2017, 11:27 AM",38,https://forum.lowyat.net/Kopitiam/topic/4338765
who got travel from KL to JB on Monday/Tuesday,"Jun 25 2017, 11:16 AM",38,https://forum.lowyat.net/Kopitiam/topic/4338758
WEH KORANG WARFRAME BEST OR NOT?,"Jun 24 2017, 04:11 PM",38,https://forum.lowyat.net/Kopitiam/topic/4338248
ada soalan mau tanya,"Jun 25 2017, 10:16 AM",38,https://forum.lowyat.net/Kopitiam/topic/4338730
I watched the new Bayformers movie[Spoilers],"Jun 25 2017, 09:34 AM",38,https://forum.lowyat.net/Kopitiam/topic/4338710
Which card,"Jun 25 2017, 10:55 AM",38,https://forum.lowyat.net/Kopitiam/topic/4338745
Fell in love with my self.,"Jun 25 2017, 10:45 AM",38,https://forum.lowyat.net/Kopitiam/topic/4338741
Selamat Hari Raya Aidilfitri,"Jun 25 2017, 07:53 AM",38,https://forum.lowyat.net/Kopitiam/topic/4338681
My gf planned a roadtrip,"Jun 24 2017, 02:52 AM",38,https://forum.lowyat.net/Kopitiam/topic/4337812
Steam Summer sales now.,"Jun 23 2017, 11:49 AM",38,https://forum.lowyat.net/Kopitiam/topic/4337181
what islam is like in egypt in 1958,"Jun 24 2017, 10:00 PM",38,https://forum.lowyat.net/Kopitiam/topic/4338483
"SYED SADDIQ, YOU JUST GOT NAILED GOOD AND PROPER","Jun 20 2017, 08:16 PM",38,https://forum.lowyat.net/Kopitiam/topic/4333488
/k tipu KL no car all balik kampung,"Jun 24 2017, 10:30 PM",38,https://forum.lowyat.net/Kopitiam/topic/4338506
MDDA Rosedy Issa: Genuine MLMs Hit Hard,"Jun 25 2017, 08:14 AM",38,https://forum.lowyat.net/Kopitiam/topic/4338687
Pecut kuat lepas tol,"Jun 23 2017, 03:23 PM",38,https://forum.lowyat.net/Kopitiam/topic/4337403
why malaysian guys can't be like Kguys?,"Jun 25 2017, 01:23 AM",38,https://forum.lowyat.net/Kopitiam/topic/4338586
28th GMA: Khalil Fong Takes Home,"Jun 24 2017, 11:15 PM",38,https://forum.lowyat.net/Kopitiam/topic/4338529
Sniper hits ISIS target from over 2 miles away,"Jun 23 2017, 02:44 PM",38,https://forum.lowyat.net/Kopitiam/topic/4337373
Becareful when hiring maid,"Jun 24 2017, 12:49 PM",38,https://forum.lowyat.net/Kopitiam/topic/4338114
What problem do you have?,"Jun 24 2017, 05:04 PM",38,https://forum.lowyat.net/Kopitiam/topic/4338292
How you feel and what others think,"Jun 25 2017, 12:27 AM",38,https://forum.lowyat.net/Kopitiam/topic/4338565
Do you believe in the RAHMAN prophecy?,"Jun 24 2017, 06:44 PM",38,https://forum.lowyat.net/Kopitiam/topic/4338375
Pbe. Deal,"Jun 25 2017, 12:48 AM",38,https://forum.lowyat.net/Kopitiam/topic/4338575
Do supermarkets still sell gift cards?,"Jun 25 2017, 02:56 AM",38,https://forum.lowyat.net/Kopitiam/topic/4338613
good morning and hepi raya,"Jun 25 2017, 07:21 AM",38,https://forum.lowyat.net/Kopitiam/topic/4338673
Chinese girl,"Jun 25 2017, 03:14 AM",38,https://forum.lowyat.net/Kopitiam/topic/4338620
South Korea,"Jun 25 2017, 02:59 AM",38,https://forum.lowyat.net/Kopitiam/topic/4338615
My gurl friend,"Jun 24 2017, 10:28 PM",39,https://forum.lowyat.net/Kopitiam/topic/4338504
johor meimei KYBKY 300k followers,"Jun 24 2017, 04:48 PM",39,https://forum.lowyat.net/Kopitiam/topic/4338275
[NSFP] Rate my brand new a***** spray,"Jun 24 2017, 01:10 AM",39,https://forum.lowyat.net/Kopitiam/topic/4337786
Mudik Indonesia 2017: macet banget,"Jun 24 2017, 08:37 PM",39,https://forum.lowyat.net/Kopitiam/topic/4338434
How to remove this,"Jun 24 2017, 08:29 PM",39,https://forum.lowyat.net/Kopitiam/topic/4338430
found UFO crashed in Mars?,"Jun 24 2017, 07:05 PM",39,https://forum.lowyat.net/Kopitiam/topic/4338388
"$12,000,000 jackpot","Feb 9 2017, 09:30 PM",39,https://forum.lowyat.net/Kopitiam/topic/4193684
next gen terrorist weapon,"Jun 25 2017, 01:10 AM",39,https://forum.lowyat.net/Kopitiam/topic/4338580
Close,"Jun 25 2017, 12:35 AM",39,https://forum.lowyat.net/Kopitiam/topic/4338568
Arm wresting is dangerous......,"Jun 25 2017, 01:57 AM",39,https://forum.lowyat.net/Kopitiam/topic/4338597
How to run Astro Otg apps for rooted devices ?,"Mar 4 2016, 01:20 AM",39,https://forum.lowyat.net/Kopitiam/topic/3884428
Apandi tempelak kenyataan Majlis Peguam,"Jun 24 2017, 06:39 PM",39,https://forum.lowyat.net/Kopitiam/topic/4338372
China's dog meat festival,"Jun 24 2017, 08:56 PM",39,https://forum.lowyat.net/Kopitiam/topic/4338446
Transformer 5 & POTC,"Jun 24 2017, 11:53 PM",39,https://forum.lowyat.net/Kopitiam/topic/4338550
London tour video,"Jun 25 2017, 12:42 AM",39,https://forum.lowyat.net/Kopitiam/topic/4338571
Sarawak Report looks to crowdfunding,"Jun 24 2017, 01:58 PM",39,https://forum.lowyat.net/Kopitiam/topic/4338170
Lol kecian dia,"Jun 25 2017, 12:19 AM",39,https://forum.lowyat.net/Kopitiam/topic/4338561
Deputy IGP: Cash find at district police HQ may be,"Jun 24 2017, 08:09 PM",39,https://forum.lowyat.net/Kopitiam/topic/4338423
Hadi a bigger champion of Najib than Umno,"Jun 24 2017, 11:26 PM",39,https://forum.lowyat.net/Kopitiam/topic/4338536
RSVP: Rumah Terbuka di Seri Perdana,"Jun 24 2017, 11:03 PM",39,https://forum.lowyat.net/Kopitiam/topic/4338524
salamat hari raya guise.......,"Jun 24 2017, 11:34 PM",39,https://forum.lowyat.net/Kopitiam/topic/4338539
Ahmad Razif: Petrol RM5 Hadiah Aidilfitri Kepada,"Jun 24 2017, 11:30 PM",39,https://forum.lowyat.net/Kopitiam/topic/4338538
MH axing of Darwin route shocks Northern Territory,"Jun 24 2017, 03:22 PM",39,https://forum.lowyat.net/Kopitiam/topic/4338219
JPJ launches WhatsApp number 4 lodging complaints,"Jun 24 2017, 10:49 PM",39,https://forum.lowyat.net/Kopitiam/topic/4338518
Silly things employers discriminate about,"Jun 24 2017, 10:45 PM",39,https://forum.lowyat.net/Kopitiam/topic/4338514
bye bye Bagheera :(,"Jun 24 2017, 11:54 AM",39,https://forum.lowyat.net/Kopitiam/topic/4338060
Just balik dari pasar,"Jun 24 2017, 12:23 PM",39,https://forum.lowyat.net/Kopitiam/topic/4338088
What k hate most when live with others?,"Jun 24 2017, 10:21 PM",39,https://forum.lowyat.net/Kopitiam/topic/4338495
how k hang clothes after wash?,"Jun 24 2017, 10:52 PM",39,https://forum.lowyat.net/Kopitiam/topic/4338519
MNP one-month rule for porting out?,"Jun 23 2017, 10:47 AM",39,https://forum.lowyat.net/Kopitiam/topic/4337124
New cashback app found - MooBucks,"Apr 19 2017, 11:42 AM",40,https://forum.lowyat.net/Kopitiam/topic/4270107
How much u willing to pay for a car,"Jun 24 2017, 07:38 PM",40,https://forum.lowyat.net/Kopitiam/topic/4338410
MO1 era coming to an end: Latest DOJ 1mdb suit,"Jun 24 2017, 05:42 PM",40,https://forum.lowyat.net/Kopitiam/topic/4338324
Harvey Normal mid year sales,"Jun 24 2017, 10:33 PM",40,https://forum.lowyat.net/Kopitiam/topic/4338507
Selamat hari raya kawan2. Salah silap maafkan ya,"Jun 24 2017, 09:18 PM",40,https://forum.lowyat.net/Kopitiam/topic/4338464
Should I teach my wife a lesson ?,"Jun 24 2017, 08:43 PM",40,https://forum.lowyat.net/Kopitiam/topic/4338437
Pakistan - A powderful hockey nation now jadi ayam,"Jun 24 2017, 10:08 PM",40,https://forum.lowyat.net/Kopitiam/topic/4338487
"Car rams roadside stall, kills woman","Jun 10 2017, 10:36 PM",40,https://forum.lowyat.net/Kopitiam/topic/4321435
INDONESIAN MINISTER SLEEPING @ JFK,"Jun 13 2017, 12:31 PM",40,https://forum.lowyat.net/Kopitiam/topic/4324514
BANG BANG MALAYSIA!,"Jun 13 2017, 03:32 PM",40,https://forum.lowyat.net/Kopitiam/topic/4324786
"NHAVEEN's Killers (suspect). lawyer ""backed out""","Jun 17 2017, 02:00 PM",40,https://forum.lowyat.net/Kopitiam/topic/4329011
Woman in the face because she was wearing shorts,"Jun 24 2017, 09:13 PM",40,https://forum.lowyat.net/Kopitiam/topic/4338457
PROTON - GEELY is the right partner. Yesss,"Jun 24 2017, 09:29 PM",40,https://forum.lowyat.net/Kopitiam/topic/4338469
Families Of Teens Charged With Nhaveens Murder,"Jun 22 2017, 03:38 PM",40,https://forum.lowyat.net/Kopitiam/topic/4336000
Safari browser,"Jun 24 2017, 10:20 PM",40,https://forum.lowyat.net/Kopitiam/topic/4338494
Saudis foil attack on Grand Mosque in Mecca,"Jun 24 2017, 12:55 PM",40,https://forum.lowyat.net/Kopitiam/topic/4338122
"wife no want cook,everyday dapao","Jun 22 2017, 02:08 PM",40,https://forum.lowyat.net/Kopitiam/topic/4335872
go singapoe can request how much salary?,"Jun 24 2017, 08:01 PM",40,https://forum.lowyat.net/Kopitiam/topic/4338419
Ucapan Aidilfitri  Dr. Mahathir: Selamat Hari Raya,"Jun 24 2017, 10:12 PM",40,https://forum.lowyat.net/Kopitiam/topic/4338491
Many Penangites opting to live in Perak,"Jun 23 2017, 08:18 PM",40,https://forum.lowyat.net/Kopitiam/topic/4337622
AES camera,"Jun 24 2017, 09:23 PM",40,https://forum.lowyat.net/Kopitiam/topic/4338467
Breaking News! MO1 identity finally revealed!,"Jun 21 2017, 06:04 PM",40,https://forum.lowyat.net/Kopitiam/topic/4334586
rekomenn good CCTV,"Feb 16 2017, 11:35 AM",40,https://forum.lowyat.net/Kopitiam/topic/4198469
What can you do with 2.5k travel voucher,"Jun 24 2017, 09:35 PM",40,https://forum.lowyat.net/Kopitiam/topic/4338471
Perutusan Hari Raya Guan Eng: Hadiah Hari Raya,"Jun 23 2017, 05:04 PM",40,https://forum.lowyat.net/Kopitiam/topic/4337504
Why flight passengers so kan cheong?,"Jun 23 2017, 10:24 AM",40,https://forum.lowyat.net/Kopitiam/topic/4337107
This guy spill a bunch of water on his new laptop,"Jun 24 2017, 12:55 PM",40,https://forum.lowyat.net/Kopitiam/topic/4338123
Bellyfat problem,"Jun 24 2017, 01:47 PM",40,https://forum.lowyat.net/Kopitiam/topic/4338164
so the car total ady?,"Jun 24 2017, 04:53 AM",40,https://forum.lowyat.net/Kopitiam/topic/4337842
My Indian colleague family quite kesian,"Jun 24 2017, 08:33 PM",40,https://forum.lowyat.net/Kopitiam/topic/4338433
Suicide Bomber Blows Himself up,"Jun 24 2017, 06:48 PM",41,https://forum.lowyat.net/Kopitiam/topic/4338377
Nazri Aziz: Malaysia Targets 4 Million Tourists,"Jun 24 2017, 09:02 PM",41,https://forum.lowyat.net/Kopitiam/topic/4338448
What are your principles? Got any /k principle?,"Jun 24 2017, 05:04 AM",41,https://forum.lowyat.net/Kopitiam/topic/4337847
Datuk Seri Syed Danial: Malaysians To Celebrate,"Jun 24 2017, 09:15 PM",41,https://forum.lowyat.net/Kopitiam/topic/4338461
Female > male,"Jun 24 2017, 07:41 PM",41,https://forum.lowyat.net/Kopitiam/topic/4338412
i mau ask but malu,"Jun 24 2017, 09:12 PM",41,https://forum.lowyat.net/Kopitiam/topic/4338456
"I'm a Malaysian Living in Houston, TX","Nov 27 2016, 08:35 AM",41,https://forum.lowyat.net/Kopitiam/topic/4127497
OFFICIAL AIDILFITRI THREAD 1438H/2017,"Jun 19 2017, 10:49 AM",41,https://forum.lowyat.net/Kopitiam/topic/4330109
Malam sebelum raya,"Jun 24 2017, 09:09 PM",41,https://forum.lowyat.net/Kopitiam/topic/4338453
Cerita Hantu,"Jun 22 2017, 05:05 PM",41,https://forum.lowyat.net/Kopitiam/topic/4336141
Indian chicky KYBKY approved ?,"Jun 22 2017, 03:44 PM",41,https://forum.lowyat.net/Kopitiam/topic/4336013
Unique grand ballroom,"Jun 24 2017, 08:45 PM",41,https://forum.lowyat.net/Kopitiam/topic/4338440
How you guys deal with those gangster,"Jun 24 2017, 06:51 PM",41,https://forum.lowyat.net/Kopitiam/topic/4338381
see couple at public places,"Jun 24 2017, 08:12 PM",41,https://forum.lowyat.net/Kopitiam/topic/4338425
Those like to shame Fat/Ugly/Flat/Short people on,"Jun 23 2017, 09:43 AM",41,https://forum.lowyat.net/Kopitiam/topic/4337073
