title,time,page no,link
/ktards are generally dumb and quick to judge,"Jun 27 2017, 12:35 PM",25,https://forum.lowyat.net/Kopitiam/topic/4340779
Coke zero really 0 calories?,"Jun 27 2017, 12:17 PM",25,https://forum.lowyat.net/Kopitiam/topic/4340757
"Julau MP Joseph Salang: Longhouse Folks, Report","Jun 27 2017, 12:52 PM",25,https://forum.lowyat.net/Kopitiam/topic/4340801
squash in kl /pj?,"Jun 27 2017, 12:38 AM",25,https://forum.lowyat.net/Kopitiam/topic/4340418
Radeon Vega,"Jun 27 2017, 12:45 PM",25,https://forum.lowyat.net/Kopitiam/topic/4340793
are k goin to watch this wu wu ah ah ?,"Jun 27 2017, 08:38 AM",25,https://forum.lowyat.net/Kopitiam/topic/4340554
Japan guys and girls so tall now,"Jun 26 2017, 11:32 PM",25,https://forum.lowyat.net/Kopitiam/topic/4340374
Holiday,"Jun 27 2017, 12:38 PM",25,https://forum.lowyat.net/Kopitiam/topic/4340783
Is today a working day,"Jun 27 2017, 12:03 PM",25,https://forum.lowyat.net/Kopitiam/topic/4340745
miranda kerr gip DOJ jewellry get from jho low,"Jun 27 2017, 12:14 PM",25,https://forum.lowyat.net/Kopitiam/topic/4340752
Where to buy this game console?,"Jun 27 2017, 10:56 AM",25,https://forum.lowyat.net/Kopitiam/topic/4340656
Mummy vs Transformers 5 - which BAD movie to watch,"Jun 27 2017, 11:36 AM",25,https://forum.lowyat.net/Kopitiam/topic/4340713
Wish Everyday Was Raya,"Jun 27 2017, 12:00 PM",25,https://forum.lowyat.net/Kopitiam/topic/4340743
O&G is mine! mine alone! RAGE!,"Jun 27 2017, 09:55 AM",25,https://forum.lowyat.net/Kopitiam/topic/4340602
"If wife give birth at another country, will","Jun 27 2017, 11:01 AM",25,https://forum.lowyat.net/Kopitiam/topic/4340659
Whats a better cheat-meal,"Jun 27 2017, 08:52 AM",25,https://forum.lowyat.net/Kopitiam/topic/4340560
Factory bus problem how,"Jun 26 2017, 09:11 AM",25,https://forum.lowyat.net/Kopitiam/topic/4339583
MASIN / SALTY.....NOT HAPPY,"Jun 27 2017, 09:13 AM",25,https://forum.lowyat.net/Kopitiam/topic/4340572
RAMAI DATANG RUMAH PM! CUKUR!,"Jun 27 2017, 09:35 AM",25,https://forum.lowyat.net/Kopitiam/topic/4340590
MSM Glucosamine Chondroitin MSM Complex,"Jun 27 2017, 11:24 AM",26,https://forum.lowyat.net/Kopitiam/topic/4340692
Note 8 leaked!,"Jun 27 2017, 10:41 AM",26,https://forum.lowyat.net/Kopitiam/topic/4340636
Wheres my duit raya?,"Jun 27 2017, 10:42 AM",26,https://forum.lowyat.net/Kopitiam/topic/4340638
I realise Victoria Secret's angels,"Jun 27 2017, 11:09 AM",26,https://forum.lowyat.net/Kopitiam/topic/4340674
Last time MHNR. now Razon.,"Jun 27 2017, 11:15 AM",26,https://forum.lowyat.net/Kopitiam/topic/4340684
Trolling a Mudah scammer,"Jun 26 2017, 10:01 PM",26,https://forum.lowyat.net/Kopitiam/topic/4340330
Abdul Karim: Cancellation Of Trips By,"Jun 27 2017, 09:51 AM",26,https://forum.lowyat.net/Kopitiam/topic/4340598
do you get irritated by people,"Jun 27 2017, 08:53 AM",26,https://forum.lowyat.net/Kopitiam/topic/4340561
WTA shopping mall,"Jun 27 2017, 08:47 AM",26,https://forum.lowyat.net/Kopitiam/topic/4340556
Parents with children,"Jun 27 2017, 10:47 AM",26,https://forum.lowyat.net/Kopitiam/topic/4340643
"Aku butthurt, so aku buka tered.","Jun 27 2017, 09:39 AM",26,https://forum.lowyat.net/Kopitiam/topic/4340593
"Cheap Dominos Pizza today, rm3.90 only","Jun 27 2017, 09:17 AM",26,https://forum.lowyat.net/Kopitiam/topic/4340574
Pitch Perfect 3,"Jun 27 2017, 10:39 AM",26,https://forum.lowyat.net/Kopitiam/topic/4340633
Malaysian are gullible,"Jun 26 2017, 10:10 PM",26,https://forum.lowyat.net/Kopitiam/topic/4340335
Pastor Koh Abduction,"Jun 27 2017, 02:00 AM",26,https://forum.lowyat.net/Kopitiam/topic/4340447
Anabelle,"Jun 27 2017, 10:08 AM",26,https://forum.lowyat.net/Kopitiam/topic/4340609
Traffic Update : From North to PJ  Smooth & Aman,"Jun 27 2017, 08:52 AM",26,https://forum.lowyat.net/Kopitiam/topic/4340559
Thai girl,"Jun 26 2017, 07:14 PM",26,https://forum.lowyat.net/Kopitiam/topic/4340195
Uber-style mobile toilet business,"Jun 27 2017, 09:53 AM",26,https://forum.lowyat.net/Kopitiam/topic/4340600
Gran Turismo Sport,"Jun 27 2017, 10:07 AM",26,https://forum.lowyat.net/Kopitiam/topic/4340608
GQ magazine cover vs Shape magazine cover,"Jun 27 2017, 09:59 AM",26,https://forum.lowyat.net/Kopitiam/topic/4340604
Mobile internet damn fast in lawyer neighborhood,"Jun 26 2017, 09:19 PM",26,https://forum.lowyat.net/Kopitiam/topic/4340300
Bank Negara says all actions against 1MDB taken,"Aug 12 2016, 03:16 PM",26,https://forum.lowyat.net/Kopitiam/topic/4027552
ur parent got ask money from u?,"Jun 26 2017, 01:57 PM",26,https://forum.lowyat.net/Kopitiam/topic/4339863
help me choose my new car color,"Jun 24 2017, 10:01 PM",26,https://forum.lowyat.net/Kopitiam/topic/4338484
Awek Melayu menari menyanyi,"Jun 26 2017, 09:27 PM",26,https://forum.lowyat.net/Kopitiam/topic/4340306
why highway not free during big festival,"Jun 25 2017, 05:06 PM",26,https://forum.lowyat.net/Kopitiam/topic/4339219
steam summer sale?,"Jun 26 2017, 12:15 AM",26,https://forum.lowyat.net/Kopitiam/topic/4339480
Topic Closed,"Jun 27 2017, 07:00 AM",26,https://forum.lowyat.net/Kopitiam/topic/4340535
TRUE FITNESS hutang KEDAI DOBI,"Jun 23 2017, 09:00 PM",26,https://forum.lowyat.net/Kopitiam/topic/4337645
Pastor Kohs wife seeks police update on abduction,"Jun 27 2017, 02:10 AM",27,https://forum.lowyat.net/Kopitiam/topic/4340449
utk perempuan yg sdg dlm pelukan,"Jun 27 2017, 03:29 AM",27,https://forum.lowyat.net/Kopitiam/topic/4340481
Penipu scammer or not?,"Jun 26 2017, 01:18 PM",27,https://forum.lowyat.net/Kopitiam/topic/4339828
rohingya in the news again,"Jun 27 2017, 03:56 AM",27,https://forum.lowyat.net/Kopitiam/topic/4340489
Code Geass R3 : Lelouch of the Resurrection,"Jun 27 2017, 02:51 AM",27,https://forum.lowyat.net/Kopitiam/topic/4340472
trump this year no Buka Puasa dinner. so crazy,"Jun 26 2017, 09:02 PM",27,https://forum.lowyat.net/Kopitiam/topic/4340285
"""ALLEGEDLY LEAPED FROM THE 3RD FLOOR""","May 22 2017, 10:15 PM",27,https://forum.lowyat.net/Kopitiam/topic/4297718
"spend ur money, be happy","Jun 26 2017, 03:49 PM",27,https://forum.lowyat.net/Kopitiam/topic/4339970
Takata decides to file for bankruptcy,"Jun 26 2017, 04:08 PM",27,https://forum.lowyat.net/Kopitiam/topic/4339981
Ragnarok Online Gameflier Malaysia/ Singapore,"Oct 7 2013, 12:38 PM",27,https://forum.lowyat.net/Kopitiam/topic/2985769
karena suka,"Jun 8 2017, 10:35 PM",27,https://forum.lowyat.net/Kopitiam/topic/4319104
My town vs velocity,"Jun 26 2017, 05:18 PM",27,https://forum.lowyat.net/Kopitiam/topic/4340056
Raya without gaji,"Jun 26 2017, 06:17 PM",27,https://forum.lowyat.net/Kopitiam/topic/4340116
USS Fitzgerald conspiracy,"Jun 26 2017, 02:30 AM",27,https://forum.lowyat.net/Kopitiam/topic/4339529
"Ramai sedar, mahu perubahaan di Kelantan - UMNO","Jun 26 2017, 10:17 PM",27,https://forum.lowyat.net/Kopitiam/topic/4340338
what is the feeling of drinking alone?,"Jun 26 2017, 08:02 PM",27,https://forum.lowyat.net/Kopitiam/topic/4340250
Raining,"Jun 26 2017, 06:12 PM",27,https://forum.lowyat.net/Kopitiam/topic/4340110
MB: Moratorium bauksit dilanjut hingga PRU14,"Jun 26 2017, 10:54 PM",27,https://forum.lowyat.net/Kopitiam/topic/4340359
TVB At The Threshold Of An Era 3 To Start,"Jun 25 2017, 05:59 PM",27,https://forum.lowyat.net/Kopitiam/topic/4339267
iHerb,"Jul 26 2016, 05:49 PM",27,https://forum.lowyat.net/Kopitiam/topic/4013768
How to dress like a king,"Jun 27 2017, 12:08 AM",27,https://forum.lowyat.net/Kopitiam/topic/4340395
Transformers  the last knight sucks,"Jun 22 2017, 03:47 PM",27,https://forum.lowyat.net/Kopitiam/topic/4336019
what one particular k/tard looks like,"Jun 26 2017, 09:29 PM",27,https://forum.lowyat.net/Kopitiam/topic/4340312
/k csgo squad v3,"Jan 19 2017, 10:50 PM",27,https://forum.lowyat.net/Kopitiam/topic/4179386
Aguero-Sanchez swap deals.,"Jun 26 2017, 09:02 PM",27,https://forum.lowyat.net/Kopitiam/topic/4340286
Pemandu bas tertidur.,"Jun 26 2017, 09:21 PM",27,https://forum.lowyat.net/Kopitiam/topic/4340302
U.S. Supreme Court revives Trump travel ban..,"Jun 27 2017, 12:01 AM",27,https://forum.lowyat.net/Kopitiam/topic/4340391
For those who cannot use chopstick,"Jun 26 2017, 11:49 PM",27,https://forum.lowyat.net/Kopitiam/topic/4340384
Pls don't tell me ur mlm program if,"Jun 26 2017, 06:23 PM",27,https://forum.lowyat.net/Kopitiam/topic/4340123
Good morning zeh zeh kym?,"Jun 26 2017, 09:39 AM",27,https://forum.lowyat.net/Kopitiam/topic/4339593
multiple property? I might not impressed,"Jun 26 2017, 07:06 PM",28,https://forum.lowyat.net/Kopitiam/topic/4340184
Camry vs Vellfire,"Jun 26 2017, 02:51 AM",28,https://forum.lowyat.net/Kopitiam/topic/4339534
Is it just me or is Petronas Twin Tower nice?,"Jun 26 2017, 05:16 PM",28,https://forum.lowyat.net/Kopitiam/topic/4340052
Which one prettier?,"Jun 26 2017, 09:24 PM",28,https://forum.lowyat.net/Kopitiam/topic/4340303
"Mat Rempit vs Myvi : Myvi KO, Rempit Win ","Jun 26 2017, 07:15 PM",28,https://forum.lowyat.net/Kopitiam/topic/4340198
LRT filled with bangla,"Jun 26 2017, 07:14 PM",28,https://forum.lowyat.net/Kopitiam/topic/4340197
HELP!,"Jun 26 2017, 10:21 PM",28,https://forum.lowyat.net/Kopitiam/topic/4340340
Show skill in lift,"Jun 26 2017, 09:16 PM",28,https://forum.lowyat.net/Kopitiam/topic/4340298
We should be smart and not easily deceived!,"Jun 26 2017, 10:26 PM",28,https://forum.lowyat.net/Kopitiam/topic/4340343
Chicken was too cold......,"Jun 26 2017, 06:35 PM",28,https://forum.lowyat.net/Kopitiam/topic/4340141
credit card,"Jun 26 2017, 09:05 PM",28,https://forum.lowyat.net/Kopitiam/topic/4340289
car front sensor,"Jun 25 2017, 09:13 PM",28,https://forum.lowyat.net/Kopitiam/topic/4339405
Why SG salary is so high while expenses is so low?,"Jun 25 2017, 01:26 PM",28,https://forum.lowyat.net/Kopitiam/topic/4338900
Indon Horror Movie: The Doll 2,"Jun 26 2017, 09:17 PM",28,https://forum.lowyat.net/Kopitiam/topic/4340299
Which is best coffee liqueur?,"Jun 26 2017, 09:54 PM",28,https://forum.lowyat.net/Kopitiam/topic/4340327
Come buy Fast! Celcom 4g first blue,"Jun 19 2017, 07:07 AM",28,https://forum.lowyat.net/Kopitiam/topic/4330004
see hot chick with old man,"Jun 26 2017, 09:46 PM",28,https://forum.lowyat.net/Kopitiam/topic/4340324
Datuk Vida > KPOP,"Jun 26 2017, 09:52 PM",28,https://forum.lowyat.net/Kopitiam/topic/4340326
BANK HATES THEM! RM 2.5mil in 60 seconds!,"Jun 23 2017, 06:12 AM",28,https://forum.lowyat.net/Kopitiam/topic/4336913
gf shows interest on others,"Jun 25 2017, 10:37 PM",28,https://forum.lowyat.net/Kopitiam/topic/4339430
i only like transformers 5 for 1 thing,"Jun 26 2017, 02:07 PM",28,https://forum.lowyat.net/Kopitiam/topic/4339875
person selected to recite the azan aloud should at,"Jun 26 2017, 04:01 PM",28,https://forum.lowyat.net/Kopitiam/topic/4339974
"""i can't find the perfect woman...oh wait""","Jun 26 2017, 09:15 PM",28,https://forum.lowyat.net/Kopitiam/topic/4340297
Taylor Swift: Spotify Return Made $400k in 1 week,"Jun 26 2017, 09:14 PM",28,https://forum.lowyat.net/Kopitiam/topic/4340296
Texas Jiken,"Jun 26 2017, 08:24 PM",28,https://forum.lowyat.net/Kopitiam/topic/4340262
Will tongsan come and takeover Maybank,"Jun 26 2017, 12:10 AM",28,https://forum.lowyat.net/Kopitiam/topic/4339478
Goh Liu Ying house compound and exp cars! OMG!,"Jun 26 2017, 06:03 PM",28,https://forum.lowyat.net/Kopitiam/topic/4340104
Jun Ji Hyun revealed to be pregnant with 2nd child,"Jun 26 2017, 08:37 PM",28,https://forum.lowyat.net/Kopitiam/topic/4340274
DOUBLE PARK...walk slow slow lol,"Jun 26 2017, 08:10 PM",28,https://forum.lowyat.net/Kopitiam/topic/4340255
Why k females very honest use own drillz as avatar,"Jun 26 2017, 08:44 PM",28,https://forum.lowyat.net/Kopitiam/topic/4340279
Myanmar and Thailand burn drugs in open,"Jun 26 2017, 08:31 PM",29,https://forum.lowyat.net/Kopitiam/topic/4340269
AJIN live action!,"Jun 26 2017, 08:56 PM",29,https://forum.lowyat.net/Kopitiam/topic/4340282
Im quite cukur to be able to,"Jun 25 2017, 11:53 AM",29,https://forum.lowyat.net/Kopitiam/topic/4338786
vaccines,"Jun 26 2017, 08:59 PM",29,https://forum.lowyat.net/Kopitiam/topic/4340283
"Sarawak Report berjaya mengumpul GB30,000","Jun 26 2017, 08:35 PM",29,https://forum.lowyat.net/Kopitiam/topic/4340273
How much of each bank belongs to the government?,"Jun 26 2017, 12:35 AM",29,https://forum.lowyat.net/Kopitiam/topic/4339490
Joined Tindar,"Jun 26 2017, 11:19 AM",29,https://forum.lowyat.net/Kopitiam/topic/4339697
Isteri Curang,"Jun 26 2017, 03:16 AM",29,https://forum.lowyat.net/Kopitiam/topic/4339542
Name with arabic name instead of angmoo,"Jun 26 2017, 10:31 AM",29,https://forum.lowyat.net/Kopitiam/topic/4339626
IS declared war on taliban in Afghanistan.,"Jun 26 2017, 08:23 PM",29,https://forum.lowyat.net/Kopitiam/topic/4340260
What is the feeling of drinking wine after durian?,"Jun 26 2017, 08:33 PM",29,https://forum.lowyat.net/Kopitiam/topic/4340271
Transformers box office,"Jun 26 2017, 03:01 AM",29,https://forum.lowyat.net/Kopitiam/topic/4339538
Building guard held for raping student! OMG!,"Jun 26 2017, 06:00 PM",29,https://forum.lowyat.net/Kopitiam/topic/4340099
Count how many people there,"Jun 26 2017, 06:56 PM",29,https://forum.lowyat.net/Kopitiam/topic/4340171
Jack Ma shares a secret of Alibaba's success,"Jun 25 2017, 12:20 PM",29,https://forum.lowyat.net/Kopitiam/topic/4338818
Only in Sabah...,"Jun 26 2017, 02:58 PM",29,https://forum.lowyat.net/Kopitiam/topic/4339937
yessss finally brought back my mahney back Msia !,"Jun 22 2017, 10:02 PM",29,https://forum.lowyat.net/Kopitiam/topic/4336494
Why MOST people are stubborn...,"Jun 26 2017, 10:28 AM",29,https://forum.lowyat.net/Kopitiam/topic/4339621
Transformers 5,"Jun 26 2017, 07:05 PM",29,https://forum.lowyat.net/Kopitiam/topic/4340182
Statistic of Gemok vs Kurus,"Jun 26 2017, 06:04 PM",29,https://forum.lowyat.net/Kopitiam/topic/4340106
Brown sugar kym?,"Jun 26 2017, 06:26 PM",29,https://forum.lowyat.net/Kopitiam/topic/4340126
Adnan Yaakob: BN Pahang Ketengah Calon PRU14,"Jun 26 2017, 07:18 PM",29,https://forum.lowyat.net/Kopitiam/topic/4340203
Elizabeth Tan Selamat Hari Raya! Ade video!,"Jun 26 2017, 05:56 PM",29,https://forum.lowyat.net/Kopitiam/topic/4340096
Ex-girlfriend,"Jun 26 2017, 12:00 PM",29,https://forum.lowyat.net/Kopitiam/topic/4339748
Salon,"Jun 26 2017, 07:16 PM",29,https://forum.lowyat.net/Kopitiam/topic/4340200
Myvi driba,"Jun 26 2017, 05:48 PM",29,https://forum.lowyat.net/Kopitiam/topic/4340087
Good thing about religion,"Jun 26 2017, 04:58 PM",29,https://forum.lowyat.net/Kopitiam/topic/4340036
Mummy,"Jun 25 2017, 11:37 AM",29,https://forum.lowyat.net/Kopitiam/topic/4338773
I am finally a Singaporkean !,"Feb 17 2014, 01:42 PM",29,https://forum.lowyat.net/Kopitiam/topic/3134281
Where do you download,"Jun 26 2017, 05:34 PM",29,https://forum.lowyat.net/Kopitiam/topic/4340069
FITGEAR malaysia,"Jun 26 2017, 06:31 PM",30,https://forum.lowyat.net/Kopitiam/topic/4340132
Forget to sing up dupe,"Jan 1 2014, 12:56 AM",30,https://forum.lowyat.net/Kopitiam/topic/3084759
What type of phone is this? Pink color de?,"Jun 26 2017, 06:23 PM",30,https://forum.lowyat.net/Kopitiam/topic/4340122
Touch n Go question,"Jun 26 2017, 01:07 PM",30,https://forum.lowyat.net/Kopitiam/topic/4339821
Gender transition,"Jun 26 2017, 03:50 PM",30,https://forum.lowyat.net/Kopitiam/topic/4339971
Kisah seram sejuk di malam sebelum hari raya,"Jun 26 2017, 11:45 AM",30,https://forum.lowyat.net/Kopitiam/topic/4339722
Any mod/staff/admin working tru Raya?,"Jun 26 2017, 05:48 PM",30,https://forum.lowyat.net/Kopitiam/topic/4340086
Top 50 World Street Food Penang Siam Road,"Jun 26 2017, 02:28 PM",30,https://forum.lowyat.net/Kopitiam/topic/4339895
meat bone soup,"Jun 26 2017, 05:30 PM",30,https://forum.lowyat.net/Kopitiam/topic/4340066
rice gives yani the adhesive,"Jun 25 2017, 11:06 PM",30,https://forum.lowyat.net/Kopitiam/topic/4339442
P10 / no trolls,"Jun 26 2017, 05:38 PM",30,https://forum.lowyat.net/Kopitiam/topic/4340074
stupid person park at his own convenience,"Jun 26 2017, 05:07 PM",30,https://forum.lowyat.net/Kopitiam/topic/4340046
I guess it's rape then,"Jun 26 2017, 12:24 AM",30,https://forum.lowyat.net/Kopitiam/topic/4339487
Do u have this kind of relative or not! Pekcek!,"Jun 26 2017, 12:09 PM",30,https://forum.lowyat.net/Kopitiam/topic/4339760
Where got open house tonight?,"Jun 26 2017, 05:17 PM",30,https://forum.lowyat.net/Kopitiam/topic/4340053
2017 lousy big movies so far,"Jun 25 2017, 09:45 PM",30,https://forum.lowyat.net/Kopitiam/topic/4339413
Thailand tallest building (615 m) starting soon,"Jun 26 2017, 02:54 PM",30,https://forum.lowyat.net/Kopitiam/topic/4339932
i cukur my family not lemang rendang type,"Jun 26 2017, 12:45 PM",30,https://forum.lowyat.net/Kopitiam/topic/4339806
facebook app keep giving useless notification,"Jun 26 2017, 04:40 PM",30,https://forum.lowyat.net/Kopitiam/topic/4340015
STEAM SALE Insurgency 85% off. RM3.45 ONLY,"Jun 23 2017, 08:53 AM",30,https://forum.lowyat.net/Kopitiam/topic/4337036
Number pkate holder.,"Jun 24 2017, 11:21 PM",30,https://forum.lowyat.net/Kopitiam/topic/4338533
Life Tip: Always brush your teeth diligently,"Jun 26 2017, 03:51 PM",30,https://forum.lowyat.net/Kopitiam/topic/4339972
I feel mad kena tax,"Jun 26 2017, 02:44 PM",30,https://forum.lowyat.net/Kopitiam/topic/4339918
Colleagues are too good.,"Jun 26 2017, 04:42 PM",30,https://forum.lowyat.net/Kopitiam/topic/4340019
Rate this ramyeon,"Jun 26 2017, 04:40 PM",30,https://forum.lowyat.net/Kopitiam/topic/4340017
My son berlagak,"Jun 26 2017, 04:13 PM",30,https://forum.lowyat.net/Kopitiam/topic/4339987
The Higashi Kitty Band @ Anime Saiko'17 Johor,"Jun 26 2017, 04:17 PM",30,https://forum.lowyat.net/Kopitiam/topic/4339992
What happen now? Another end of the world issue?,"Jun 25 2017, 10:39 AM",30,https://forum.lowyat.net/Kopitiam/topic/4338737
Where to get free TnG cards ?,"Jun 26 2017, 03:32 PM",30,https://forum.lowyat.net/Kopitiam/topic/4339958
/k always say xxx place not for human live 1,"Jun 26 2017, 03:36 PM",30,https://forum.lowyat.net/Kopitiam/topic/4339960
Empire City ice rink will be up and running by Jun,"Jun 26 2017, 04:02 PM",31,https://forum.lowyat.net/Kopitiam/topic/4339975
help me to sale canon AOS 1100D DLSR,"Jun 26 2017, 12:44 PM",31,https://forum.lowyat.net/Kopitiam/topic/4339802
Gaming is the cheapest form of entertainment,"Jun 25 2017, 09:32 PM",31,https://forum.lowyat.net/Kopitiam/topic/4339410
Wan Azizah: Pakatan Harapan Postpones Registration,"Jun 22 2017, 04:00 PM",31,https://forum.lowyat.net/Kopitiam/topic/4336034
BLACKOUT @ IOI City Mall,"Jun 26 2017, 03:36 PM",31,https://forum.lowyat.net/Kopitiam/topic/4339962
Someone Shared Why You Should NOT Go To UTAR or,"Jun 26 2017, 12:32 PM",31,https://forum.lowyat.net/Kopitiam/topic/4339787
Catching BIG FISH in SEWER!,"Jun 26 2017, 10:50 AM",31,https://forum.lowyat.net/Kopitiam/topic/4339643
What does 'lao xiong' mean in chinese?,"Jun 26 2017, 02:25 PM",31,https://forum.lowyat.net/Kopitiam/topic/4339893
Homeless guy on LRT,"Jun 26 2017, 01:55 PM",31,https://forum.lowyat.net/Kopitiam/topic/4339862
Miss Astro result out riao out riao! OMG!,"Jun 26 2017, 09:50 AM",31,https://forum.lowyat.net/Kopitiam/topic/4339600
UBER DRIVER SLASHED!,"Jun 23 2017, 09:00 PM",31,https://forum.lowyat.net/Kopitiam/topic/4337643
Many Malaysians are not only penipu scammers.,"May 20 2017, 04:17 PM",31,https://forum.lowyat.net/Kopitiam/topic/4295300
Anyone know where to buy these type of,"Jun 26 2017, 11:15 AM",31,https://forum.lowyat.net/Kopitiam/topic/4339694
Anyone know of a good office equipment,"Jun 26 2017, 02:41 PM",31,https://forum.lowyat.net/Kopitiam/topic/4339911
Thousands attend Hari Raya open house at Istana,"Jun 26 2017, 01:06 PM",31,https://forum.lowyat.net/Kopitiam/topic/4339818
Tina's movie review - Transformers 5: 1) if you ar,"Jun 25 2017, 08:16 PM",31,https://forum.lowyat.net/Kopitiam/topic/4339385
Gsc e voucher,"Jun 26 2017, 02:11 PM",31,https://forum.lowyat.net/Kopitiam/topic/4339879
Zeti's 'BNM no power' excuse on 1MDB lame at best,"Jun 26 2017, 12:07 PM",31,https://forum.lowyat.net/Kopitiam/topic/4339756
Go To Sarawak CM Hari Raya Open House,"Jun 26 2017, 02:05 PM",31,https://forum.lowyat.net/Kopitiam/topic/4339873
wah.. najib & obama will be going to Bali,"Jun 24 2017, 02:11 PM",31,https://forum.lowyat.net/Kopitiam/topic/4338176
Which soalan paling tabouli,"Jun 26 2017, 01:21 PM",31,https://forum.lowyat.net/Kopitiam/topic/4339829
CNN headline - ISIS' new frontier,"Jun 26 2017, 01:15 PM",31,https://forum.lowyat.net/Kopitiam/topic/4339827
Y IDF chick mostly kiut kiut?,"Jun 13 2017, 03:56 PM",31,https://forum.lowyat.net/Kopitiam/topic/4324825
Hitz FM puerto rico song,"Jun 2 2017, 04:01 PM",31,https://forum.lowyat.net/Kopitiam/topic/4307905
bangalasia hari raya,"Jun 26 2017, 11:15 AM",31,https://forum.lowyat.net/Kopitiam/topic/4339693
World Taekwondo Federation (WTF) changes name,"Jun 25 2017, 09:51 AM",31,https://forum.lowyat.net/Kopitiam/topic/4338713
My in laws topkek,"Jun 26 2017, 11:41 AM",31,https://forum.lowyat.net/Kopitiam/topic/4339716
Mysterious missed call,"Jun 26 2017, 11:45 AM",31,https://forum.lowyat.net/Kopitiam/topic/4339725
"Jadi, hari raya i dun hv much idea","Jun 26 2017, 12:12 PM",31,https://forum.lowyat.net/Kopitiam/topic/4339764
WU KONG Trailer (2017),"Jun 26 2017, 12:32 PM",31,https://forum.lowyat.net/Kopitiam/topic/4339788
OnePlus 5 coming to MY pretty soon,"Jun 26 2017, 12:33 PM",32,https://forum.lowyat.net/Kopitiam/topic/4339791
Entry cheap road bike,"Apr 22 2017, 11:15 PM",32,https://forum.lowyat.net/Kopitiam/topic/4272958
"Its raya, everywhere pack of ppl","Jun 26 2017, 01:22 AM",32,https://forum.lowyat.net/Kopitiam/topic/4339508
AirAsia plane shaking like washing machine,"Jun 25 2017, 05:08 PM",32,https://forum.lowyat.net/Kopitiam/topic/4339222
Italian's former PM likes Melania.,"Jun 24 2017, 04:41 PM",32,https://forum.lowyat.net/Kopitiam/topic/4338267
SITI BOWLING,"Jun 25 2017, 09:39 PM",32,https://forum.lowyat.net/Kopitiam/topic/4339412
Who is working today?,"Jun 26 2017, 10:50 AM",32,https://forum.lowyat.net/Kopitiam/topic/4339645
Gov't's remarks on DOJ suit do not hold water,"Jun 26 2017, 12:22 PM",32,https://forum.lowyat.net/Kopitiam/topic/4339779
Honda HRV or Honda Civic?,"Jun 26 2017, 12:07 PM",32,https://forum.lowyat.net/Kopitiam/topic/4339757
Where to find groups to travel to Japan,"Jun 26 2017, 12:16 PM",32,https://forum.lowyat.net/Kopitiam/topic/4339773
"Lol, King's bun price is crazier than lavender","Jun 26 2017, 11:31 AM",32,https://forum.lowyat.net/Kopitiam/topic/4339708
Man fucuk ass,"Jun 26 2017, 11:10 AM",32,https://forum.lowyat.net/Kopitiam/topic/4339686
Delete,"Jun 26 2017, 12:01 PM",32,https://forum.lowyat.net/Kopitiam/topic/4339749
Should i fap?,"Jun 24 2017, 10:13 PM",32,https://forum.lowyat.net/Kopitiam/topic/4338492
everest dupe looking for love?,"Jun 26 2017, 01:17 AM",32,https://forum.lowyat.net/Kopitiam/topic/4339506
Celebrate Raya In,"Jun 26 2017, 09:40 AM",32,https://forum.lowyat.net/Kopitiam/topic/4339594
Custom casing,"Jun 26 2017, 01:39 AM",32,https://forum.lowyat.net/Kopitiam/topic/4339515
wta SMK Bandar Utama 3 or BU3 school,"Dec 7 2015, 12:26 PM",32,https://forum.lowyat.net/Kopitiam/topic/3798021
My ungrateful friend betrayed me,"Jun 4 2017, 08:45 PM",32,https://forum.lowyat.net/Kopitiam/topic/4311705
i dun tell my parents how much i earn,"Jun 25 2017, 10:31 PM",32,https://forum.lowyat.net/Kopitiam/topic/4339426
Boeing 737 family now 50 years old,"Jun 26 2017, 11:53 AM",32,https://forum.lowyat.net/Kopitiam/topic/4339736
After the wake up call..,"Jun 26 2017, 08:58 AM",32,https://forum.lowyat.net/Kopitiam/topic/4339578
Actor Steps Out with Girlfriend in First Sighting.,"Jun 26 2017, 11:42 AM",32,https://forum.lowyat.net/Kopitiam/topic/4339719
Pinoy got good musical genetics?,"Jun 26 2017, 11:26 AM",32,https://forum.lowyat.net/Kopitiam/topic/4339702
MH will focus on China after axing Darwin route,"Jun 26 2017, 11:29 AM",32,https://forum.lowyat.net/Kopitiam/topic/4339706
wented sing k with amoiz,"Jun 23 2017, 11:12 AM",32,https://forum.lowyat.net/Kopitiam/topic/4337136
TPM: Ribuan Ke Rumah Terbuka PM Bukti,"Jun 26 2017, 08:32 AM",32,https://forum.lowyat.net/Kopitiam/topic/4339575
"Overload boat sank, 9 dead","Jun 26 2017, 10:14 AM",32,https://forum.lowyat.net/Kopitiam/topic/4339614
Snapchat update new feature,"Jun 26 2017, 12:56 AM",32,https://forum.lowyat.net/Kopitiam/topic/4339499
---,"Jun 26 2017, 10:13 AM",32,https://forum.lowyat.net/Kopitiam/topic/4339613
Why dun do this?,"Jun 26 2017, 09:14 AM",33,https://forum.lowyat.net/Kopitiam/topic/4339584
Ribuan hadir bukti sokongan kepada Najib - Zahid,"Jun 26 2017, 01:01 AM",33,https://forum.lowyat.net/Kopitiam/topic/4339500
Multiple Signs of Malaysia Property Bubble V20,"Dec 23 2016, 04:32 PM",33,https://forum.lowyat.net/Kopitiam/topic/4156178
It's such a lovely morning,"Jun 26 2017, 07:50 AM",33,https://forum.lowyat.net/Kopitiam/topic/4339564
Six hurt as car hits crowd,"Jun 26 2017, 08:23 AM",33,https://forum.lowyat.net/Kopitiam/topic/4339572
Recommend myvi spark plug,"Jun 25 2017, 03:49 PM",33,https://forum.lowyat.net/Kopitiam/topic/4339083
Mesti kau bangun awal ni sebab,"Jun 26 2017, 05:42 AM",33,https://forum.lowyat.net/Kopitiam/topic/4339555
Where can I buy this?,"Jun 26 2017, 07:01 AM",33,https://forum.lowyat.net/Kopitiam/topic/4339558
What flowers do girls like?,"Jun 25 2017, 11:53 PM",33,https://forum.lowyat.net/Kopitiam/topic/4339470
Pay RM200 for old RM1 paper money...SCAM?!,"Jun 22 2017, 07:25 PM",33,https://forum.lowyat.net/Kopitiam/topic/4336321
Great! Roght before i sleep,"Jun 26 2017, 01:22 AM",33,https://forum.lowyat.net/Kopitiam/topic/4339507
Malaysia top news share on WhatsApp,"Jun 26 2017, 02:36 AM",33,https://forum.lowyat.net/Kopitiam/topic/4339531
WTF general assembly,"Jun 25 2017, 09:11 PM",33,https://forum.lowyat.net/Kopitiam/topic/4339403
Penang expert please come here,"Jun 26 2017, 02:16 AM",33,https://forum.lowyat.net/Kopitiam/topic/4339527
HGGggh melody Ketiak hgggg,"Jun 16 2017, 03:27 PM",33,https://forum.lowyat.net/Kopitiam/topic/4328259
